title,source,date,url,abstract,matched_topics,relevance_score,novelty_score,why_it_matters,category,doi,arxiv_id,pubmed_id
SPD-RAG: Sub-Agent Per Document Retrieval-Augmented Generation,arXiv,2026-03-09T12:46:32+00:00,http://arxiv.org/abs/2603.08329v1,"Answering complex, real-world queries often requires synthesizing facts scattered across vast document corpora. In these settings, standard retrieval-augmented generation (RAG) pipelines suffer from incomplete evidence coverage, while long-context large language models (LLMs) struggle to reason reliably over massive inputs. We introduce SPD-RAG, a hierarchical multi-agent framework for exhaustive cross-document question answering that decomposes the problem along the document axis. Each document is processed by a dedicated document-level agent operating only on its own content, enabling focused retrieval, while a coordinator dispatches tasks to relevant agents and aggregates their partial answers. Agent outputs are synthesized by merging partial answers through a token-bounded synthesis layer (which supports recursive map-reduce for massive corpora). This document-level specialization with centralized fusion improves scalability and answer quality in heterogeneous multidocument settings while yielding a modular, extensible retrieval pipeline. On the LOONG benchmark (EMNLP 2024) for long-context multi-document QA, SPD-RAG achieves an Avg Score of 58.1 (GPT-5 evaluation), outperforming Normal RAG (33.0) and Agentic RAG (32.8) while using only 38% of the API cost of a full-context baseline (68.0).",foundation_model_agent,5.45,7.54,这篇工作更像方法创新，可能直接关联 metagenomics、long-read 或 pathogen identification 流程优化。,methods,,2603.08329v1,
RexDrug: Reliable Multi-Drug Combination Extraction through Reasoning-Enhanced LLMs,arXiv,2026-03-09T09:47:25+00:00,http://arxiv.org/abs/2603.08166v1,"Automated Drug Combination Extraction (DCE) from large-scale biomedical literature is crucial for advancing precision medicine and pharmacological research. However, existing relation extraction methods primarily focus on binary interactions and struggle to model variable-length n-ary drug combinations, where complex compatibility logic and distributed evidence need to be considered. To address these limitations, we propose RexDrug, an end-to-end reasoning-enhanced relation extraction framework for n-ary drug combination extraction based on large language models. RexDrug adopts a two-stage training strategy. First, a multi-agent collaborative mechanism is utilized to automatically generate high-quality expert-like reasoning traces for supervised fine-tuning. Second, reinforcement learning with a multi-dimensional reward function specifically tailored for DCE is applied to further refine reasoning quality and extraction accuracy. Extensive experiments on the DrugComb dataset show that RexDrug consistently outperforms state-of-the-art baselines for n-ary extraction. Additional evaluation on the DDI13 corpus confirms its generalizability to binary drugdrug interaction tasks. Human expert assessment and automatic reasoning metrics further indicates that RexDrug produces coherent medical reasoning while accurately identifying complex therapeutic regimens. These results establish RexDrug as a scalable and reliable solution for complex biomedical relation extraction from unstructured text. The source code and data are available at https://github.com/DUTIR-BioNLP/RexDrug",foundation_model_agent,5.45,7.04,这篇工作偏数据集或基准构建，适合判断是否能作为病原组学训练或评测资源。,dataset,,2603.08166v1,
EvoScientist: Towards Multi-Agent Evolving AI Scientists for End-to-End Scientific Discovery,arXiv,2026-03-09T09:07:19+00:00,http://arxiv.org/abs/2603.08127v1,"The increasing adoption of Large Language Models (LLMs) has enabled AI scientists to perform complex end-to-end scientific discovery tasks requiring coordination of specialized roles, including idea generation and experimental execution. However, most state-of-the-art AI scientist systems rely on static, hand-designed pipelines and fail to adapt based on accumulated interaction histories. As a result, these systems overlook promising research directions, repeat failed experiments, and pursue infeasible ideas. To address this, we introduce EvoScientist, an evolving multi-agent AI scientist framework that continuously improves research strategies through persistent memory and self-evolution. EvoScientist comprises three specialized agents: a Researcher Agent (RA) for scientific idea generation, an Engineer Agent (EA) for experiment implementation and execution, and an Evolution Manager Agent (EMA) that distills insights from prior interactions into reusable knowledge. EvoScientist contains two persistent memory modules: (i) an ideation memory, which summarizes feasible research directions from top-ranked ideas while recording previously unsuccessful directions; and (ii) an experimentation memory, which captures effective data processing and model training strategies derived from code search trajectories and best-performing implementations. These modules enable the RA and EA to retrieve relevant prior strategies, improving idea quality and code execution success rates over time. Experiments show that EvoScientist outperforms 7 open-source and commercial state-of-the-art systems in scientific idea generation, achieving higher novelty, feasibility, relevance, and clarity via automatic and human evaluation. EvoScientist also substantially improves code execution success rates through multi-agent evolution, demonstrating persistent memory's effectiveness for end-to-end scientific discovery.",foundation_model_agent,5.45,6.43,这篇工作偏基础模型/Agent方向，可能影响病原检测任务的建模上限，值得关注其任务定义与评测设计。,foundation_model,,2603.08127v1,
NC-Bench: An LLM Benchmark for Evaluating Conversational Competence,arXiv,2026-01-10T04:57:24+00:00,http://arxiv.org/abs/2601.06426v2,"The Natural Conversation Benchmark (NC-Bench) introduces a new approach to evaluating the general conversational competence of large language models (LLMs). Unlike prior benchmarks that focus on the content of model behavior, NC-Bench focuses on the form and structure of natural conversation. Grounded in the IBM Natural Conversation Framework (NCF), NC-Bench comprises three distinct sets: (1) the basic set evaluates fundamental sequence management practices, such as answering inquiries, repairing responses, and closing conversational pairs; (2) the retrieval-augmented generation (RAG) set applies the same sequence management patterns as the first set but incorporates information-seeking via RAG; (3) the complex request set extends to requests involving more intricate sequence management patterns. Each set tests a model's ability to produce contextually appropriate conversational actions in response to characteristic interaction patterns. Initial evaluations across six open-source models and 14 interaction patterns show that models perform well on basic answering tasks, struggle more with repair tasks (especially repeat), have mixed performance on closing sequences, and find complex multi-turn requests most challenging. By operationalizing fundamental principles of human conversation, NC-Bench provides a lightweight, extensible, and theory-grounded framework for assessing and improving the conversational abilities of LLMs beyond topical or task-specific benchmarks.",foundation_model_agent,5.45,6.0,这篇工作更像方法创新，可能直接关联 metagenomics、long-read 或 pathogen identification 流程优化。,methods,,2601.06426v2,
HLER: Human-in-the-Loop Economic Research via Multi-Agent Pipelines for Empirical Discovery,arXiv,2026-03-08T03:40:34+00:00,http://arxiv.org/abs/2603.07444v1,"Large language models (LLMs) have enabled agent-based systems that aim to automate scientific research workflows. Most existing approaches focus on fully autonomous discovery, where AI systems generate research ideas, conduct analyses, and produce manuscripts with minimal human involvement. However, empirical research in economics and the social sciences poses additional constraints: research questions must be grounded in available datasets, identification strategies require careful design, and human judgment remains essential for evaluating economic significance. We introduce HLER (Human-in-the-Loop Economic Research), a multi-agent architecture that supports empirical research automation while preserving critical human oversight. The system orchestrates specialized agents for data auditing, data profiling, hypothesis generation, econometric analysis, manuscript drafting, and automated review. A key design principle is dataset-aware hypothesis generation, where candidate research questions are constrained by dataset structure, variable availability, and distributional diagnostics, reducing infeasible or hallucinated hypotheses. HLER further implements a two-loop architecture: a question quality loop that screens and selects feasible hypotheses, and a research revision loop where automated review triggers re-analysis and manuscript revision. Human decision gates are embedded at key stages, allowing researchers to guide the automated pipeline. Experiments on three empirical datasets show that dataset-aware hypothesis generation produces feasible research questions in 87% of cases (versus 41% under unconstrained generation), while complete empirical manuscripts can be produced at an average API cost of $0.8-$1.5 per run. These results suggest that Human-AI collaborative pipelines may provide a practical path toward scalable empirical research.",foundation_model_agent,5.45,6.0,这篇工作偏基础模型/Agent方向，可能影响病原检测任务的建模上限，值得关注其任务定义与评测设计。,foundation_model,,2603.07444v1,
InterMind: Doctor-Patient-Family Interactive Depression Assessment Empowered by Large Language Models,arXiv,2024-09-23T10:23:19+00:00,http://arxiv.org/abs/2409.14878v2,"Depression poses significant challenges to patients and healthcare organizations, necessitating efficient assessment methods. Existing paradigms typically focus on a patient-doctor way that overlooks multi-role interactions, such as family involvement in the evaluation and caregiving process. Moreover, current automatic depression detection (ADD) methods usually model depression detection as a classification or regression task, lacking interpretability for the decision-making process. To address these issues, we developed InterMind, a doctor-patient-family interactive depression assessment system empowered by large language models (LLMs). Our system enables patients and families to contribute descriptions, generates assistive diagnostic reports for doctors, and provides actionable insights, improving diagnostic precision and efficiency. To enhance LLMs' performance in psychological counseling and diagnostic interpretability, we integrate retrieval-augmented generation (RAG) and chain-of-thoughts (CoT) techniques for data augmentation, which mitigates the hallucination issue of LLMs in specific scenarios after instruction fine-tuning. Quantitative experiments and professional assessments by clinicians validate the effectiveness of our system.",foundation_model_agent,5.45,5.5,这篇工作更接近临床/监测落地，适合评估其对快速识别、预警或治疗辅助的实际价值。,clinical_application,,2409.14878v2,
TokMem: One-Token Procedural Memory for Large Language Models,arXiv,2025-10-01T02:51:58+00:00,http://arxiv.org/abs/2510.00444v2,"Large language models are typically controlled via prompts, which must be repeatedly re-processed for every new query and are difficult to reuse modularly. We introduce TokMem, a procedural memory framework that compiles each reusable task procedure into a single trainable memory token. Each token serves as both a procedure index and a generation control signal that steers generation, enabling targeted behaviors with constant-size overhead. TokMem keeps the backbone LLM frozen and stores procedural knowledge entirely in these dedicated units, so new procedures can be added continually without interfering with existing ones. We evaluate TokMem on two settings: atomic recall over 1,000 Super-Natural Instructions tasks and compositional recall on multi-step function-calling. Our results show that TokMem consistently outperforms retrieval-augmented prompting while avoiding repeated context overhead. Moreover, it matches or exceeds parameter-efficient fine-tuning with substantially fewer trainable parameters.",foundation_model_agent,5.45,5.5,这篇工作偏基础模型/Agent方向，可能影响病原检测任务的建模上限，值得关注其任务定义与评测设计。,foundation_model,,2510.00444v2,
KCoEvo: A Knowledge Graph Augmented Framework for Evolutionary Code Generation,arXiv,2026-03-08T10:39:48+00:00,http://arxiv.org/abs/2603.07581v1,"Code evolution is inevitable in modern software development. Changes to third-party APIs frequently break existing code and complicate maintenance, posing practical challenges for developers. While large language models (LLMs) have shown promise in code generation, they struggle to reason without a structured representation of these evolving relationships, often leading them to produce outdated APIs or invalid outputs. In this work, we propose a knowledge graph-augmented framework that decomposes the migration task into two synergistic stages: evolution path retrieval and path-informed code generation. Our approach constructs static and dynamic API graphs to model intra-version structures and cross-version transitions, enabling structured reasoning over API evolution. Both modules are trained with synthetic supervision automatically derived from real-world API diffs, ensuring scalability and minimal human effort. Extensive experiments across single-package and multi-package benchmarks demonstrate that our framework significantly improves migration accuracy, controllability, and execution success over standard LLM baselines. The source code and datasets are available at: https://github.com/kangjz1203/KCoEvo.",foundation_model_agent,4.75,6.25,这篇工作更像方法创新，可能直接关联 metagenomics、long-read 或 pathogen identification 流程优化。,methods,,2603.07581v1,
Neuro-Symbolic Financial Reasoning via Deterministic Fact Ledgers and Adversarial Low-Latency Hallucination Detector,arXiv,2026-03-04T22:55:16+00:00,http://arxiv.org/abs/2603.04663v2,"Standard Retrieval-Augmented Generation (RAG) architectures fail in high-stakes financial domains due to two fundamental limitations: the inherent arithmetic incompetence of Large Language Models (LLMs) and the distributional semantic conflation of dense vector retrieval (e.g., mapping ""Net Income"" to ""Net Sales"" due to contextual proximity). In deterministic domains, a 99% accuracy rate yields 0% operational trust. To achieve zero-hallucination financial reasoning, we introduce the Verifiable Numerical Reasoning Agent (VeNRA). VeNRA shifts the RAG paradigm from retrieving probabilistic text to retrieving deterministic variables via a strictly typed Universal Fact Ledger (UFL). We mathematically bound this ledger using a novel Double-Lock Grounding algorithm. Coupled with deterministic Python execution, this neuro-symbolic routing compresses systemic hallucination rates to a near-zero 1.2%. Recognising that upstream parsing anomalies inevitably occur, we introduce the VeNRA Sentinel: a 3-billion parameter SLM trained to forensically audit candidate using a single-token inference budget with optional post-hoc reasoning. To train the Sentinel, we steer away from traditional hallucination datasets in favour of Adversarial Simulation, programmatically sabotaging financial records to simulate Ecological Errors. The compact Sentinel consequently outperforms 70B+ frontier models in error detection. Through Loss Dilution phenomenon in Reverse-CoT training, we present a novel Micro-Chunking loss algorithm to stabilise gradients under extreme verdict penalisation, yielding a 28x latency speedup without sacrificing forensic rigor.",foundation_model_agent,4.75,5.75,这篇工作偏基础模型/Agent方向，可能影响病原检测任务的建模上限，值得关注其任务定义与评测设计。,foundation_model,,2603.04663v2,
Benchmarking Large Language Models for Quebec Insurance: From Closed-Book to Retrieval-Augmented Generation,arXiv,2026-03-08T22:02:32+00:00,http://arxiv.org/abs/2603.07825v1,"The digitization of insurance distribution in the Canadian province of Quebec, accelerated by legislative changes such as Bill 141, has created a significant ""advice gap"", leaving consumers to interpret complex financial contracts without professional guidance. While Large Language Models (LLMs) offer a scalable solution for automated advisory services, their deployment in high-stakes domains hinges on strict legal accuracy and trustworthiness. In this paper, we address this challenge by introducing AEPC-QA, a private gold-standard benchmark of 807 multiple-choice questions derived from official regulatory certification (paper) handbooks. We conduct a comprehensive evaluation of 51 LLMs across two paradigms: closed-book generation and retrieval-augmented generation (RAG) using a specialized corpus of Quebec insurance documents. Our results reveal three critical insights: 1) the supremacy of inference-time reasoning, where models leveraging chain-of-thought processing (e.g. o3-2025-04-16, o1-2024-12-17) significantly outperform standard instruction-tuned models; 2) RAG acts as a knowledge equalizer, boosting the accuracy of models with weak parametric knowledge by over 35 percentage points, yet paradoxically causing ""context distraction"" in others, leading to catastrophic performance regressions; and 3) a ""specialization paradox"", where massive generalist models consistently outperform smaller, domain-specific French fine-tuned ones. These findings suggest that while current architectures approach expert-level proficiency (~79%), the instability introduced by external context retrieval necessitates rigorous robustness calibration before autonomous deployment is viable.",foundation_model_agent,4.75,5.75,这篇工作偏数据集或基准构建，适合判断是否能作为病原组学训练或评测资源。,dataset,,2603.07825v1,
Position: LLMs Must Use Functor-Based and RAG-Driven Bias Mitigation for Fairness,arXiv,2026-03-07T22:40:44+00:00,http://arxiv.org/abs/2603.07368v1,"Biases in large language models (LLMs) often manifest as systematic distortions in associations between demographic attributes and professional or social roles, reinforcing harmful stereotypes across gender, ethnicity, and geography. This position paper advocates for addressing demographic and gender biases in LLMs through a dual-pronged methodology, integrating category-theoretic transformations and retrieval-augmented generation (RAG). Category theory provides a rigorous, structure-preserving mathematical framework that maps biased semantic domains to unbiased canonical forms via functors, ensuring bias elimination while preserving semantic integrity. Complementing this, RAG dynamically injects diverse, up-to-date external knowledge during inference, directly countering ingrained biases within model parameters. By combining structural debiasing through functor-based mappings and contextual grounding via RAG, we outline a comprehensive framework capable of delivering equitable and fair model outputs. Our synthesis of the current literature validates the efficacy of each approach individually, while addressing potential critiques demonstrates the robustness of this integrated strategy. Ensuring fairness in LLMs, therefore, demands both the mathematical rigor of category-theoretic transformations and the adaptability of retrieval augmentation.",foundation_model_agent,4.75,5.25,这篇工作更像方法创新，可能直接关联 metagenomics、long-read 或 pathogen identification 流程优化。,methods,,2603.07368v1,
"SoK: Agentic Retrieval-Augmented Generation (RAG): Taxonomy, Architectures, Evaluation, and Research Directions",arXiv,2026-03-07T23:38:57+00:00,http://arxiv.org/abs/2603.07379v1,"Retrieval-Augmented Generation (RAG) systems are increasingly evolving into agentic architectures where large language models autonomously coordinate multi-step reasoning, dynamic memory management, and iterative retrieval strategies. Despite rapid industrial adoption, current research lacks a systematic understanding of Agentic RAG as a sequential decision-making system, leading to highly fragmented architectures, inconsistent evaluation methodologies, and unresolved reliability risks. This Systematization of Knowledge (SoK) paper provides the first unified framework for understanding these autonomous systems. We formalize agentic retrieval-generation loops as finite-horizon partially observable Markov decision processes, explicitly modeling their control policies and state transitions. Building upon this formalization, we develop a comprehensive taxonomy and modular architectural decomposition that categorizes systems by their planning mechanisms, retrieval orchestration, memory paradigms, and tool-invocation behaviors. We further analyze the critical limitations of traditional static evaluation practices and identify severe systemic risks inherent to autonomous loops, including compounding hallucination propagation, memory poisoning, retrieval misalignment, and cascading tool-execution vulnerabilities. Finally, we outline key doctoral-scale research directions spanning stable adaptive retrieval, cost-aware orchestration, formal trajectory evaluation, and oversight mechanisms, providing a definitive roadmap for building reliable, controllable, and scalable agentic retrieval systems.",foundation_model_agent,4.75,5.25,这篇工作更像方法创新，可能直接关联 metagenomics、long-read 或 pathogen identification 流程优化。,methods,,2603.07379v1,
Application of large language models to the annotation of cell lines and mouse strains in genomics data,bioRxiv,2026-03-07T00:00:00+00:00,https://www.bioRxiv.org/content/10.1101/10.64898/2026.03.05.709906v1,"Accurate, consistent and comprehensive metadata are essential for the reuse of functional genomics data deposited in repositories such as the Gene Expression Omnibus (GEO), however, achieving this often requires careful manual curation that is time-consuming, costly and prone to errors. In this paper, we evaluate the performance of Large Language Models (LLMs), specifically OpenAI's GPT-4o, as an assistive tool for entity-to-ontology annotation of two commonly encountered descriptors in transcriptomic experiments - mouse strains and cell lines. Using over 9,000 manually curated experiments from the Gemma database and over 5,000 associated journal articles, we assess the model's ability to identify relevant free-text entries and map them to appropriate ontology terms. Using zero-shot prompting and retrieval-augmented generation (RAG) to incorporate domain-specific ontology knowledge, GPT-4o correctly annotated 77% of mouse strain and 59% of cell line experiments, and uncovered manual curation errors in Gemma for over 200 experiments. GPT-4o substantially outperformed a regular expression-based string-matching method, which correctly annotated only 6% of mouse strain experiments due to low precision. Model errors often arose from typographical mistakes or inconsistent naming in the GEO record or publication, and resembled those made by human curators. Along with annotations, our approach requests that the model output supporting context and quotes from the sources. These were typically accurate and enabled rapid curator verification. These findings suggest that LLMs are not ready to fully replace manual curators, but can already effectively support them. A human-in-the-loop workflow, in which LLM's annotations are provided to human curators for validation, may improve the efficiency and quality of large-scale biomedical metadata curation.",foundation_model_agent,6.45,0.5,这篇工作更像方法创新，可能直接关联 metagenomics、long-read 或 pathogen identification 流程优化。,methods,10.64898/2026.03.05.709906,,
