title,source,date,url,abstract,abstract_zh,matched_topics,relevance_score,novelty_score,why_it_matters,analysis_zh,category,doi,arxiv_id,pubmed_id
"HViLM: A Foundation Model for Viral Genomics Enables Multi-Task Prediction of Pathogenicity, Transmissibility, and Host Tropism",bioRxiv,2026-03-20T00:00:00+00:00,https://www.biorxiv.org/content/10.64898/2026.03.18.712700v1,"Motivation: The emergence of novel viral pathogens poses critical threats to global health, yet current computational approaches for viral risk assessment are predominantly virus-specific and require extensive retraining for each new threat. Computational methods for rapid characterization of emerging viruses across multiple epidemiologically relevant dimensions--pathogenicity, host tropism, and transmissibility--are urgently needed to inform public health responses and guide experimental prioritization. Results: We present HViLM (Human Virome Language Model), the first foundation model for pan-viral genomic analysis through continued pre-training of DNABERT-2 on 5 million non-redundant viral sequences (MMseqs2-clustered from 25 million chunks at 80% identity) spanning 9,000 species across 45+ viral families from the VIRION database. We introduce the Human Virome Understanding Evaluation (HVUE) benchmark comprising seven curated datasets across three prediction tasks: pathogenicity classification, host tropism prediction, and transmissibility assessment. Through parameter-efficient fine-tuning with LoRA, HViLM achieves state-of-the-art performance with average accuracies of 95.32% for pathogenicity, 96.25% for host tropism, and 97.36% for transmissibility assessment. The model demonstrates robust cross-family generalization, substantially outperforming sequence-similarity baselines and general genomic foundation models. Attention-based interpretability analysis reveals that HViLM captures biologically meaningful pathogenicity determinants through molecular mimicry of host regulatory elements, including convergent evolution of eight independent sequences targeting Interferon Regulatory Factor 1 (Irf1) for immune evasion. Availability: The HVUE benchmark datasets, training scripts, and complete implementation are publicly available at https://github.com/duttaprat/HViLM . Pre-trained HViLM-base model weights and fine-tuned task-specific variants are available on Hugging Face at https://huggingface.co/duttaprat/HViLM-base .",,pathogenomics;sequencing_bioinformatics;foundation_model_agent,10.0,7.25,这篇工作偏基础模型/Agent方向，可能影响病原检测任务的建模上限，值得关注其任务定义与评测设计。,,foundation_model,10.64898/2026.03.18.712700,,
BioReason-Pro: Advancing Protein Function Prediction with Multimodal Biological Reasoning,bioRxiv,2026-03-20T00:00:00+00:00,https://www.biorxiv.org/content/10.64898/2026.03.19.712954v1,"Protein function annotation is fundamental to understanding biological mechanisms, designing therapeutics, and advancing biomedical research. Current computational methods either rely on shallow sequence similarity or treat function prediction as isolated classification tasks, failing to capture the integrative reasoning across sequence, structure, domains, and interactions that expert biologists perform to infer function. We introduce BioReason-Pro, the first multimodal reasoning large language model (LLM) for protein function prediction that integrates protein embeddings with biological context to generate structured reasoning traces. A key input into BioReason-Pro is the set of GO term predictions made by GO-GPT, our autoregressive transformer that captures hierarchical and cross-aspect dependencies of GO terms. BioReason-Pro is trained via supervised fine-tuning on synthetic reasoning traces generated by GPT-5 for over 130K proteins and further optimized through reinforcement learning. It achieves 73.6% Fmax on GO term prediction and an LLM judge score of 8/10 on functional summaries, substantially outperforming previous methods. Evaluations with human protein experts show that BioReason-Pro annotations are preferred over ground truth UniProt annotations in 79% of cases. Remarkably, BioReason-Pro de novo predicted experimentally confirmed binding partners with per-residue attention localizing to the exact contact residues resolved in cryo-EM structures of those complexes. Together, GO-GPT and BioReason-Pro establish a framework for protein function prediction that combines precise ontology modeling with interpretable biological reasoning.",,foundation_model_agent,8.9,6.2,这篇工作偏基础模型/Agent方向，可能影响病原检测任务的建模上限，值得关注其任务定义与评测设计。,,foundation_model,10.64898/2026.03.19.712954,,
Designing mRNA coding sequence via multimodal reverse translation language modeling with Pro2RNA,bioRxiv,2026-03-20T00:00:00+00:00,https://www.biorxiv.org/content/10.64898/2026.03.18.712790v1,"mRNA coding sequence design is a critical component in the development of mRNA vaccines, nucleic acid therapeutics, and heterologous gene expression systems. While large language models have recently been successfully applied to protein design and RNA modeling, designing optimal mRNA coding sequences for a given protein, particularly in a species-specific manner, remains a major challenge. Here, we present Pro2RNA, a multimodal reverse-translation language model that generates mRNA coding sequences from their corresponding protein sequences while explicitly conditioning on host organism taxonomy information. Pro2RNA integrates multiple pretrained language models across different modalities, including ESM2 for protein representation, SciBERT for taxonomy understanding, and a generative RNA language model for mRNA codon-level sequence generation. By training on mRNA-protein pairs from eukaryote and bacteria datasets respectively, Pro2RNA learns species-dependent genetic codes and codon usage patterns, enabling the generation of host-adapted and natural-like mRNA coding sequences. Across multiple benchmark evaluations, Pro2RNA matches or surpasses existing optimization methods, demonstrating its potential as a powerful and flexible framework for species-aware mRNA coding sequence design.",,foundation_model_agent,8.5,6.75,这篇工作更像方法创新，可能直接关联 metagenomics、long-read 或 pathogen identification 流程优化。,,methods,10.64898/2026.03.18.712790,,
CliPepPI: Scalable prediction of domain-peptide specificityusing contrastive learning,bioRxiv,2026-03-20T00:00:00+00:00,https://www.biorxiv.org/content/10.64898/2026.03.18.712595v1,"Domain-peptide interactions mediate a significant fraction of cellular protein networks, yet accurately predicting their specificity remains challenging. Peptide motifs typically have short, fuzzy sequence profiles, and their interactions are often weak and transient, limiting the size, coverage, and quality of experimentally validated domain-peptide datasets. Since true non-binders are rarely known, constructing negative examples often introduces bias. While structure-based prediction methods can achieve high accuracy, they are computationally demanding and difficult to scale to the proteome level. We introduce CLIPepPI, a dual-encoder model that leverages contrastive learning to embed domains and peptides into a shared space directly from sequence. Both encoders are initialized from a protein language model (ESM-C) and fine-tuned using lightweight LoRA adapters, enabling parameter-efficient training on positive pairs alone. To overcome data scarcity, we augment ~3K protein-peptide complexes from PPI3D with ~150K domain-peptide pairs derived from protein-protein interfaces. CLIPepPI further injects structural information by marking interface residues in the domain sequence, thus guiding the encoders toward binding regions and linking sequence-level learning with structural context. Competitive performance is achieved across three independent benchmarks: domain-peptide complexes from PPI3D, large-scale phage-library data from ProP-PD, and a curated dataset of nuclear export signal (NES) sequences. We demonstrate scalability and generalization through two applications: (i) proteome-wide NES scanning, and (ii) variant-effect prediction, where score changes in domain-peptide interactions between wild-type and mutant sequences discriminate pathogenic from benign variants. Together, CLIPepPI offers a scalable, structure-informed model for predicting domain-peptide specificity and generating meaningful embeddings suited for large-scale proteomic analyses. CLIPepPI is available at: https://bio3d.cs.huji.ac.il/webserver/clipeppi/.",,sequencing_bioinformatics;foundation_model_agent,7.65,6.25,这篇工作偏数据集或基准构建，适合判断是否能作为病原组学训练或评测资源。,,dataset,10.64898/2026.03.18.712595,,
Grounded Multimodal Retrieval-Augmented Drafting of Radiology Impressions Using Case-Based Similarity Search,arXiv,2026-03-18T14:25:50+00:00,http://arxiv.org/abs/2603.17765v1,"Automated radiology report generation has gained increasing attention with the rise of deep learning and large language models. However, fully generative approaches often suffer from hallucinations and lack clinical grounding, limiting their reliability in real-world workflows. In this study, we propose a multimodal retrieval-augmented generation (RAG) system for grounded drafting of chest radiograph impressions. The system combines contrastive image-text embeddings, case-based similarity retrieval, and citation-constrained draft generation to ensure factual alignment with historical radiology reports. A curated subset of the MIMIC-CXR dataset was used to construct a multimodal retrieval database. Image embeddings were generated using CLIP encoders, while textual embeddings were derived from structured impression sections. A fusion similarity framework was implemented using FAISS indexing for scalable nearest-neighbor retrieval. Retrieved cases were used to construct grounded prompts for draft impression generation, with safety mechanisms enforcing citation coverage and confidence-based refusal. Experimental results demonstrate that multimodal fusion significantly improves retrieval performance compared to image-only retrieval, achieving Recall@5 above 0.95 on clinically relevant findings. The grounded drafting pipeline produces interpretable outputs with explicit citation traceability, enabling improved trustworthiness compared to conventional generative approaches. This work highlights the potential of retrieval-augmented multimodal systems for reliable clinical decision support and radiology workflow augmentation",,foundation_model_agent,8.5,1.25,这篇工作更像方法创新，可能直接关联 metagenomics、long-read 或 pathogen identification 流程优化。,,methods,,2603.17765v1,
From Snapshots to Symphonies: The Evolution of Protein Prediction from Static Structures to Generative Dynamics and Multimodal Interactions,arXiv,2026-03-19T05:25:17+00:00,http://arxiv.org/abs/2603.18505v1,"The protein folding problem has been fundamentally transformed by artificial intelligence, evolving from static structure prediction toward the modeling of dynamic conformational ensembles and complex biomolecular interactions. This review systematically examines the paradigm shift in AI driven protein science across five interconnected dimensions: unified multimodal representations that integrate sequences, geometries, and textual knowledge; refinement of static prediction through MSA free architectures and all atom complex modeling; generative frameworks, including diffusion models and flow matching, that capture conformational distributions consistent with thermodynamic ensembles; prediction of heterogeneous interactions spanning protein ligand, protein nucleic acid, and protein protein complexes; and functional inference of fitness landscapes, mutational effects, and text guided property prediction. We critically analyze current bottlenecks, including data distribution biases, limited mechanistic interpretability, and the disconnect between geometric metrics and biophysical reality, while identifying future directions toward physically consistent generative models, multimodal foundation architectures, and experimental closed loop systems. This methodological transformation marks artificial intelligence's transition from a structural analysis tool into a universal simulator capable of understanding and ultimately rewriting the dynamic language of life.",,foundation_model_agent,8.5,0.75,这篇工作偏基础模型/Agent方向，可能影响病原检测任务的建模上限，值得关注其任务定义与评测设计。,,foundation_model,,2603.18505v1,
Caption Injection for Optimization in Generative Search Engine,arXiv,2025-11-06T05:37:27+00:00,http://arxiv.org/abs/2511.04080v2,"Generative Search Engine (GSE) leverages the Retrieval-Augmented Generation (RAG) technique and the Large Language Model (LLM) to integrate multi-source information and provide users with accurate and comprehensive responses. Unlike traditional search engines that present results in ranked lists, GSE shifts users' attention from sequential browsing to content-driven subjective perception, not only driving a paradigm shift in information retrieval but also highlighting the importance of enhancing the subjective visibility of content in generative search. In this context, Generative Search Engine Optimization (G-SEO) methods have emerged as a new research focus. With the rapid advancement of Multimodal Retrieval-Augmented Generation (MRAG) techniques, GSE can now efficiently integrate text, images, audio, and video, producing richer responses that better satisfy complex information needs. Existing G-SEO methods, however, remain limited to text-based optimization and fail to fully exploit multimodal data. To address this gap, we propose Caption Injection, the first multimodal G-SEO approach, which extracts captions from images and injects them into textual content, integrating visual semantics to enhance the subjective visibility in generative search. We systematically evaluate Caption Injection on MRAMG, a benchmark for MRAG, under both unimodal and multimodal settings. Experimental results show that Caption Injection significantly outperforms text-only G-SEO baselines under the G-EVAL metric, effectively improving the subjective visibility of content perceived by users, and demonstrating the practical benefits of multimodal information in G-SEO.",,foundation_model_agent,7.9,1.7,这篇工作偏基础模型/Agent方向，可能影响病原检测任务的建模上限，值得关注其任务定义与评测设计。,,foundation_model,,2511.04080v2,
Coupling codon and protein constraints decouples drivers of variant pathogenicity,bioRxiv,2026-03-20T00:00:00+00:00,https://www.biorxiv.org/content/10.1101/2025.03.12.642937v3,"Predicting the functional impact of genetic variants remains a fundamental challenge in genomics. Existing models focus on protein-intrinsic defects yet overlook regulatory constraints embedded within coding sequences. Here, we couple a codon language model (CaLM) with a protein language model (ESM-2) to dissect the drivers of variant pathogenicity. On ClinVar data, both modalities contribute near-equally to distinguishing pathogenic from benign variants. Evaluation across Deep Mutational Scanning and CRISPR-Based Genome Editing platforms in ClinMAVE reveals that loss-of-function variants are governed primarily by residue-level features, whereas gain-of-function variants show a greater relative contribution from codon-level constraints, albeit in a gene-specific manner. A controlled comparison of identical variants in BRCA1 and TP53 further suggests that codon-level signals are elevated in the endogenous genomic context. Together, these findings indicate that pathogenicity reflects both the ""product'' and the ""process,'' and that the experimental platform may influence which dimension is observable.",,pathogenomics;sequencing_bioinformatics;foundation_model_agent,7.7,5.25,这篇工作更像方法创新，可能直接关联 metagenomics、long-read 或 pathogen identification 流程优化。,,methods,10.1101/2025.03.12.642937,,
HARVEST: Unlocking the Dark Bioactivity Data of Pharmaceutical Patents via Agentic AI,bioRxiv,2026-03-18T00:00:00+00:00,https://www.biorxiv.org/content/10.64898/2026.03.15.711910v1,"Pharmaceutical patents contain vast Structure-Activity Relationship tables documenting protein- ligand binding data that are technically public yet computationally inaccessible, rendering this wealth of data effectively dark -- trapped in unstructured archives no existing database has systematically captured. We present HARVEST, a multi-agent large language model pipeline that autonomously extracts structured bioactivity records from USPTO patent archives at $0.11 per document. Applied to 164,877 patents, HARVEST produced 3.36 million activity records, recovering 365,713 unique scaffolds and 1,108 protein targets absent from BindingDB -- completing in under a week a task requiring over 55 years of continuous expert labor. Automated extraction achieves 91% agreement with human curators while exhibiting lower unit-conversion error rates. We further introduce H-Bench, a structurally guaranteed held-out benchmark built from this recovered data. Evaluation of the leading open-source model Boltz-2 on H-Bench reveals a two-dimensional generalization gap: performance degrades both on novel chemical scaffolds and on uncharacterized protein targets, exposing fundamental limitations of models trained on existing public repositories.",,foundation_model_agent,7.55,1.5,这篇工作偏基础模型/Agent方向，可能影响病原检测任务的建模上限，值得关注其任务定义与评测设计。,,foundation_model,10.64898/2026.03.15.711910,,
Sentiment in Clinical Notes: A Predictor for Length of Stay?,medRxiv,2026-03-18T00:00:00+00:00,https://www.medrxiv.org/content/10.64898/2026.03.16.26348553v1,"BackgroundLength of stay (LOS) is a critical metric for hospital operational efficiency. While structured clinical data is widely used to predict LOS, unstructured admission notes contain latent prognostic information regarding diagnostic uncertainty and disease complexity. This study evaluates the efficacy of extracting sentiment and direct LOS estimates from admission notes to predict patient hospitalization duration. MethodsWe conducted a retrospective study of 4,503 adult patients admitted with community-acquired pneumonia between 2013 and 2023. Admission history and physical notes were preprocessed and filtered to extract physician-generated narratives. We evaluated four natural language processing models, VADER, TextBlob, Longformer, and an open-source large language model (GPT-oss-20B), to generate zero-shot sentiment scores. Additionally, GPT-oss-20B was prompted to directly estimate LOS. Model outputs were correlated with actual LOS using linear regression and Pearson correlation coefficients. ResultsSentiment models demonstrated statistically significant, albeit weak, correlations with actual LOS. Longformer achieved the highest variance explained among sentiment classifiers (R2 = 0.019). Direct LOS estimation by the LLM outperformed sentiment-based approaches, demonstrating the strongest correlation with actual hospital duration (r = -0.218, p < 0.001). Model agreement was generally poor (ICC = 0.059), and computational time varied drastically, from 2.6 seconds per 100 notes (TextBlob) to over 370 seconds (GPT-oss-20B). ConclusionZero-shot sentiment analysis of clinical notes yields a small but measurable correlation with LOS, limited primarily by the objective, non-evaluative nature of clinical documentation. Direct LLM estimation of clinical outcomes outperforms emotional sentiment extraction. Future predictive systems should integrate computationally efficient NLP models capable of capturing latent clinical complexity alongside established structured data variables.",,foundation_model_agent,7.15,0.75,这篇工作偏基础模型/Agent方向，可能影响病原检测任务的建模上限，值得关注其任务定义与评测设计。,,foundation_model,10.64898/2026.03.16.26348553,,
From Protocol to Analysis Plan: Development and Validation of a Large Language Model Pipeline for Statistical Analysis Plan Generation using Artificial Intelligence (SAPAI),medRxiv,2026-03-19T00:00:00+00:00,https://www.medrxiv.org/content/10.64898/2026.03.19.26348626v1,"Background: Statistical Analysis Plans (SAPs) are essential for trial transparency and credibility but are resource-intensive to produce. While Large Language Models (LLMs) have shown promise in drafting protocols, their ability to generate high-quality, protocol-compliant SAPs remains untested against current content guidance. This study developed and validated an LLM-based pipeline for drafting SAPs from clinical trial protocols. Methods: We developed a structured, section-by-section prompting pipeline aligned with standard SAP guidance. We applied this pipeline to nine clinical trial protocols using three leading LLMs: OpenAI GPT-5, Anthropic Claude Sonnet 4, and Google Gemini 2.5 Pro. The resulting 27 SAPs were evaluated against a 46-item quality checklist derived from the published SAP guidelines. Items were double-scored by independent trial statisticians on a 0 to 3 scale for accuracy. We compared performance across LLMs and between item types (descriptive vs. statistical reasoning) using mixed-effects logistic regression. Results: Across 9 trials, the models produced SAP drafts with high overall accuracy (77% to 78%), with no difference in performance between the three LLMs (p=0.79) but varied by content type (p < 0.001). All models performed well on descriptive items (e.g., administrative details, trial design), with lower accuracy for items requiring statistical reasoning (e.g., modelling strategies, sensitivity analyses). Accuracy for statistical items ranged from 67% to 72%, whereas descriptive items achieved 81% to 83% accuracy. Qualitatively, models were prone to specific failure modes in complex sections, such as omitting necessary details for secondary outcome models or hallucinating sensitivity analyses. Discussion: Current LLMs can effectively draft portions of SAPs, offering the potential for substantial time savings in trial documentation. However, a human-in-the-loop approach remains mandatory; while models demonstrate strong capability in producing descriptive content, their independent application to complex statistical methodology design still requires further methodological development and training. Future work should explore advanced prompt engineering, such as retrieval-augmented generation or agentic workflows, to improve reasoning capabilities.",,foundation_model_agent,7.15,0.75,这篇工作偏基础模型/Agent方向，可能影响病原检测任务的建模上限，值得关注其任务定义与评测设计。,,foundation_model,10.64898/2026.03.19.26348626,,
MRD: Multi-resolution Retrieval-Detection Fusion for High-Resolution Image Understanding,arXiv,2025-12-02T16:22:01+00:00,http://arxiv.org/abs/2512.02906v3,"Understanding high-resolution (HR) images remains a critical challenge for multimodal large language models (MLLMs). Recent approaches leverage vision-based retrieval-augmented generation (RAG) to retrieve query-relevant crops from HR images, improving understanding capacity of MLLMs. However, this paradigm often leads to object fragmentation, resulting in semantic bias and incomplete retrieval, while also introducing false positives from irrelevant background patches. To address these issues, we propose Multi-resolution Retrieval-Detection (MRD), a training-free framework that enhances HR image understanding from both local and global perspectives. Locally, MRD enforces cross-scale semantic consistency via multi-resolution semantic fusion to mitigate single-resolution bias and alleviate object fragmentation. Globally, it integrates open-vocabulary object detection (OVD) as localization priors within a unified framework. Extensive experiments across multiple MLLMs on HR image benchmarks demonstrate that MRD achieves state-of-the-art (SOTA) performance on both single-object and multi-object understanding tasks. Code will be available at: https://github.com/yf0412/MRD.",,foundation_model_agent,6.8,1.0,这篇工作偏基础模型/Agent方向，可能影响病原检测任务的建模上限，值得关注其任务定义与评测设计。,,foundation_model,,2512.02906v3,
