title,source,date,url,abstract,matched_topics,relevance_score,novelty_score,why_it_matters,category,doi,arxiv_id,pubmed_id
RexDrug: Reliable Multi-Drug Combination Extraction through Reasoning-Enhanced LLMs,arXiv,2026-03-09T09:47:25+00:00,http://arxiv.org/abs/2603.08166v1,"Automated Drug Combination Extraction (DCE) from large-scale biomedical literature is crucial for advancing precision medicine and pharmacological research. However, existing relation extraction methods primarily focus on binary interactions and struggle to model variable-length n-ary drug combinations, where complex compatibility logic and distributed evidence need to be considered. To address these limitations, we propose RexDrug, an end-to-end reasoning-enhanced relation extraction framework for n-ary drug combination extraction based on large language models. RexDrug adopts a two-stage training strategy. First, a multi-agent collaborative mechanism is utilized to automatically generate high-quality expert-like reasoning traces for supervised fine-tuning. Second, reinforcement learning with a multi-dimensional reward function specifically tailored for DCE is applied to further refine reasoning quality and extraction accuracy. Extensive experiments on the DrugComb dataset show that RexDrug consistently outperforms state-of-the-art baselines for n-ary extraction. Additional evaluation on the DDI13 corpus confirms its generalizability to binary drugdrug interaction tasks. Human expert assessment and automatic reasoning metrics further indicates that RexDrug produces coherent medical reasoning while accurately identifying complex therapeutic regimens. These results establish RexDrug as a scalable and reliable solution for complex biomedical relation extraction from unstructured text. The source code and data are available at https://github.com/DUTIR-BioNLP/RexDrug",foundation_model_agent,5.45,1.0,这篇工作偏数据集或基准构建，适合判断是否能作为病原组学训练或评测资源。,dataset,,2603.08166v1,
SPD-RAG: Sub-Agent Per Document Retrieval-Augmented Generation,arXiv,2026-03-09T12:46:32+00:00,http://arxiv.org/abs/2603.08329v1,"Answering complex, real-world queries often requires synthesizing facts scattered across vast document corpora. In these settings, standard retrieval-augmented generation (RAG) pipelines suffer from incomplete evidence coverage, while long-context large language models (LLMs) struggle to reason reliably over massive inputs. We introduce SPD-RAG, a hierarchical multi-agent framework for exhaustive cross-document question answering that decomposes the problem along the document axis. Each document is processed by a dedicated document-level agent operating only on its own content, enabling focused retrieval, while a coordinator dispatches tasks to relevant agents and aggregates their partial answers. Agent outputs are synthesized by merging partial answers through a token-bounded synthesis layer (which supports recursive map-reduce for massive corpora). This document-level specialization with centralized fusion improves scalability and answer quality in heterogeneous multidocument settings while yielding a modular, extensible retrieval pipeline. On the LOONG benchmark (EMNLP 2024) for long-context multi-document QA, SPD-RAG achieves an Avg Score of 58.1 (GPT-5 evaluation), outperforming Normal RAG (33.0) and Agentic RAG (32.8) while using only 38% of the API cost of a full-context baseline (68.0).",foundation_model_agent,5.45,1.0,这篇工作更像方法创新，可能直接关联 metagenomics、long-read 或 pathogen identification 流程优化。,methods,,2603.08329v1,
InterMind: Doctor-Patient-Family Interactive Depression Assessment Empowered by Large Language Models,arXiv,2024-09-23T10:23:19+00:00,http://arxiv.org/abs/2409.14878v2,"Depression poses significant challenges to patients and healthcare organizations, necessitating efficient assessment methods. Existing paradigms typically focus on a patient-doctor way that overlooks multi-role interactions, such as family involvement in the evaluation and caregiving process. Moreover, current automatic depression detection (ADD) methods usually model depression detection as a classification or regression task, lacking interpretability for the decision-making process. To address these issues, we developed InterMind, a doctor-patient-family interactive depression assessment system empowered by large language models (LLMs). Our system enables patients and families to contribute descriptions, generates assistive diagnostic reports for doctors, and provides actionable insights, improving diagnostic precision and efficiency. To enhance LLMs' performance in psychological counseling and diagnostic interpretability, we integrate retrieval-augmented generation (RAG) and chain-of-thoughts (CoT) techniques for data augmentation, which mitigates the hallucination issue of LLMs in specific scenarios after instruction fine-tuning. Quantitative experiments and professional assessments by clinicians validate the effectiveness of our system.",foundation_model_agent,5.45,0.5,这篇工作更接近临床/监测落地，适合评估其对快速识别、预警或治疗辅助的实际价值。,clinical_application,,2409.14878v2,
EvoScientist: Towards Multi-Agent Evolving AI Scientists for End-to-End Scientific Discovery,arXiv,2026-03-09T09:07:19+00:00,http://arxiv.org/abs/2603.08127v1,"The increasing adoption of Large Language Models (LLMs) has enabled AI scientists to perform complex end-to-end scientific discovery tasks requiring coordination of specialized roles, including idea generation and experimental execution. However, most state-of-the-art AI scientist systems rely on static, hand-designed pipelines and fail to adapt based on accumulated interaction histories. As a result, these systems overlook promising research directions, repeat failed experiments, and pursue infeasible ideas. To address this, we introduce EvoScientist, an evolving multi-agent AI scientist framework that continuously improves research strategies through persistent memory and self-evolution. EvoScientist comprises three specialized agents: a Researcher Agent (RA) for scientific idea generation, an Engineer Agent (EA) for experiment implementation and execution, and an Evolution Manager Agent (EMA) that distills insights from prior interactions into reusable knowledge. EvoScientist contains two persistent memory modules: (i) an ideation memory, which summarizes feasible research directions from top-ranked ideas while recording previously unsuccessful directions; and (ii) an experimentation memory, which captures effective data processing and model training strategies derived from code search trajectories and best-performing implementations. These modules enable the RA and EA to retrieve relevant prior strategies, improving idea quality and code execution success rates over time. Experiments show that EvoScientist outperforms 7 open-source and commercial state-of-the-art systems in scientific idea generation, achieving higher novelty, feasibility, relevance, and clarity via automatic and human evaluation. EvoScientist also substantially improves code execution success rates through multi-agent evolution, demonstrating persistent memory's effectiveness for end-to-end scientific discovery.",foundation_model_agent,5.45,0.5,这篇工作偏基础模型/Agent方向，可能影响病原检测任务的建模上限，值得关注其任务定义与评测设计。,foundation_model,,2603.08127v1,
Beyond Relevance: On the Relationship Between Retrieval and RAG Information Coverage,arXiv,2026-03-09T18:20:20+00:00,http://arxiv.org/abs/2603.08819v1,"Retrieval-augmented generation (RAG) systems combine document retrieval with a generative model to address complex information seeking tasks like report generation. While the relationship between retrieval quality and generation effectiveness seems intuitive, it has not been systematically studied. We investigate whether upstream retrieval metrics can serve as reliable early indicators of the final generated response's information coverage. Through experiments across two text RAG benchmarks (TREC NeuCLIR 2024 and TREC RAG 2024) and one multimodal benchmark (WikiVideo), we analyze 15 text retrieval stacks and 10 multimodal retrieval stacks across four RAG pipelines and multiple evaluation frameworks (Auto-ARGUE and MiRAGE). Our findings demonstrate strong correlations between coverage-based retrieval metrics and nugget coverage in generated responses at both topic and system levels. This relationship holds most strongly when retrieval objectives align with generation goals, though more complex iterative RAG pipelines can partially decouple generation quality from retrieval effectiveness. These findings provide empirical support for using retrieval metrics as proxies for RAG performance.",foundation_model_agent,3.45,6.25,这篇工作偏基础模型/Agent方向，可能影响病原检测任务的建模上限，值得关注其任务定义与评测设计。,foundation_model,,2603.08819v1,
Amortized Phylodynamic Inference with Neural Bayes Estimators and Recursive Neural Networks,arXiv,2026-03-09T13:07:01+00:00,http://arxiv.org/abs/2603.08345v1,"Phylodynamics is used to estimate epidemic dynamics from phylogenetic trees or genomic sequences of pathogens, but the likelihood calculations needed can be challenging for complex models. We present a neural Bayes estimator (NBE) for key epidemic quantities: the reproduction number, prevalence, and cumulative infections through time. By performing quantile regression over tree space, the NBE allows us to estimate posterior medians and credible intervals directly from a reconstructed tree. Our approach uses a recursive neural network as a tree embedding network with a prediction network conditioned on time and quantile level to generate the estimates. In simulation studies, the NBE achieves good predictive performance, with conservative uncertainty estimates. Compared with a BEAST2 fixed-tree analysis, the NBE gives less biased estimates of time-varying reproduction numbers in our test setting. Under a misspecified sampling model, the NBE performance degrades (as expected) but remains reasonable, and fine-tuning a pre-trained model yields estimates comparable to those from a model trained from scratch, at substantially lower computational cost.",sequencing_bioinformatics,2.6,0.25,这篇工作更像方法创新，可能直接关联 metagenomics、long-read 或 pathogen identification 流程优化。,methods,,2603.08345v1,
AutoAgent: Evolving Cognition and Elastic Memory Orchestration for Adaptive Agents,arXiv,2026-03-10T14:23:49+00:00,http://arxiv.org/abs/2603.09716v1,"Autonomous agent frameworks still struggle to reconcile long-term experiential learning with real-time, context-sensitive decision-making. In practice, this gap appears as static cognition, rigid workflow dependence, and inefficient context usage, which jointly limit adaptability in open-ended and non-stationary environments. To address these limitations, we present AutoAgent, a self-evolving multi-agent framework built on three tightly coupled components: evolving cognition, on-the-fly contextual decision-making, and elastic memory orchestration. At the core of AutoAgent, each agent maintains structured prompt-level cognition over tools, self-capabilities, peer expertise, and task knowledge. During execution, this cognition is combined with live task context to select actions from a unified space that includes tool calls, LLM-based generation, and inter-agent requests. To support efficient long-horizon reasoning, an Elastic Memory Orchestrator dynamically organizes interaction history by preserving raw records, compressing redundant trajectories, and constructing reusable episodic abstractions, thereby reducing token overhead while retaining decision-critical evidence. These components are integrated through a closed-loop cognitive evolution process that aligns intended actions with observed outcomes to continuously update cognition and expand reusable skills, without external retraining. Empirical results across retrieval-augmented reasoning, tool-augmented agent benchmarks, and embodied task environments show that AutoAgent consistently improves task success, tool-use efficiency, and collaborative robustness over static and memory-augmented baselines. Overall, AutoAgent provides a unified and practical foundation for adaptive autonomous agents that must learn from experience while making reliable context-aware decisions in dynamic environments.",,2.1,8.06,这篇工作偏基础模型/Agent方向，可能影响病原检测任务的建模上限，值得关注其任务定义与评测设计。,foundation_model,,2603.09716v1,
LooComp: Leverage Leave-One-Out Strategy to Encoder-only Transformer for Efficient Query-aware Context Compression,arXiv,2026-03-10T05:44:20+00:00,http://arxiv.org/abs/2603.09222v1,"Efficient context compression is crucial for improving the accuracy and scalability of question answering. For the efficiency of Retrieval Augmented Generation, context should be delivered fast, compact, and precise to ensure clue sufficiency and budget-friendly LLM reader cost. We propose a margin-based framework for query-driven context pruning, which identifies sentences that are critical for answering a query by measuring changes in clue richness when they are omitted. The model is trained with a composite ranking loss that enforces large margins for critical sentences while keeping non-critical ones near neutral. Built on a lightweight encoder-only Transformer, our approach generally achieves strong exact-match and F1 scores with high-throughput inference and lower memory requirements than those of major baselines. In addition to efficiency, our method yields effective compression ratios without degrading answering performance, demonstrating its potential as a lightweight and practical alternative for retrieval-augmented tasks.",,2.1,6.12,这篇工作更像方法创新，可能直接关联 metagenomics、long-read 或 pathogen identification 流程优化。,methods,,2603.09222v1,
World2Mind: Cognition Toolkit for Allocentric Spatial Reasoning in Foundation Models,arXiv,2026-03-10T15:12:14+00:00,http://arxiv.org/abs/2603.09774v1,"Achieving robust spatial reasoning remains a fundamental challenge for current Multimodal Foundation Models (MFMs). Existing methods either overfit statistical shortcuts via 3D grounding data or remain confined to 2D visual perception, limiting both spatial reasoning accuracy and generalization in unseen scenarios. Inspired by the spatial cognitive mapping mechanisms of biological intelligence, we propose World2Mind, a training-free spatial intelligence toolkit. At its core, World2Mind leverages 3D reconstruction and instance segmentation models to construct structured spatial cognitive maps, empowering MFMs to proactively acquire targeted spatial knowledge regarding interested landmarks and routes of interest. To provide robust geometric-topological priors, World2Mind synthesizes an Allocentric-Spatial Tree (AST) that uses elliptical parameters to model the top-down layout of landmarks accurately. To mitigate the inherent inaccuracies of 3D reconstruction, we introduce a three-stage reasoning chain comprising tool invocation assessment, modality-decoupled cue collection, and geometry-semantics interwoven reasoning. Extensive experiments demonstrate that World2Mind boosts the performance of frontier models, such as GPT-5.2, by 5%~18%. Astonishingly, relying solely on the AST-structured text, purely text-only foundation models can perform complex 3D spatial reasoning, achieving performance approaching that of advanced multimodal models.",foundation_model_agent,2.05,7.69,这篇工作偏基础模型/Agent方向，可能影响病原检测任务的建模上限，值得关注其任务定义与评测设计。,foundation_model,,2603.09774v1,
Conversational Artificial Intelligence-Enabled Molecular Characterization of Sezary Syndrome Reveals Distinct Pathway-Level Alterations Compared with Non-Sezary Cutaneous T-Cell Lymphoma,medRxiv,2026-03-10T00:00:00+00:00,https://www.medRxiv.org/content/10.1101/10.64898/2026.03.09.26347970v1,"ABSTRACT Background: Sezary syndrome (SS) represents an aggressive leukemic variant of cutaneous T-cell lymphoma (CTCL) with distinct clinical behavior compared with other CTCL subtypes. While prior studies have identified recurrent genomic alterations in CTCL, a systematic pathway-centric comparison between SS and non-SS CTCL remains limited. We applied our conversational artificial intelligence (AI) platform for precision oncology, to accelerate hypothesis generation and integrative interpretation of public genomic data. Methods: We performed a secondary analysis of somatic mutation and clinical data from the Columbia University CTCL cohort available via cBioPortal. Samples were stratified into SS (n=26) and non-SS CTCL (n=17). High-impact coding variants were retained and annotated to curated functional gene groups and signaling pathways relevant to CTCL biology. Pathway-level mutation frequencies were compared using Fishers exact test, with effect sizes summarized by odds ratios. Tumor mutation burden (TMB) was compared using Wilcoxon rank-sum testing. Subtype-specific gene-gene co-mutation patterns were assessed using pairwise association testing and visualized with heatmaps and oncoplots, with our conversational AI agents facilitating interactive exploration and prioritization of results. Results: Overall TMB did not differ between SS and non-SS CTCL (p=0.83), indicating comparable global mutational burden. Pathway-level analyses revealed enrichment of alterations affecting epigenetic regulators, tumor suppressor and cell-cycle control genes, NFAT signaling, and apoptosis/immune regulation in SS, whereas MAPK and JAK-STAT pathway alterations were relatively more frequent in non-SS CTCL. Co-mutation analysis demonstrated fewer but more focused gene-gene interactions in SS compared with broader co-mutation networks in non-SS CTCL, suggesting divergent evolutionary constraints. Several genes (including ERBB2, WWC1, POSTN) showed borderline subtype-specific enrichment, warranting further validation. Conclusions: Conversational AI-enhanced analysis reveals that SS is distinguished from other CTCL subtypes not by higher mutational load, but by qualitative differences in pathway involvement, particularly epigenetic dysregulation, immune escape, and transcriptional control. These findings generate testable hypotheses for downstream validation in patient-level datasets and demonstrate the utility of conversational AI agents as accelerators of translational cancer genomics.",,1.7,5.75,这篇工作更接近临床/监测落地，适合评估其对快速识别、预警或治疗辅助的实际价值。,clinical_application,10.64898/2026.03.09.26347970,,
Flow Matching Meets Biology and Life Science: A Survey,arXiv,2025-07-23T17:44:29+00:00,http://arxiv.org/abs/2507.17731v2,"Over the past decade, advances in generative modeling, such as generative adversarial networks, masked autoencoders, and diffusion models, have significantly transformed biological research and discovery, enabling breakthroughs in molecule design, protein generation, catalysis discovery, drug discovery, and beyond. At the same time, biological applications have served as valuable testbeds for evaluating the capabilities of generative models. Recently, flow matching has emerged as a powerful and efficient alternative to diffusion-based generative modeling, with growing interest in its application to problems in biology and life sciences. This paper presents the first comprehensive survey of recent developments in flow matching and its applications in biological domains. We begin by systematically reviewing the foundations and variants of flow matching, and then categorize its applications into three major areas: biological sequence modeling, molecule generation and design, and peptide and protein generation. For each, we provide an in-depth review of recent progress. We also summarize commonly used datasets and software tools, and conclude with a discussion of potential future directions. The corresponding curated resources are available at https://github.com/Violet24K/Awesome-Flow-Matching-Meets-Biology.",,1.7,0.75,这篇工作更像方法创新，可能直接关联 metagenomics、long-read 或 pathogen identification 流程优化。,methods,,2507.17731v2,
Overview of the TREC 2025 Retrieval Augmented Generation (RAG) Track,arXiv,2026-03-10T16:49:18+00:00,http://arxiv.org/abs/2603.09891v1,"The second edition of the TREC Retrieval Augmented Generation (RAG) Track advances research on systems that integrate retrieval and generation to address complex, real-world information needs. Building on the foundation of the inaugural 2024 track, this year's challenge introduces long, multi-sentence narrative queries to better reflect the deep search task with the growing demand for reasoning-driven responses. Participants are tasked with designing pipelines that combine retrieval and generation while ensuring transparency and factual grounding. The track leverages the MS MARCO V2.1 corpus and employs a multi-layered evaluation framework encompassing relevance assessment, response completeness, attribution verification, and agreement analysis. By emphasizing multi-faceted narratives and attribution-rich answers from over 150 submissions this year, the TREC 2025 RAG Track aims to foster innovation in creating trustworthy, context-aware systems for retrieval augmented generation.",,1.4,7.71,这篇工作偏数据集或基准构建，适合判断是否能作为病原组学训练或评测资源。,dataset,,2603.09891v1,
Quantifying the Accuracy and Cost Impact of Design Decisions in Budget-Constrained Agentic LLM Search,arXiv,2026-03-09T19:42:21+00:00,http://arxiv.org/abs/2603.08877v1,"Agentic Retrieval-Augmented Generation (RAG) systems combine iterative search, planning prompts, and retrieval backends, but deployed settings impose explicit budgets on tool calls and completion tokens. We present a controlled measurement study of how search depth, retrieval strategy, and completion budget affect accuracy and cost under fixed constraints. Using Budget-Constrained Agentic Search (BCAS), a model-agnostic evaluation harness that surfaces remaining budget and gates tool use, we run comparisons across six LLMs and three question-answering benchmarks. Across models and datasets, accuracy improves with additional searches up to a small cap, hybrid lexical and dense retrieval with lightweight re-ranking produces the largest average gains in our ablation grid, and larger completion budgets are most helpful on HotpotQA-style synthesis. These results provide practical guidance for configuring budgeted agentic retrieval pipelines and are accompanied by reproducible prompts and evaluation settings.",,1.4,6.5,这篇工作偏基础模型/Agent方向，可能影响病原检测任务的建模上限，值得关注其任务定义与评测设计。,foundation_model,,2603.08877v1,
Human-AI Collaboration for Scaling Agile Regression Testing: An Agentic-AI Teammate from Manual to Automated Testing,arXiv,2026-03-09T10:19:13+00:00,http://arxiv.org/abs/2603.08190v1,"Agile organizations increasingly rely on automated regression testing to sustain rapid, high-quality software delivery. However, as systems grow and requirements evolve, a persistent bottleneck arises: test specifications are produced faster than they can be transformed into executable scripts, leading to mounting manual effort and delayed releases. In partnership with Hacon (a Siemens company), we present an agentic AI approach that generates system-level test scripts directly from validated specifications, aiming to accelerate automation without sacrificing human oversight. Our solution features a retrieval-augmented, multi-agent architecture integrated into Hacon's agile workflows. We evaluate this system through a mixed-method analysis of industrial artifacts and practitioner feedback. Results show that the AI teammate significantly increases test script throughput and reduces manual authoring effort, while underscoring the ongoing need for clear specifications and human review to ensure quality and maintainability. We conclude with practical lessons for scaling regression automation and fostering effective Human-AI collaboration in agile environments.",,1.4,0.5,这篇工作更像方法创新，可能直接关联 metagenomics、long-read 或 pathogen identification 流程优化。,methods,,2603.08190v1,
