title,source,date,url,abstract,matched_topics,relevance_score,novelty_score,why_it_matters,category,doi,arxiv_id,pubmed_id
"AI Agents, Language, Deep Learning and the Next Revolution in Science",arXiv,2026-03-09T04:14:20+00:00,http://arxiv.org/abs/2603.07940v1,"Modern science is reaching a critical inflection point. Instruments across disciplines, from particle physics and astronomy to genomics and climate modeling, now produce data of such scale, diversity, and interdependence that traditional analytical methods can no longer keep pace. This growing imbalance between data generation and data understanding signals the need for a new scientific paradigm. We propose that intelligent, human-supervised AI agents operating over deep-learning algorithms, represent the next evolution of the scientific method. Built upon large language models and multimodal learning, these agents can interpret scientific intent, design and execute analytical workflows, and ensure traceability through domain-specific languages that preserve human oversight and accountability. Particle physics, a historic incubator of computational innovation, offers the ideal testbed for this transition. At the Institute of High Energy Physics of the Chinese Academy of Sciences, the Dr. Sai system embodies this vision, a multi-agent reasoning framework deployed within collider research at the CEPC. This emerging approach does not replace human scientists but extends their cognitive reach, enabling discovery to scale with complexity and redefining how knowledge itself is produced in the age of intelligent machines. The significance of this paradigm transcends particle physics, offering a blueprint for all data-driven sciences facing the same complexity ceiling.",foundation_model_agent,8.5,5.87,这篇工作更像方法创新，可能直接关联 metagenomics、long-read 或 pathogen identification 流程优化。,methods,10.15302/frontphys.2026.096401,2603.07940v1,
"Memory for Autonomous LLM Agents:Mechanisms, Evaluation, and Emerging Frontiers",arXiv,2026-03-08T15:08:01+00:00,http://arxiv.org/abs/2603.07670v1,"Large language model (LLM) agents increasingly operate in settings where a single context window is far too small to capture what has happened, what was learned, and what should not be repeated. Memory -- the ability to persist, organize, and selectively recall information across interactions -- is what turns a stateless text generator into a genuinely adaptive agent. This survey offers a structured account of how memory is designed, implemented, and evaluated in modern LLM-based agents, covering work from 2022 through early 2026. We formalize agent memory as a \emph{write--manage--read} loop tightly coupled with perception and action, then introduce a three-dimensional taxonomy spanning temporal scope, representational substrate, and control policy. Five mechanism families are examined in depth: context-resident compression, retrieval-augmented stores, reflective self-improvement, hierarchical virtual context, and policy-learned management. On the evaluation side, we trace the shift from static recall benchmarks to multi-session agentic tests that interleave memory with decision-making, analyzing four recent benchmarks that expose stubborn gaps in current systems. We also survey applications where memory is the differentiating factor -- personal assistants, coding agents, open-world games, scientific reasoning, and multi-agent teamwork -- and address the engineering realities of write-path filtering, contradiction handling, latency budgets, and privacy governance. The paper closes with open challenges: continual consolidation, causally grounded retrieval, trustworthy reflection, learned forgetting, and multimodal embodied memory.",foundation_model_agent,7.9,6.7,这篇工作偏基础模型/Agent方向，可能影响病原检测任务的建模上限，值得关注其任务定义与评测设计。,foundation_model,,2603.07670v1,
BRIDGE: Benchmark for multi-hop Reasoning In long multimodal Documents with Grounded Evidence,arXiv,2026-03-09T03:54:08+00:00,http://arxiv.org/abs/2603.07931v1,"Multi-hop question answering (QA) is widely used to evaluate the reasoning capabilities of large language models, yet most benchmarks focus on final answer correctness and overlook intermediate reasoning, especially in long multimodal documents. We introduce BRIDGE, a benchmark for multi-hop reasoning over long scientific papers that require integrating evidence across text, tables, and figures. The dataset supports both chain-like and fan-out structures and provides explicit multi-hop reasoning annotations for step-level evaluation beyond answer accuracy. Experiments with state-of-the-art LLMs and multimodal retrieval-augmented generation (RAG) systems reveal systematic deficiencies in evidence aggregation and grounding that remain hidden under conventional answer-only evaluation. BRIDGE provides a targeted testbed for diagnosing reasoning failures in long multimodal documents.",foundation_model_agent,6.8,6.56,这篇工作偏数据集或基准构建，适合判断是否能作为病原组学训练或评测资源。,dataset,,2603.07931v1,
CMMR-VLN: Vision-and-Language Navigation via Continual Multimodal Memory Retrieval,arXiv,2026-03-09T06:02:50+00:00,http://arxiv.org/abs/2603.07997v1,"Although large language models (LLMs) are introduced into vision-and-language navigation (VLN) to improve instruction comprehension and generalization, existing LLM- based VLN lacks the ability to selectively recall and use relevant priori experiences to help navigation tasks, limiting their performance in long-horizon and unfamiliar scenarios. In this work, we propose CMMR-VLN (Continual Multimodal Memory Retrieval based VLN), a VLN framework that endows LLM agents with structured memory and reflection capabilities. Specifically, the CMMR-VLN constructs a multimodal experi- ence memory indexed by panoramic visual images and salient landmarks to retrieve relevant experiences during navigation, introduces a retrieved-augmented generation pipeline to mimick how experienced human navigators leverage priori knowledge, and incorporates a reflection-based memory update strategy that selectively stores complete successful paths and the key initial mistake in failure cases. Comprehensive tests illustrate average success rate improvements of 52.9%, 20.9% and 20.9%, and 200%, 50% and 50% over the NavGPT, the MapGPT, and the DiscussNav in simulation and real tests, respectively eluci- dating the great potential of the CMMR-VLN as a backbone VLN framework.",foundation_model_agent,6.8,5.92,这篇工作偏基础模型/Agent方向，可能影响病原检测任务的建模上限，值得关注其任务定义与评测设计。,foundation_model,,2603.07997v1,
HDLxGraph: Bridging Large Language Models and HDL Repositories via HDL Graph Databases,arXiv,2025-05-21T16:14:10+00:00,http://arxiv.org/abs/2505.15701v2,"Retrieval Augmented Generation (RAG) is an essential agent for Large Language Model (LLM) aided Description Language (HDL) tasks, addressing the challenges of limited training data and prohibitively long prompts. However, its performance in handling ambiguous queries and real-world, repository-level HDL projects containing thousands or even tens of thousands of code lines remains limited. Our analysis demonstrates two fundamental mismatches, structural and vocabulary, between conventional semantic similarity-based RAGs and HDL codes. To this end, we propose HDLxGraph, the first framework that integrates the inherent graph characteristics of HDLs with RAGs for LLM-assisted tasks. Specifically, HDLxGraph incorporates Abstract Syntax Trees (ASTs) to capture HDLs' hierarchical structures and Data Flow Graphs (DFGs) to address the vocabulary mismatch. In addition, to overcome the lack of comprehensive HDL search benchmarks, we introduce HDLSearch, an LLM generated dataset derived from real-world, repository-level HDL projects. Evaluations show that HDLxGraph improves search, debugging, and completion accuracy by 12.04%/12.22%/5.04% and by 11.59%/8.18%/4.07% over state-of-the-art similarity-based RAG and software-code Graph RAG baselines, respectively. The code of HDLxGraph and HDLSearch benchmark are available at https://github.com/UMN-ZhaoLab/HDLxGraph.",foundation_model_agent,6.55,7.2,这篇工作偏基础模型/Agent方向，可能影响病原检测任务的建模上限，值得关注其任务定义与评测设计。,foundation_model,,2505.15701v2,
LongAudio-RAG: Event-Grounded Question Answering over Multi-Hour Long Audio,arXiv,2026-02-16T10:15:22+00:00,http://arxiv.org/abs/2602.14612v3,"Long-duration audio is increasingly common in industrial and consumer settings, yet reviewing multi-hour recordings is impractical, motivating systems that answer natural-language queries with precise temporal grounding and minimal hallucination. Existing audio-language models show promise, but long-audio question answering remains difficult due to context-length limits. We introduce LongAudio-RAG (LA-RAG), a hybrid framework that grounds Large Language Model outputs in retrieved, timestamped acoustic event detections rather than raw audio. Multi-hour streams are converted into structured event records stored in an SQL database, and at inference time the system resolves natural-language time references, classifies intent, retrieves only the relevant events, and generates answers using this constrained evidence. To evaluate performance, we construct a synthetic long-audio benchmark by concatenating recordings with preserved timestamps and generating template-based question-answer pairs for detection, counting, and summarization tasks. Finally, we demonstrate the practicality of our approach by deploying it in a hybrid edge-cloud environment, where the audio grounding model runs on-device on IoT-class hardware while the LLM is hosted on a GPU-backed server. This architecture enables low-latency event extraction at the edge and high-quality language reasoning in the cloud. Experiments show that structured, event-level retrieval significantly improves accuracy compared to vanilla Retrieval-Augmented Generation (RAG) or text-to-SQL approaches.",foundation_model_agent,6.55,6.5,这篇工作偏基础模型/Agent方向，可能影响病原检测任务的建模上限，值得关注其任务定义与评测设计。,foundation_model,,2602.14612v3,
Multi-Agentic AI for Conflict-Aware rApp Policy Orchestration in Open RAN,arXiv,2026-03-07T23:34:20+00:00,http://arxiv.org/abs/2603.07375v1,"Open Radio Access Network (RAN) enables flexible, AI-driven control of mobile networks through disaggregated, multi-vendor components. In this architecture, xApps handle real-time functions, whereas rApps in the non-real-time controller generate strategic policies. However, current rApp development remains largely manual, brittle, and poorly scalable as xApp diversity proliferates. In this work, we propose a Multi-Agentic AI framework to automate rApp policy generation and orchestration. The architecture integrates three specialized large language model (LLM)-based agents, Perception, Reasoning, and Refinement, supported by retrieval-augmented generation (RAG) and memory-based analogical reasoning. These agents collectively analyze potential conflicts, synthesize intent-aligned control pipelines, and incrementally refine deployment decisions. Experiments across diverse deployment scenarios demonstrate that the proposed system achieves over 70% improvement in deployment accuracy and 95% reduction in reasoning cost compared to baseline methods, while maintaining zero-shot generalization to unseen intents. These results establish a scalable and conflict-aware solution for fully autonomous, zero-touch rApp orchestration in Open RAN.",foundation_model_agent,6.55,6.2,这篇工作偏基础模型/Agent方向，可能影响病原检测任务的建模上限，值得关注其任务定义与评测设计。,foundation_model,,2603.07375v1,
Fanar-Sadiq: A Multi-Agent Architecture for Grounded Islamic QA,arXiv,2026-03-09T15:35:12+00:00,http://arxiv.org/abs/2603.08501v1,"Large language models (LLMs) can answer religious knowledge queries fluently, yet they often hallucinate and misattribute sources, which is especially consequential in Islamic settings where users expect grounding in canonical texts (Qur'an and Hadith) and jurisprudential (fiqh) nuance. Retrieval-augmented generation (RAG) reduces some of these limitations by grounding generation in external evidence. However, a single ``retrieve-then-generate'' pipeline is limited to deal with the diversity of Islamic queries.Users may request verbatim scripture, fatwa-style guidance with citations or rule-constrained computations such as zakat and inheritance that require strict arithmetic and legal invariants. In this work, we present a bilingual (Arabic/English) multi-agent Islamic assistant, called Fanar-Sadiq, which is a core component of the Fanar AI platform. Fanar-Sadiq routes Islamic-related queries to specialized modules within an agentic, tool-using architecture. The system supports intent-aware routing, retrieval-grounded fiqh answers with deterministic citation normalization and verification traces, exact verse lookup with quotation validation, and deterministic calculators for Sunni zakat and inheritance with madhhab-sensitive branching. We evaluate the complete end-to-end system on public Islamic QA benchmarks and demonstrate effectiveness and efficiency. Our system is currently publicly and freely accessible through API and a Web application, and has been accessed $\approx$1.9M times in less than a year.",foundation_model_agent,6.15,8.26,这篇工作偏基础模型/Agent方向，可能影响病原检测任务的建模上限，值得关注其任务定义与评测设计。,foundation_model,,2603.08501v1,
LeJOT-AutoML: LLM-Driven Feature Engineering for Job Execution Time Prediction in Databricks Cost Optimization,arXiv,2026-03-09T02:31:50+00:00,http://arxiv.org/abs/2603.07897v1,"Databricks job orchestration systems (e.g., LeJOT) reduce cloud costs by selecting low-priced compute configurations while meeting latency and dependency constraints. Accurate execution-time prediction under heterogeneous instance types and non-stationary runtime conditions is therefore critical. Existing pipelines rely on static, manually engineered features that under-capture runtime effects (e.g., partition pruning, data skew, and shuffle amplification), and predictive signals are scattered across logs, metadata, and job scripts-lengthening update cycles and increasing engineering overhead. We present LeJOT-AutoML, an agent-driven AutoML framework that embeds large language model agents throughout the ML lifecycle. LeJOT-AutoML combines retrieval-augmented generation over a domain knowledge base with a Model Context Protocol toolchain (log parsers, metadata queries, and a read-only SQL sandbox) to analyze job artifacts, synthesize and validate feature-extraction code via safety gates, and train/select predictors. This design materializes runtime-derived features that are difficult to obtain through static analysis alone. On enterprise Databricks workloads, LeJOT-AutoML generates over 200 features and reduces the feature-engineering and evaluation loop from weeks to 20-30 minutes, while maintaining competitive prediction accuracy. Integrated into the LeJOT pipeline, it enables automated continuous model updates and achieves 19.01% cost savings in our deployment setting through improved orchestration.",foundation_model_agent,6.15,5.75,这篇工作偏基础模型/Agent方向，可能影响病原检测任务的建模上限，值得关注其任务定义与评测设计。,foundation_model,,2603.07897v1,
RobustVisRAG: Causality-Aware Vision-Based Retrieval-Augmented Generation under Visual Degradations,arXiv,2026-02-25T15:27:57+00:00,http://arxiv.org/abs/2602.22013v3,"Vision-based Retrieval-Augmented Generation (VisRAG) leverages vision-language models (VLMs) to jointly retrieve relevant visual documents and generate grounded answers based on multimodal evidence. However, existing VisRAG models degrade in performance when visual inputs suffer from distortions such as blur, noise, low light, or shadow, where semantic and degradation factors become entangled within pretrained visual encoders, leading to errors in both retrieval and generation stages. To address this limitation, we introduce RobustVisRAG, a causality-guided dual-path framework that improves VisRAG robustness while preserving efficiency and zero-shot generalization. RobustVisRAG uses a non-causal path to capture degradation signals through unidirectional attention and a causal path to learn purified semantics guided by these signals. Together with the proposed Non-Causal Distortion Modeling and Causal Semantic Alignment objectives, the framework enforces a clear separation between semantics and degradations, enabling stable retrieval and generation under challenging visual conditions. To evaluate robustness under realistic conditions, we introduce the Distortion-VisRAG dataset, a large-scale benchmark containing both synthetic and real-world degraded documents across seven domains, with 12 synthetic and 5 real distortion types that comprehensively reflect practical visual degradations. Experimental results show that RobustVisRAG improves retrieval, generation, and end-to-end performance by 7.35%, 6.35%, and 12.40%, respectively, on real-world degradations, while maintaining comparable accuracy on clean inputs.",foundation_model_agent,6.1,6.25,这篇工作偏数据集或基准构建，适合判断是否能作为病原组学训练或评测资源。,dataset,,2602.22013v3,
Retrieval-Augmented Anatomical Guidance for Text-to-CT Generation,arXiv,2026-03-09T12:27:17+00:00,http://arxiv.org/abs/2603.08305v1,"Text-conditioned generative models for volumetric medical imaging provide semantic control but lack explicit anatomical guidance, often resulting in outputs that are spatially ambiguous or anatomically inconsistent. In contrast, structure-driven methods ensure strong anatomical consistency but typically assume access to ground-truth annotations, which are unavailable when the target image is to be synthesized. We propose a retrieval-augmented approach for Text-to-CT generation that integrates semantic and anatomical information under a realistic inference setting. Given a radiology report, our method retrieves a semantically related clinical case using a 3D vision-language encoder and leverages its associated anatomical annotation as a structural proxy. This proxy is injected into a text-conditioned latent diffusion model via a ControlNet branch, providing coarse anatomical guidance while maintaining semantic flexibility. Experiments on the CT-RATE dataset show that retrieval-augmented generation improves image fidelity and clinical consistency compared to text-only baselines, while additionally enabling explicit spatial controllability, a capability inherently absent in such approaches. Further analysis highlights the importance of retrieval quality, with semantically aligned proxies yielding consistent gains across all evaluation axes. This work introduces a principled and scalable mechanism to bridge semantic conditioning and anatomical plausibility in volumetric medical image synthesis. Code will be released.",foundation_model_agent,5.75,7.24,这篇工作偏数据集或基准构建，适合判断是否能作为病原组学训练或评测资源。,dataset,,2603.08305v1,
Retrieval-Augmented Generation for Predicting Cellular Responses to Gene Perturbation,arXiv,2026-03-07T14:31:27+00:00,http://arxiv.org/abs/2603.07233v1,"Predicting how cells respond to genetic perturbations is fundamental to understanding gene function, disease mechanisms, and therapeutic development. While recent deep learning approaches have shown promise in modeling single-cell perturbation responses, they struggle to generalize across cell types and perturbation contexts due to limited contextual information during generation. We introduce PT-RAG (Perturbation-aware Two-stage Retrieval-Augmented Generation), a novel framework that extends Retrieval-Augmented Generation beyond traditional language-model applications to cellular biology. Unlike standard RAG systems designed for text retrieval with pre-trained LLMs, perturbation retrieval lacks established similarity metrics and requires learning what constitutes relevant context, making differentiable retrieval essential. PT-RAG addresses this through a two-stage pipeline: first, retrieving candidate perturbations $K$ using GenePT embeddings, then adaptively refining the selection through Gumbel-Softmax discrete sampling conditioned on both the cell state and the input perturbation. This cell-type-aware differentiable retrieval enables end-to-end optimization of the retrieval objective jointly with generation. On the Replogle-Nadig single-gene perturbation dataset, we demonstrate that PT-RAG outperforms both STATE and vanilla RAG under identical experimental conditions, with the strongest gains in distributional similarity metrics ($W_1$, $W_2$). Notably, vanilla RAG's dramatic failure is itself a key finding: it demonstrates that differentiable, cell-type-aware retrieval is essential in this domain, and that naive retrieval can actively harm performance. Our results establish retrieval-augmented generation as a promising paradigm for modelling cellular responses to gene perturbation. The code to reproduce our experiments is available at https://github.com/difra100/PT-RAG_ICLR.",foundation_model_agent,5.75,5.75,这篇工作更像方法创新，可能直接关联 metagenomics、long-read 或 pathogen identification 流程优化。,methods,,2603.07233v1,
Reverse Distillation: Consistently Scaling Protein Language Model Representations,arXiv,2026-03-08T16:24:05+00:00,http://arxiv.org/abs/2603.07710v1,"Unlike the predictable scaling laws in natural language processing and computer vision, protein language models (PLMs) scale poorly: for many tasks, models within the same family plateau or even decrease in performance, with mid-sized models often outperforming the largest in the family. We introduce Reverse Distillation, a principled framework that decomposes large PLM representations into orthogonal subspaces guided by smaller models of the same family. The resulting embeddings have a nested, Matryoshka-style structure: the first k dimensions of a larger model's embedding are exactly the representation from the smaller model. This ensures that larger reverse-distilled models consistently outperform smaller ones. A motivating intuition is that smaller models, constrained by capacity, preferentially encode broadly-shared protein features. Reverse distillation isolates these shared features and orthogonally extracts additional contributions from larger models, preventing interference between the two. On ProteinGym benchmarks, reverse-distilled ESM-2 variants outperform their respective baselines at the same embedding dimensionality, with the reverse-distilled 15 billion parameter model achieving the strongest performance. Our framework is generalizable to any model family where scaling challenges persist. Code and trained models are available at https://github.com/rohitsinghlab/plm_reverse_distillation.",foundation_model_agent,5.75,5.75,这篇工作更像方法创新，可能直接关联 metagenomics、long-read 或 pathogen identification 流程优化。,methods,,2603.07710v1,
Accelerating Exploratory Clinical Research: An LLM-Powered Framework for Cross-Study Data Harmonization and Natural Language Querying,medRxiv,2026-03-09T00:00:00+00:00,https://www.medRxiv.org/content/10.1101/10.64898/2026.03.04.26345603v1,"Clinical research depends on high quality data that is standardized, accessible and interoperable. Yet evolving data standards over time and variations in their implementation hinder the secondary use of clinical trial datasets. Although individual studies adhere to clinical data standards set forth by CDISC (Clinical Data Interchange Standards Consortium), differences in study design, interpretation of complex models, controlled terminologies, and historical conventions create inconsistencies that limit interoperability and complicate cross-study analysis. As a result, harmonizing SDTM datasets across studies is essential to enable efficient secondary use and accelerate evidence generation.To address these challenges, we introduce a framework that leverages Large Language Models (LLMs) to automate the harmonization of study-specific clinical trial data, available in CDISC Study Data Tabulation Model (SDTM) format, into data that is harmonized across trials at scale and also enables natural language querying via a text-to-SQL agent. This system transforms siloed study clinical datasets into interoperable, analysis-ready formats while empowering users to retrieve insights across trials without needing SQL or domain-specific schema knowledge. By constructing a semantic layer and applying retrieval-augmented prompting to models like GPT-4o, our approach improves data access, query accuracy, and scalability across use cases. This work demonstrates the potential of LLMs to transform clinical data workflows, cutting manual effort, substantially reducing manual harmonization effort and query latency in secondary analysis workflows, and enabling faster exploratory analysis and hypothesis generation in clinical research.",foundation_model_agent,5.75,5.75,这篇工作偏基础模型/Agent方向，可能影响病原检测任务的建模上限，值得关注其任务定义与评测设计。,foundation_model,10.64898/2026.03.04.26345603,,
