title,source,date,url,abstract,abstract_zh,matched_topics,relevance_score,novelty_score,why_it_matters,analysis_zh,category,doi,arxiv_id,pubmed_id
yakRNA Design: A semantic multimodal RNA composer,bioRxiv,2026-04-23T00:00:00+00:00,https://www.biorxiv.org/content/10.64898/2026.04.22.720245v1,"Like proteins, RNAs have been a target for exploitation to generate synthetic molecules that can adopt enhanced and novel functions. High-throughput assays, combined with meticulous biochemistry, have led to the generation of some artificial RNAs but the ability to algorithmically program RNAs with an intended function remains difficult. While generative models have revolutionized protein design, RNA design remains challenging due to the dearth of 3D RNA structures. Here we present You Always Know RNA (yakRNA) Design, a frontier language model that can simultaneously reason over sequence, biological function, consensus sequence, and secondary structure to generate functional RNAs. yakRNA Design is not trained on any 3D structural information but rather co-learned over a corpus of semantically labeled sequences that we designed. yakRNA Design, without any human intervention, fine-tuning, sequence optimization, scoring or selection, zero-shot designed 17 (out of 84 total designs) synthetic RNAs that were able to efficiently induce ribosomes to change their reading frames during elongation at rates comparable to or higher than most natural sequences. One of these efficient synthetic RNAs was found to have no identity to any sequence in the known universe, demonstrating how a model with semantic understanding of RNA has rich generative capabilities.",,foundation_model_agent,8.9,6.0,这篇工作偏基础模型/Agent方向，可能影响病原检测任务的建模上限，值得关注其任务定义与评测设计。,,foundation_model,10.64898/2026.04.22.720245,,
Aiki-XP: leakage-controlled multimodal prediction of within-species relative protein expression at pan-bacterial scale,bioRxiv,2026-04-23T00:00:00+00:00,https://www.biorxiv.org/content/10.64898/2026.04.21.719525v1,"Generalizable protein-expression prediction can accelerate protein engineering, inform disease mechanisms, and help optimize heterologous recombinant protein production. Protein expression is governed by many interacting parameters that no single omics view captures. We develop Aiki-XP, a multimodal platform integrating four biological scales (genome, operon, coding sequence, protein) plus biophysical features across 492,026 genes from 385 bacterial species. Aiki-XP predicts within-species relative abundance (per-species z-score rank), not absolute copies per cell. Under a leakage-controlled gene-operon split Aiki-XP reaches Spearman {rho}nc = 0.592 versus 0.509 for ESM-C 600M alone, and each tier of a monotone protein[-&gt;]operon[-&gt;]genome deployment ladder yields a statistically significant gain; a five-recipe rank-average ensemble adds a further +0.016. All recipes were locked before external evaluation; transfer to heterologous, cross-species, and novel-phylum benchmarks demonstrates utility and limits. Ablations and scaling experiments identify operon-scale genomic context, not protein language-model capacity, as the rate-limiting input at this scale; one foundation model per biological scale suffices, with same-scale stacking adding little.",,foundation_model_agent,7.8,6.5,这篇工作偏基础模型/Agent方向，可能影响病原检测任务的建模上限，值得关注其任务定义与评测设计。,,foundation_model,10.64898/2026.04.21.719525,,
"Autonomous multimodal agents enable transparent, spatiotemporal reconstruction of immune dynamics in pancreatic cancer progression",bioRxiv,2026-04-23T00:00:00+00:00,https://www.biorxiv.org/content/10.64898/2026.04.20.719684v1,"Pancreatic cancer progression is orchestrated by dynamic shifts in immune and stromal cellular ecosystems, yet the temporal and spatial principles governing these transitions remain poorly understood. Here, we present an agentic computational pathology framework that leverages large language models to orchestrate modular biomarker inference and spatiotemporal reasoning directly from routine H&E histology. Our approach, ROSIE (RObust in Silico Immunofluorescence), combines deep-learning-based multiplex inference with LLM-driven agent logic that emulates pathologist-level reasoning, enabling transparent and reproducible analysis of complex tissue microarchitectures. Applying this workflow to pancreatic intraepithelial neoplasia (PanIN) progression in KSC transgenic mice (n=24, ages 4-12 weeks), we generated 10.44 million single-cell profiles and identified a temporally ordered immune trajectory comprising three spatially distinct immune-stromal states: (1) early immune-surveillance niche: sharply bounded window of adaptive immune activation and antigen-presentation enrichment; (2) transitional mixed state: declining lymphoid activity, emerging exhaustion programs, and early EMT/angiogenesis signals; (3) stromal-dominant terminal state: fibroblast expansion, vascular remodeling, and immune silence. These findings establish pancreatic cancer progression as a temporally ordered sequence of immune activation, exhaustion, and stromal takeover. The agentic framework transcends static AI models by offering dynamic, tool-augmented reasoning that bridges high-dimensional tissue data with clinical interpretability -- providing a scalable foundation for identifying therapeutic inflection points in early tumor evolution.",,foundation_model_agent,8.5,0.75,这篇工作偏基础模型/Agent方向，可能影响病原检测任务的建模上限，值得关注其任务定义与评测设计。,,foundation_model,10.64898/2026.04.20.719684,,
Multimodal Protein Language Models for Enzyme Kinetic Parameters: From Substrate Recognition to Conformational Adaptation,arXiv,2026-03-13T09:45:41+00:00,http://arxiv.org/abs/2603.12845v2,"Predicting enzyme kinetic parameters quantifies how efficiently an enzyme catalyzes a specific substrate under defined biochemical conditions. Canonical parameters such as the turnover number ($k_\text{cat}$), Michaelis constant ($K_\text{m}$), and inhibition constant ($K_\text{i}$) depend jointly on the enzyme sequence, the substrate chemistry, and the conformational adaptation of the active site during binding. Many learning pipelines simplify this process to a static compatibility problem between the enzyme and substrate, fusing their representations through shallow operations and regressing a single value. Such formulations overlook the staged nature of catalysis, which involves both substrate recognition and conformational adaptation. In this regard, we reformulate kinetic prediction as a staged multimodal conditional modeling problem and introduce the Enzyme-Reaction Bridging Adapter (ERBA), which injects cross-modal information via fine-tuning into Protein Language Models (PLMs) while preserving their biochemical priors. ERBA performs conditioning in two stages: Molecular Recognition Cross-Attention (MRCA) first injects substrate information into the enzyme representation to capture specificity; Geometry-aware Mixture-of-Experts (G-MoE) then integrates active-site structure and routes samples to pocket-specialized experts to reflect induced fit. To maintain semantic fidelity, Enzyme-Substrate Distribution Alignment (ESDA) enforces distributional consistency within the PLM manifold in a reproducing kernel Hilbert space. Experiments across three kinetic endpoints and multiple PLM backbones, ERBA delivers consistent gains and stronger out-of-distribution performance compared with sequence-only and shallow-fusion baselines, offering a biologically grounded route to scalable kinetic prediction and a foundation for adding cofactors, mutations, and time-resolved structural cues.",,foundation_model_agent,7.8,0.5,这篇工作偏基础模型/Agent方向，可能影响病原检测任务的建模上限，值得关注其任务定义与评测设计。,,foundation_model,,2603.12845v2,
"Dissecting clinical reasoning failures in frontier artificial intelligence using 10,000 synthetic cases",medRxiv,2026-04-23T00:00:00+00:00,https://www.medrxiv.org/content/10.64898/2026.04.22.26351488v1,"Background: Current medical large language model (LLM) evaluations largely rely on small collections of cases, whereas rigorous safety testing requires large-scale, diverse, and complex cases with verifiable ground truth. Multiple Sclerosis (MS) provides an ideal evaluation model, with validated diagnostic criteria and numerous paraclinical tests informing differential diagnosis, investigation, and management. Methods: We generated synthetic MS cases with ground-truth labels for diagnosis, localisation, and management. Four frontier LLMs (Gemini 3 Pro/Flash, GPT 5.2/5 mini) were instructed to analyse cases to provide anatomical localisation, differential diagnoses, investigations, and management plans. An automated evaluator compared these outputs to the ground-truth labels. Blinded subspecialty experts validated 70 cases for realism and automated evaluator accuracy. We then evaluated LLM decision-making across 1,000 cases and scaled to 10,000 to characterise rare, catastrophic failures. Results: Subspecialist expert review confirmed 100% synthetic case realism and 99.8% (95% CI 95.5 to 100) automated evaluation accuracy. Across 1,000 generated MS cases, all LLMs successfully included MS in the differential diagnoses for more than 91% cases. However, diagnostic competence did not associate with treatment safety. Gemini 3 models had low rates of clinically appropriate steroid recommendations (Flash: 7.2% 95% CI 5.6 to 8.8; Pro: 15.8% 95% CI 13.6 to 18.1) compared to GPT 5 mini (23.5% 95% CI 20.8 to 26.1), frequently overlooking contraindications like active infection. OpenAI models inappropriately recommended acute intravenous thrombolysis for MS cases (9.6% GPT 5.2; 6.4% GPT 5 mini) compared to below 1% for Gemini models. Expanded evaluation (to 10,000 cases) probed these errors in detail. Thrombolysis was recommended in 10.1% of cases lacking symptom timing information and paradoxically persisted (2.9%) even when symptoms were explicitly documented as more than 14 days old. Conclusion: Automated expert-level evaluation across 10,000 cases characterised artificial intelligence clinical blind spots hitherto invisible to small-scale testing. Massive-scale simulation and automated interrogation should become standard for uncovering serious failures and implementing safety guardrails before clinical deployment exposes patients to risk.",,foundation_model_agent,7.15,0.75,这篇工作更接近临床/监测落地，适合评估其对快速识别、预警或治疗辅助的实际价值。,,clinical_application,10.64898/2026.04.22.26351488,,
Large language models and retrieval augmented generation for complex clinical codelists: evaluating performance and assessing failure modes,medRxiv,2026-04-24T00:00:00+00:00,https://www.medrxiv.org/content/10.64898/2026.04.23.26351098v1,"Objectives: Large language models (LLMs) have shown promise in creating clinical codelists for research purposes, a time-consuming task requiring expert domain knowledge. Here, we evaluate the performance and assess failure modes of a retrieval augmented generation (RAG) approach to creating clinical codelists for the large and complex medical terminology used by the Clinical Practice Research Datalink (CPRD). Materials & Methods: We set up a RAG system using a database of word embeddings of the medical terminology that we created using a general-purpose word embedding model (gemini-embedding). We developed 7 reference codelists presenting different challenges and tagged required and optional codes. We ran 168 evaluations (7 codelists, 2 different database subsets, 4 models, 3 epochs each). Scoring was based on the omission of required codes, and inclusion of irrelevant codes. We used model-grading (i.e., grading by another LLM with the reference codelists provided as context) to evaluate the output codelists (a score of 0% being all incorrect and 100% being all correct). Results: We saw varying accuracy across models and codelists, with Gemini 3 Pro (Score 43%) generally performing better than Claude Sonnet 4.6 (36%), Gemini 3 Flash, and OpenAI GPT 5.2 performing worst (14%). Models performed better with shorter target codelists (e.g., Eosinophilic esophagitis with four codes, and Hidradenitis suppurativa with 14 codes). For example, all models consistently failed to produce a complete Wrist fracture codelist (with 214 required codes). We further present evaluation summaries, and failure mode evaluations produced by parsing LLM chat logs. Discussion: Besides demonstrating that a single-shot RAG approach is currently not suitable for codelist generation, we demonstrate failure modes including hallucinations, retrieval failures and generation failures where retrieved codes are not used. Conclusions: Our findings suggest that while RAG systems using current frontier LLMs may create correct clinical codelists in some cases, they still struggle with large and complex terminologies and codelists with a large number of codes. The failure mode we highlight can inform the creation of future workflows to avoid failures.",,foundation_model_agent,7.15,0.75,这篇工作偏基础模型/Agent方向，可能影响病原检测任务的建模上限，值得关注其任务定义与评测设计。,,foundation_model,10.64898/2026.04.23.26351098,,
MIMIC-IV-Phenotype-Atlas (MIPA) : A Publicly Available Dataset for EHR Phenotyping,medRxiv,2026-04-24T00:00:00+00:00,https://www.medrxiv.org/content/10.64898/2026.04.16.26350888v1,"Introduction Secondary use of electronic health records (EHRs) often requires transforming raw clinical information into research-grade data. A central step in this process is EHR phenotyping - the identification of patient cohorts defined by specific medical conditions. Although numerous approaches exist, from ICD-based heuristics to supervised learning and large language models (LLMs), the field lacks standardized benchmark datasets, limiting reproducibility and hindering fair comparison across methods. Methods We developed the MIMIC-IV Phenotype Atlas (MIPA) dataset, an adaptation of MIMIC-IV that provides expert-annotated discharge summaries across 16 phenotypes of varying prevalence and complexity. Two independent clinicians reviewed and labeled the discharge summaries, resolving disagreements by consensus. In parallel, we implemented a processing pipeline that extracts multimodal EHR features and generates training, validation, and testing datasets for supervised phenotyping. To illustrate MIPA's utility, we benchmarked four phenotyping methods : ICD-based classifiers, keyword-driven Term Frequency-Inverse Document Frequency (TF-IDF) classifiers, supervised machine learning (ML) models, and LLMs on the task. Results The final MIPA corpus consists of 1,388 expert-annotated discharge summaries. Annotation reliability was high (mean document-level kappa = 0.805, mean label-level kappa = 0.771), with 91% of disagreements resolved through consensus review. MIPA provides high-quality phenotype labels paired with structured EHR features and predefined train/validation/test splits for each phenotype. In the benchmarking case study, LLMs achieved the highest F1 scores in 13 of 16 phenotypes, particularly for conditions requiring contextual interpretation of clinical narrative, while supervised ML offered moderate improvements over rule-based baselines. Conclusion MIPA is the first publicly available benchmark dataset dedicated to EHR phenotyping, combining expert-curated annotations, broad phenotype coverage, and a reproducible processing pipeline. By enabling standardized comparison across ICD-based heuristics, ML models, and LLMs, MIPA provides a durable reference resource to advance methodological development in automated phenotyping.",,foundation_model_agent,7.1,1.25,这篇工作偏数据集或基准构建，适合判断是否能作为病原组学训练或评测资源。,,dataset,10.64898/2026.04.16.26350888,,
RVQ-Alpha: Bridging Single-Cell Transcriptomics and Large Language Models via Discrete Tokenization and Verifiable Reinforcement Learning,bioRxiv,2026-04-23T00:00:00+00:00,https://www.biorxiv.org/content/10.64898/2026.04.20.719773v1,"Integrating continuous single-cell gene expression profiles with discrete-token large language models (LLMs) remains an open challenge: text-based methods are token-inefficient and discard quantitative precision, continuous embeddings preclude autoregressive generation, and single-codebook vector quantization cannot stratify biological scales. We present RVQ-Alpha, an end-to-end framework that bridges this modality gap through three contributions: (i) a Residual Vector Quantization (RVQ) tokenizer that compresses each cell into a fixed 10-token sequence via eight residual codebooks embedded directly in the LLM vocabulary, requiring 3.4x fewer tokens than prior discrete methods and enabling bidirectional unification of cell interpretation and generation; (ii) scCoT-Synth, a teacher-student engine that grounds newly added biological tokens through evidence-before-conclusion reasoning, using the language modeling objective as the cross-modal alignment signal without a separate projection network; and (iii) a Fact-Aware RLVR system combining an ontology-grounded answer judge with saliency-weighted verification of biological claims against actual expression data, under dynamic gating that conditions hallucination suppression on task competence. Built on Qwen3-4B and trained via continued pretraining, supervised fine-tuning, and reinforcement learning, RVQ-Alpha substantially improves out-of-distribution generalization and rare-cell recognition across eight held-out datasets; ablations confirm that evidence-first grounding reduces hallucination more than fivefold.",,foundation_model_agent,6.45,6.0,这篇工作更像方法创新，可能直接关联 metagenomics、long-read 或 pathogen identification 流程优化。,,methods,10.64898/2026.04.20.719773,,
Comparing prognostic performance and reasoning between large language models and physicians,medRxiv,2026-04-25T00:00:00+00:00,https://www.medrxiv.org/content/10.64898/2026.04.17.26350898v1,"Importance: Physicians routinely prognosticate to guide care delivery and shared decision making, particularly when caring for patients with critical illnesses. Yet, these physician estimates are prone to inaccuracy and uncertainty. Artificial intelligence, including large language models (LLMs), show promise in supporting or improving this prognostication. However, the performance of contemporary LLMs in prognosticating for the heterogeneous population of critically ill patients remains poorly understood. Objective: To characterize and compare the performance of LLMs and physicians when predicting 6-month mortality for hospitalized adults who survived critical illness. Design: Embedded mixed methods study with elicitation and comparison of prognostic estimates and reasoning from LLMs and practicing physicians. Setting: The publicly available, deidentified Medical Information Mart for Intensive Care (MIMIC)-IV v2.2 dataset. Participants: We randomly selected 100 hospitalizations of adult survivors of critical illness. Four contemporary LLMs (Open AI GPT-4o, o3- and o4-mini, and DeepSeek-R1) and 7 physicians provided independent prognostic estimates for each case (1,100 total estimates; 400 LLM and 700 physician). Main outcomes and measures: For each case, LLMs and physicians used the hospital discharge summary and demographics to predict 6-month mortality (yes/no) and provide their reasoning (free text). We assessed prognostic performance using accuracy, sensitivity, and specificity, and used inductive, qualitative content analysis to characterize reasonings. Results: Mean physician accuracy for predicting mortality was 70.1% (95% CI 63.7-76.4%), with sensitivity of 59.7% (95% CI 50.6-68.8%) and specificity of 80.6% (95% CI 71.7-88.2%). The top-performing LLM (OpenAI o4-mini) accuracy was 78.0% (95% CI 70.0-86.0%), with sensitivity of 80.0% (95% CI 67.4-90.2%) and specificity of 76.0% (95% CI 63.3-88.0%). The difference between mean physician and top-performing LLM accuracy was not statistically significant (p = 0.5). Qualitative analysis revealed similar patterns in LLM and physician expressed reasoning, except that physicians regularly and explicitly reported uncertainty while LLMs did not. Conclusion and Relevance: In this study, LLMs and physicians achieved comparable, moderate performance in predicting 6-month mortality after critical illness, with similar patterns in expressed reasoning. Our findings suggest LLMs could be used to support prognostication in clinical practice but also raise safety concerns due to the lack of LLM uncertainty expression.",,foundation_model_agent,6.45,6.0,这篇工作偏基础模型/Agent方向，可能影响病原检测任务的建模上限，值得关注其任务定义与评测设计。,,foundation_model,10.64898/2026.04.17.26350898,,
Large Language Model Agent Enables Autonomous Machine Learning Model Building for Biomedicine,bioRxiv,2026-04-23T00:00:00+00:00,https://www.biorxiv.org/content/10.64898/2026.04.20.719735v1,"Machine learning accelerates biomedical discovery, but creating effective predictive models requires specialized human expertise and demanding manual effort. Researchers must iteratively design pipelines, select architectures, and debug code. This challenge is particularly severe in biomedicine because of the heterogeneous datasets, sparse annotations, and complex evaluation protocols one must deal with. We present AIDO.Harness, an agentic artificial intelligence system that fully automates the entire life-cycle of biomedical model development. Provided only with a natural language task description and a target metric, AIDO.Harness autonomously constructs executable training and evaluation pipelines. The system selects optimal modeling strategies, executes experiments, and uses automated feedback-loop to iteratively revise its own code, configurations, and training procedures. It flexibly adapts to new tasks by training specialized models de novo or refining pretrained foundation models. We show that across diverse biomedical benchmarks, AIDO.Harness produces highly competitive solutions against human alternatives, while eliminating the manual iteration previously required for robust model development. By automating the translation of raw data into reliable AI models, AIDO.Harness demonstrates how AI itself can be used to accelerate AI for biomedical research.",,foundation_model_agent,6.15,7.25,这篇工作偏基础模型/Agent方向，可能影响病原检测任务的建模上限，值得关注其任务定义与评测设计。,,foundation_model,10.64898/2026.04.20.719735,,
"Back to BERT in 2026: ModernGENA as a Strong, Efficient Baseline for DNA Foundation Models",bioRxiv,2026-04-23T00:00:00+00:00,https://www.biorxiv.org/content/10.64898/2026.04.21.719816v1,"Recent advances in DNA language models have mainly come from building larger and more complex architectures, making it harder to understand the effect of changes to standard components such as the transformer layers widely used in NLP. In this work, we study whether and how a modernized BERT-style backbone (ModernBERT) can be adapted to genomic sequence modeling to improve computational efficiency, training stability, and downstream performance. Under controlled experimental settings, we benchmark efficiency across a range of sequence lengths and evaluate downstream performance on the Nucleotide Transformer benchmark. The resulting model, ModernGENA, achieves a strong efficiency-quality trade-off and ranks among the top-performing models in our evaluation suite. To support reproducibility and provide a solid default reference point for future architectural work in genomics, we release the full implementation and configuration of ModernGENA as an open, reusable baseline, and make ModernGENA base and ModernGENA large publicly available through the DNA language models collection on Hugging Face.",,foundation_model_agent,5.75,6.25,这篇工作偏基础模型/Agent方向，可能影响病原检测任务的建模上限，值得关注其任务定义与评测设计。,,foundation_model,10.64898/2026.04.21.719816,,
