title,source,date,url,abstract,abstract_zh,matched_topics,relevance_score,novelty_score,why_it_matters,analysis_zh,category,doi,arxiv_id,pubmed_id
PREBA: Surgical Duration Prediction via PCA-Weighted Retrieval-Augmented LLMs and Bayesian Averaging Aggregation,arXiv,2026-02-27T07:19:23+00:00,http://arxiv.org/abs/2603.13275v2,"Accurate prediction of surgical duration is pivotal for hospital resource management. Although recent supervised learning approaches-from machine learning (ML) to fine-tuned large language models (LLMs)-have shown strong performance, they remain constrained by the need for high-quality labeled data and computationally intensive training. In contrast, zero-shot LLM inference offers a promising training-free alternative but it lacks grounding in institution-specific clinical context (e.g., local demographics and case-mix distributions), making its predictions clinically misaligned and prone to instability. To address these limitations, we present PREBA, a retrieval-augmented framework that integrates PCA-weighted retrieval and Bayesian averaging aggregation to ground LLM predictions in institution-specific clinical evidence and statistical priors. The core of PREBA is to construct an evidence-based prompt for the LLM, comprising (1) the most clinically similar historical surgical cases and (2) clinical statistical priors. To achieve this, PREBA first encodes heterogeneous clinical features into a unified representation space enabling systematic retrieval. It then performs PCA-weighted retrieval to identify clinically relevant historical cases, which form the evidence context supplied to the LLM. Finally, PREBA applies Bayesian averaging to fuse multi-round LLM predictions with population-level statistical priors, yielding calibrated and clinically plausible duration estimates. We evaluate PREBA on two real-world clinical datasets using three state-of-the-art LLMs, including Qwen3, DeepSeek-R1, and HuatuoGPT-o1. PREBA significantly improves performance-for instance, reducing MAE by up to 40% and raising R^2 from -0.13 to 0.62 over zero-shot inference-and it achieves accuracy competitive with supervised ML methods, demonstrating strong effectiveness and generalization.",,foundation_model_agent,5.75,0.75,这篇工作偏基础模型/Agent方向，可能影响病原检测任务的建模上限，值得关注其任务定义与评测设计。,,foundation_model,,2603.13275v2,
HERCULES: an integrative deep-learning framework for predicting RNA-binding propensity and mutation effects at single-residue resolution,bioRxiv,2026-03-18T00:00:00+00:00,https://www.biorxiv.org/content/10.64898/2026.03.17.712455v1,"RNA-binding proteins (RBPs) regulate essential aspects of RNA metabolism, yet accurately identifying RNA-binding domains (RBDs) and quantifying the impact of sequence variation on RNA-binding ability remain challenging. Here, we present HERCULES (Hybrid framEwoRk for RNA-binding domain loCalization and mUtation anaLysis using physicochemical and languagE modelS), a unified sequence-based framework for simultaneous RBD localization, global RNA-binding propensity prediction and mutation effect assessment. HERCULES integrates a fine-tuned protein language model with an explicit residue-level physicochemical module, combining global contextual representations with local mutation-sensitive descriptors. On an independent test set, the HERCULES global score discriminates RBPs from non-RBPs with an AUROC of 0.86. At residue resolution, HERCULES outperforms state-of-the-art sequence-based predictors in identifying canonical, non-canonical and putative RBDs across Pfam-annotated proteins. Using a curated dataset of experimentally validated RNA-binding-disrupting mutations, HERCULES correctly classifies 87% of deleterious variants, including single-amino acid substitutions. Evaluation on experimentally resolved protein-RNA complexes further demonstrates robust residue-level performance and improved generalization when contact annotations are augmented with AlphaFold3-predicted complexes. By unifying domain localization and mutation sensitivity within a single sequence-only framework, HERCULES provides a mechanistically interpretable approach for studying RNA-protein interactions. HERCULES is freely available at https://tools.tartaglialab.com/hercules and as an open-source Python package at https://github.com/tartaglialabIIT/hercules.git.",,foundation_model_agent,5.75,0.75,这篇工作更像方法创新，可能直接关联 metagenomics、long-read 或 pathogen identification 流程优化。,,methods,10.64898/2026.03.17.712455,,
SOORENA: Self-lOOp containing or autoREgulatory Nodes in biological network Analysis,bioRxiv,2026-03-19T00:00:00+00:00,https://www.biorxiv.org/content/10.1101/2025.11.03.685842v4,"Autoregulatory mechanisms, in which proteins regulate their own activity or expression, are fundamental to biological networks but are challenging to identify systematically from literature. To address this gap, we present SOORENA (https://soorena.it.helsinki.fi/soorena/), a two-stage transformer model that predicts and classifies protein autoregulation in PubMed abstracts. SOORENA was trained on 1,332 experimentally validated abstracts and achieved 96.0 percent accuracy and 97.8 percent precision in stage one, with stage two achieving 95.5 percent accuracy and 96.2 percent macro-F1 across seven mechanistic classes. Applied to 3.34 million abstracts, SOORENA identified 85,145 publications containing autoregulatory mechanisms, yielding 97,657 protein-specific records. Integration with curated databases generated 100,065 comprehensive entries accessible via an interactive Shiny application. By systematically cataloging self-regulatory interactions, which often act as bottlenecks in dynamic network modeling, SOORENA provides a resource that supports mechanistic interpretation, model reduction, and predictive systems-level analyses. These results demonstrate that domain-specific language models can scale the discovery and curation of biologically essential self-regulatory mechanisms, bridging literature mining and systems biology.",,foundation_model_agent,5.75,0.25,这篇工作偏基础模型/Agent方向，可能影响病原检测任务的建模上限，值得关注其任务定义与评测设计。,,foundation_model,10.1101/2025.11.03.685842,,
ST-PARM: Pareto-Complete Inference-Time Alignment for Multi-Objective Protein Design,bioRxiv,2026-03-19T00:00:00+00:00,https://www.biorxiv.org/content/10.64898/2026.03.17.712483v1,"Motivation: Protein engineering is inherently multi-objective: improving one property can degrade others, so practical workflows require generating non-dominated (Pareto-optimal) candidates spanning a trade-off surface. Linear objective scalarization and deterministic pairwise preference learning can under-explore non-convex Pareto regions and amplify noise from uncertain evaluators, limiting Pareto coverage and trade-off controllability. Results: We introduce Smooth Tchebycheff Preference-Aware Reward Model (ST-PARM), an inference-time alignment framework that steers a frozen protein language model along user-specified trade-offs with a lightweight reward model trained only once. ST-PARM combines (i) a reward-calibrated pairwise preference loss that is uncertainty-aware by down-weighting ambiguous comparisons under noises, (ii) a smooth Tchebycheff scalarization that is Pareto-complete in principle and improves empirical trade-off coverage, and (iii) latent-space pair-construction strategies. On GFP fluorescence--stability (full-length design) and IL-6 nanobody stability--solubility (CDR3+suffix design), ST-PARM delivers broader Pareto coverage and stronger preference tracking than baselines PARM and MosPro. For GFP, a conservative structural screen for local confidence and global fold preservation retains a broad frontier and strong controllability, yielding an actionable cohort for downstream assays. We also provide cross-evaluator robustness checks, a three-objective extension, and a natural-language alignment generality check in the Supplement, establishing a practical foundation for controllable sequence generation under competing multi-objectives and noisy measurements. Availability and Implementation: https://github.com/Shen-Lab/ST-PARM.",,foundation_model_agent,5.75,0.25,这篇工作更像方法创新，可能直接关联 metagenomics、long-read 或 pathogen identification 流程优化。,,methods,10.64898/2026.03.17.712483,,
Clinician Experiences with Ambient AI Scribe Technology in Singapore: A Qualitative Study,medRxiv,2026-03-19T00:00:00+00:00,https://www.medrxiv.org/content/10.64898/2026.03.17.26348627v1,"Background: The administrative burden of clinical documentation is a recognised contributor to clinician burnout and diminished care quality. Ambient artificial intelligence (AI) scribe technology, which uses large language models to passively record and summarise clinical encounters, has rapidly gained traction internationally. However, no published studies have examined clinician experiences with this technology in the Asia-Pacific region or within Singapore's multilingual healthcare system. Objective: This study explored clinician perspectives on ambient AI scribe technology at Alexandra Hospital, Singapore, focusing on perceived benefits, barriers, workflow integration, ethical considerations, and recommendations for sustained implementation. Methods: A qualitative descriptive study was conducted using semi-structured interviews with 28 clinicians across multiple specialties at Alexandra Hospital, National University Health System (NUHS). Participants were purposively sampled for diversity in role, specialty, and usage level. Interviews were analysed using reflexive thematic analysis guided by the RE-AIM/PRISM framework. The COREQ checklist was followed. Results: Five themes emerged: (1) reclaiming presence in the clinical encounter, (2) navigating accuracy and trust in AI-generated documentation, (3) workflow disruption and adaptation, (4) privacy, consent, and ethical tensions within Singapore's regulatory landscape, and (5) envisioning sustainable integration. Clinicians reported improved patient engagement and reduced cognitive burden. Persistent barriers included accuracy concerns, AI hallucinations, limited multilingual functionality, loss of documentation style, and uncertainties around compliance with the Personal Data Protection Act (PDPA). Conclusions: Ambient AI scribe technology holds promise for alleviating documentation burden in Singapore's public healthcare system. Realising this potential requires attention to safety validation, multilingual capability, clinician training, and patient-centred consent aligned with local regulatory frameworks.",,foundation_model_agent,5.75,0.25,这篇工作更接近临床/监测落地，适合评估其对快速识别、预警或治疗辅助的实际价值。,,clinical_application,10.64898/2026.03.17.26348627,,
InferDPT: Privacy-Preserving Inference for Closed-box Large Language Model,arXiv,2023-10-18T18:00:11+00:00,http://arxiv.org/abs/2310.12214v8,"Large language models (LLMs), like ChatGPT, have greatly simplified text generation tasks. However, they have also raised concerns about privacy risks such as data leakage and unauthorized data collection. Existing solutions for privacy-preserving inference face practical challenges related to computation time and communication costs. In this paper, we propose InferDPT, the first practical framework for the privacy-preserving Inference of black-box LLMs, implementing Differential Privacy in Text generation. InferDPT comprises two key modules: the ""perturbation module"" utilizes the exponential mechanism to generate a perturbed prompt, facilitating privacy-preserving inference with black-box LLMs, and the ""extraction module"", inspired by knowledge distillation and retrieval-augmented generation, extracts coherent and consistent text from the perturbed generation result, ensuring successful text generation completion. To address privacy concerns related to previous exponential mechanisms' susceptibility to embedding revision attacks, we introduce RANTEXT, a novel differential privacy mechanism integrated into the perturbation module of InferDPT, which introduces the concept of ""RANdom adjacency"" for TEXT perturbation within the prompt. Experimental results across three datasets demonstrate that the text generation quality of InferDPT is comparable to that of non-private GPT-4, and RANTEXT surpasses existing state-of-the-art mechanisms, namely, SANTEXT+ and CUSTEXT+ in the trade-off between privacy and utility. Even with an privacy parameter epsilon value of 6.0, RANTEXT achieves an average privacy protection rate exceeding 90% against embedding revision attacks, which is 0.58 times higher than that of SANTEXT+ and 3.35 times higher than that of CUSTEXT+.",,foundation_model_agent,5.45,1.0,这篇工作偏基础模型/Agent方向，可能影响病原检测任务的建模上限，值得关注其任务定义与评测设计。,,foundation_model,,2310.12214v8,
RAGXplain: From Explainable Evaluation to Actionable Guidance of RAG Pipelines,arXiv,2025-05-18T17:25:34+00:00,http://arxiv.org/abs/2505.13538v2,"Retrieval-Augmented Generation (RAG) systems couple large language models with external knowledge, yet most evaluation methods report aggregate scores that reveal whether a pipeline underperforms but not where or why. We introduce RAGXplain, an evaluation framework that translates performance metrics into actionable guidance. RAGXplain structures evaluation around a 'Metric Diamond' connecting user input, retrieved context, generated answer, and (when available) ground truth via six diagnostic dimensions. It uses LLM reasoning to produce natural-language failure-mode explanations and prioritized interventions. Across five QA benchmarks, applying RAGXplain's recommendations in a single human-guided pass consistently improves RAG pipeline performance across multiple metrics. We release RAGXplain as open source to support reproducibility and community adoption.",,foundation_model_agent,5.45,1.0,这篇工作更像方法创新，可能直接关联 metagenomics、long-read 或 pathogen identification 流程优化。,,methods,,2505.13538v2,
Adaptive Guidance for Retrieval-Augmented Masked Diffusion Models,arXiv,2026-03-18T12:54:50+00:00,http://arxiv.org/abs/2603.17677v1,"Retrieval-Augmented Generation (RAG) improves factual grounding by incorporating external knowledge into language model generation. However, when retrieved context is noisy, unreliable, or inconsistent with the model's parametric knowledge, it introduces retrieval-prior conflicts that can degrade generation quality. While this problem has been studied in autoregressive language models, it remains largely unexplored in diffusion-based language models, where the iterative denoising process introduces unique challenges for integrating retrieved context. In this work, we propose Adaptive Retrieval-Augmented Masked Diffusion (ARAM), a training-free adaptive guidance framework for Masked Diffusion Models (MDMs) in RAG settings. ARAM dynamically calibrates the guidance scale during denoising according to the Signal-to-Noise Ratio (SNR) of the distributional shift induced by retrieved context. Intuitively, the model strengthens guidance when the retrieved context provides reliable corrective evidence and suppresses it when the contextual signal is noisy or non-supportive. Extensive experiments on multiple knowledge-intensive QA benchmarks show that ARAM improves overall QA performance over competitive RAG baselines.",,foundation_model_agent,5.45,1.0,这篇工作更像方法创新，可能直接关联 metagenomics、long-read 或 pathogen identification 流程优化。,,methods,,2603.17677v1,
Prompt Control-Flow Integrity: A Priority-Aware Runtime Defense Against Prompt Injection in LLM Systems,arXiv,2026-03-19T02:50:15+00:00,http://arxiv.org/abs/2603.18433v1,"Large language models (LLMs) deployed behind APIs and retrieval-augmented generation (RAG) stacks are vulnerable to prompt injection attacks that may override system policies, subvert intended behavior, and induce unsafe outputs. Existing defenses often treat prompts as flat strings and rely on ad hoc filtering or static jailbreak detection. This paper proposes Prompt Control-Flow Integrity (PCFI), a priority-aware runtime defense that models each request as a structured composition of system, developer, user, and retrieved-document segments. PCFI applies a three-stage middleware pipeline, lexical heuristics, role-switch detection, and hierarchical policy enforcement, before forwarding requests to the backend LLM. We implement PCFI as a FastAPI-based gateway for deployed LLM APIs and evaluate it on a custom benchmark of synthetic and semi-realistic prompt-injection workloads. On the evaluated benchmark suite, PCFI intercepts all attack-labeled requests, maintains a 0% False Positive Rate, and introduces a median processing overhead of only 0.04 ms. These results suggest that provenance- and priority-aware prompt enforcement is a practical and lightweight defense for deployed LLM systems.",,foundation_model_agent,5.45,1.0,这篇工作偏基础模型/Agent方向，可能影响病原检测任务的建模上限，值得关注其任务定义与评测设计。,,foundation_model,,2603.18433v1,
Rule-Based Explanations for Retrieval-Augmented LLM Systems,arXiv,2025-10-26T14:22:07+00:00,http://arxiv.org/abs/2510.22689v2,"If-then rules are widely used to explain machine learning models; e.g., ""if employed = no, then loan application = rejected."" We present the first proposal to apply rules to explain the emerging class of large language models (LLMs) with retrieval-augmented generation (RAG). Since RAG enables LLM systems to incorporate retrieved information sources at inference time, rules linking the presence or absence of sources can explain output provenance; e.g., ""if a Times Higher Education ranking article is retrieved, then the LLM ranks Oxford first."" To generate such rules, a brute force approach would probe the LLM with all source combinations and check if the presence or absence of any sources leads to the same output. We propose optimizations to speed up rule generation, inspired by Apriori-like pruning from frequent itemset mining but redefined within the scope of our novel problem. We conclude with qualitative and quantitative experiments demonstrating our solutions' value and efficiency.",,foundation_model_agent,5.45,0.5,这篇工作偏基础模型/Agent方向，可能影响病原检测任务的建模上限，值得关注其任务定义与评测设计。,,foundation_model,,2510.22689v2,
LLM-Augmented Changepoint Detection: A Framework for Ensemble Detection and Automated Explanation,arXiv,2026-01-06T12:04:38+00:00,http://arxiv.org/abs/2601.02957v3,"This paper introduces a novel changepoint detection framework that combines ensemble statistical methods with Large Language Models (LLMs) to enhance both detection accuracy and the interpretability of regime changes in time series data. Two critical limitations in the field are addressed. First, individual detection methods exhibit complementary strengths and weaknesses depending on data characteristics, making method selection non-trivial and prone to suboptimal results. Second, automated, contextual explanations for detected changes are largely absent. The proposed ensemble method aggregates results from ten distinct changepoint detection algorithms, achieving superior performance and robustness compared to individual methods. Additionally, an LLM-powered explanation pipeline automatically generates contextual narratives, linking detected changepoints to potential real-world historical events. For private or domain-specific data, a Retrieval-Augmented Generation (RAG) solution enables explanations grounded in user-provided documents. The open source Python framework demonstrates practical utility in diverse domains, including finance, political science, and environmental science, transforming raw statistical output into actionable insights for analysts and decision-makers.",,foundation_model_agent,5.45,0.5,这篇工作更像方法创新，可能直接关联 metagenomics、long-read 或 pathogen identification 流程优化。,,methods,,2601.02957v3,
LR-Robot: A Unified Supervised Intelligent Framework for Real-Time Systematic Literature Reviews with Large Language Models,arXiv,2026-03-18T13:43:07+00:00,http://arxiv.org/abs/2603.17723v1,"Recent advances in artificial intelligence (AI) and natural language processing (NLP) have enabled tools to support systematic literature reviews (SLRs), yet existing frameworks often produce outputs that are efficient but contextually limited, requiring substantial expert oversight.The framework employs a human-in-the-loop process to define sub-SLR tasks, evaluate models, and ensure methodological rigor, while leveraging structured knowledge sources and retrieval-augmented generation (RAG) to enhance factual grounding and transparency. LR-Robot enables multidimensional categorization of research, maps relationships among papers, identifies high-impact works, and supports historical, fine-grained analyses of topic evolution. We demonstrate the framework using an option pricing case study, enabling comprehensive literature analysis. Empirical results reveal the current capabilities of AI in understanding and synthesizing literature, uncover emerging trends, reveal topic connections, and highlight core research directions. By accelerating labor-intensive review stages while preserving interpretive accuracy, LR-Robot provides a practical, customizable, and high-quality approach for AI-assisted SLRs. Key contributions: (1) a novel framework combining AI and expert supervision for contextually informed SLRs, (2) support for multidimensional categorization, relationship mapping, and fine-grained topic evolution analysis, and (3) empirical demonstration of AI-driven literature synthesis in the field of option pricing.",,foundation_model_agent,5.45,0.5,这篇工作更像方法创新，可能直接关联 metagenomics、long-read 或 pathogen identification 流程优化。,,methods,,2603.17723v1,
Retrieval-Augmented LLM Agents: Learning to Learn from Experience,arXiv,2026-03-18T20:45:04+00:00,http://arxiv.org/abs/2603.18272v1,"While large language models (LLMs) have advanced the development of general-purpose agents, achieving robust generalization to unseen tasks remains a significant challenge. Current approaches typically rely on either fine-tuning or training-free memory-augmented generation using retrieved experience; yet both have limitations: fine-tuning often fails to extrapolate to new tasks, while experience retrieval often underperforms compared to supervised baselines. In this work, we propose to combine these approaches and systematically study how to train retrieval-augmented LLM agents to effectively leverage retrieved trajectories in-context. First, we establish a robust supervised fine-tuning (SFT) recipe using LoRA that outperforms several state-of-the-art agent training pipelines. Second, we provide a detailed analysis of key design choices for experience retrieval, identifying optimal strategies for storage, querying, and trajectory selection. Finally, we propose a pipeline that integrates experience retrieval into the fine-tuning process. Our results demonstrate that this combined approach significantly improves generalization to unseen tasks, providing a scalable and effective framework for building agents that learn to learn from experience.",,foundation_model_agent,5.45,0.5,这篇工作更像方法创新，可能直接关联 metagenomics、long-read 或 pathogen identification 流程优化。,,methods,,2603.18272v1,
Multimodal Model for Computational Pathology:Representation Learning and Image Compression,arXiv,2026-03-19T09:24:44+00:00,http://arxiv.org/abs/2603.18660v1,"Whole slide imaging (WSI) has transformed digital pathology by enabling computational analysis of gigapixel histopathology images. Recent foundation model advances have accelerated progress in computational pathology, facilitating joint reasoning across pathology images, clinical reports, and structured data. Despite this progress, challenges remain: the extreme resolution of WSIs creates computational hurdles for visual learning; limited expert annotations constrain supervised approaches; integrating multimodal information while preserving biological interpretability remains difficult; and the opacity of modeling ultra-long visual sequences hinders clinical transparency. This review comprehensively surveys recent advances in multimodal computational pathology. We systematically analyze four research directions: (1) self-supervised representation learning and structure-aware token compression for WSIs; (2) multimodal data generation and augmentation; (3) parameter-efficient adaptation and reasoning-enhanced few-shot learning; and (4) multi-agent collaborative reasoning for trustworthy diagnosis. We specifically examine how token compression enables cross-scale modeling and how multi-agent mechanisms simulate a pathologist's ""Chain of Thought"" across magnifications to achieve uncertainty-aware evidence fusion. Finally, we discuss open challenges and argue that future progress depends on unified multimodal frameworks integrating high-resolution visual data with clinical and biomedical knowledge to support interpretable and safe AI-assisted diagnosis.",,foundation_model_agent,4.85,1.5,这篇工作偏基础模型/Agent方向，可能影响病原检测任务的建模上限，值得关注其任务定义与评测设计。,,foundation_model,,2603.18660v1,
