title,source,date,url,abstract,abstract_zh,matched_topics,relevance_score,novelty_score,why_it_matters,analysis_zh,category,doi,arxiv_id,pubmed_id
Bio-BLIP: A Multimodal Architecture for Transferable Reasoning in Genomic Variant Interpretation,bioRxiv,2026-05-15T00:00:00+00:00,https://www.biorxiv.org/content/10.64898/2026.05.12.724740v1,"Developing scientific hypotheses in biology requires integrating heterogeneous evidence across DNA sequence, gene context, protein function, and prior literature. Existing multimodal AI systems expose biological evidence to reasoning models through textification or by projecting biological embeddings into fine-tuned language models. However, these models are typically highly optimized the specific set of tasks for which they are fine-tuned. Here we present Bio-BLIP, a multimodal Q-former based architecture which leverages biological embeddings and a LLM to generalize to complex reasoning tasks without task-specific fine-tuning. The key to Bio-BLIP is a new neural network architecture that integrates four data modalities - DNA, genes, proteins, and text - through a master Qformer model, which integrates the modality-specific information into a fixed-length prefix for the LLM backbone. Bio-BLIP is pretrained on the task of human genetic variant annotation and achieves a 29.8\% increase in generating accurate variant features over frontier LLMs. We evaluate Bio-BLIP zero-shot on downstream genomic tasks of variant prioritization and target gene prediction. Bio-BLIP outperforms two alignment-free genomic language models on regulatory variant prioritization for Mendelian disease. Across the target gene prediction task, Bio-BLIP improves accuracy over LLMs by leveraging learned genomic variant knowledge in difficult cases. Bio-BLIP consistently produces rich, transparent reasoning traces. In biological domains characterized by multiple scales of data and varied downstream tasks, Bio-BLIP offers a step toward natively multimodal, generalizable reasoning.",,foundation_model_agent,8.9,6.0,这篇工作偏基础模型/Agent方向，可能影响病原检测任务的建模上限，值得关注其任务定义与评测设计。,,foundation_model,10.64898/2026.05.12.724740,,
MethylCurate: Tool For Dataset Curation and Epigenetic Aging Clock Evaluation,bioRxiv,2026-05-14T00:00:00+00:00,https://www.biorxiv.org/content/10.64898/2026.05.11.723515v1,"SummaryDNA methylation datasets from public repositories such as NCBI Gene Expression Omnibus are central to the development and evaluation of epigenetic aging clocks, yet existing resources and tools do not fully resolve the bottlenecks of dataset retrieval and metadata harmonization. Current benchmarking frameworks often rely on static curated collections, support only a subset of available Gene Expression Omnibus studies, focus on specific tissues, or require substantial manual intervention when metadata fields and supplementary files are inconsistently structured across studies. We developed MethylCurate, an agentic AI framework that addresses these limitations by automating the retrieval of DNA methylation datasets from the Gene Expression Omnibus, harmonizing heterogeneous metadata, mapping datasets to a unified format, and enabling scalable evaluation of epigenetic aging clocks through an integrated, dialogue-driven workflow. Availability and ImplementationMethylCurate is implemented in Python and combines deterministic modules for Gene Expression Omnibus dataset retrieval, quality control, and clock evaluation with large language model-assisted agents for metadata extraction, metadata harmonization, and DNA methylation data parsing. Source code, documentation, and example workflows are available at: https://github.com/Travyse/methylcurate Contacttravyse.edwards@pennmedicine.upenn.edu Supplementary InformationSupplementary data are available at Bioinformatics online. Graphical AbstractMethylCurate is an agentic-AI framework that converts user-specified NCBI Gene Expression Omnibus DNA methylation datasets into standardized metadata, beta matrices, artifacts, logs, and aging clock benchmarking outputs through automated retrieval, quality control, metadata extraction, harmonization, and evaluation workflows. Figure generated with Biorender. O_FIG O_LINKSMALLFIG WIDTH=200 HEIGHT=51 SRC=""FIGDIR/small/723515v1_ufig1.gif"" ALT=""Figure 1""> View larger version (12K): org.highwire.dtl.DTLVardef@34028dorg.highwire.dtl.DTLVardef@93a852org.highwire.dtl.DTLVardef@fdc4forg.highwire.dtl.DTLVardef@148f3b3_HPS_FORMAT_FIGEXP M_FIG C_FIG Key MessagesO_LIAutomated curation of DNA methylation datasets from the Gene Expression Omnibus. C_LIO_LIStandardized preprocessing and metadata harmonization. C_LIO_LIIntegrated benchmarking of epigenetic aging clocks. C_LI",,foundation_model_agent,7.15,6.75,这篇工作偏数据集或基准构建，适合判断是否能作为病原组学训练或评测资源。,,dataset,10.64898/2026.05.11.723515,,
OmniGene-4: A Unified Bio-Language MoE Model with Router-Level Interpretability,bioRxiv,2026-05-14T00:00:00+00:00,https://www.biorxiv.org/content/10.64898/2026.05.12.724542v1,"Mixture-of-Experts (MoE) architectures offer a rare opportunity to probe the internal organization of large language models, but this affordance has not been systematically exploited in biological foundation modeling. We introduce OmniGene-4, a unified bio-language foundation model built on Gemma-4-26B-A4B (30 layers, 128 experts per layer, top-8 routing) by injecting 28,028 biological tokens (DNA and protein BPE, Foldseek 3Di, DSSP secondary structure), continuing pretraining (CPT) on a 32.5 GB mixture of DNA, protein, natural-language and structural corpora, and supervised fine-tuning (SFT) on 199,576 instruction-format examples spanning eight task families. On a suite of standard benchmarks, the final model (v3) reaches 99.95% accuracy on BioPAWS standard protein homology (6,000 pairs), 59.50% on remote homology (2,000 pairs from protein_pair_remote), and 93.66% on BixBench knowledge questions. Relative to its un-fine-tuned vocabulary-extended Gemma-4-Instruct baseline (85% / 60% / 87%), v3 gains +14.5 on Standard, is comparable on Remote (-0.5, within statistical noise on this 2,000-pair sample), and gains +6.7 on BixBench. We do not claim parity with specialist remote-homology tools; published numbers for ESM-2, CATHe and PLMSearch on differently constructed splits reach 65--75%, and closing this gap is discussed as an open problem. By installing forward hooks on every router we directly measure how CPT and SFT each reshape expert routing. Across 400 prompts drawn from 8 modalities, the mean pair-wise Jensen--Shannon divergence between task routing distributions, averaged over the 30 layers, rises from 0.138 (vocabulary-extended baseline) to 0.230 after CPT and further to 0.232 after the full CPT+SFT pipeline. Under this layer-averaged metric, most of the increase (Delta JS +0.092) occurs during CPT, with the SFT stage contributing a small further rise (Delta JS +0.002). The layer-wise picture is more nuanced: CPT reshapes routing in middle transformer layers (L_11--L_22, peak +0.16 at L_12), while SFT primarily reshapes the final two layers (L_28, L_29, peak +0.048 at L_29), so SFT is small under the aggregate metric but non-trivial at the layers nearest lm_head. We summarize this as a tentative representation/output-alignment factorization of bio-foundation training. At the token level, layer-12 routing reveals experts with strongly skewed token preferences, including an English-function-word expert at 80% NL purity, two DNA-dinucleotide experts, an amino-acid expert, and a cellular-biology expert; absolute purities for other experts are modest (15--46%), and we do not assume that ""the same expert ID"" refers to the same object across different layers. These findings are exploratory --- a single architecture, a single training run, and a small-N routing sample --- and we explicitly frame them as such throughout.",,foundation_model_agent,7.15,6.75,这篇工作偏基础模型/Agent方向，可能影响病原检测任务的建模上限，值得关注其任务定义与评测设计。,,foundation_model,10.64898/2026.05.12.724542,,
MetaGEM: Bottom-Up Reconstruction of Genome-Scale Metabolic Networks via Deep Enzyme-Metabolite Anchoring,arXiv,2026-05-14T13:25:22+00:00,http://arxiv.org/abs/2605.14812v1,"Genome-scale metabolic models (GEMs) are essential tools for systems biology and rational chassis design, but conventional top-down reconstruction depends heavily on sequence homology and often leaves unknown enzymes and metabolic dark matter unresolved. Direct reconstruction from metabolomics is also difficult because mapping observed metabolites to reactions is an ill-posed inverse problem with combinatorial ambiguity and possible spurious networks. Here we present MetaGEM, a bottom-up framework that uses enzymes as physical anchors to convert system-level network inference into enzyme-metabolite interaction prediction. MetaGEM uses a multimodal dual-tower architecture that combines protein evolutionary semantics from a protein language model with three-dimensional metabolite representations. It further introduces contrastive learning with hard negative mining to separate structurally similar metabolites and reduce false positive interactions. On a de-homologized benchmark, MetaGEM achieves state-of-the-art enzyme-metabolite prediction performance, with AUROC of 0.9701 and MCC of 0.8033, and remains robust under low sequence identity splits. In downstream reconstruction, MetaGEM generates functional genome-scale metabolic models for Escherichia coli, Bacillus subtilis, and Pseudomonas aeruginosa. The reconstructed models improve network connectivity, capture promiscuous enzymes, and show strong agreement with experimental phenotype microarray and gene essentiality data. These results indicate that MetaGEM provides a practical route from metabolomic evidence to computable metabolic networks and offers a foundation for automated AI-driven virtual cell reconstruction.",,foundation_model_agent,8.5,1.25,这篇工作更像方法创新，可能直接关联 metagenomics、long-read 或 pathogen identification 流程优化。,,methods,,2605.14812v1,
Towards Label-Free Single-Cell Phenotyping Using Multi-Task Learning,arXiv,2026-05-14T11:38:56+00:00,http://arxiv.org/abs/2605.14717v1,"Label-free single-cell imaging offers a scalable, non-invasive alternative to fluorescence-based cytometry, yet inferring molecular phenotypes directly from bright-field morphology remains challenging. We present a unified Deep Learning (DL) framework that jointly performs White Blood Cell (WBC) classification and continuous protein-expression regression from label-free Differential Phase Contrast (DPC) images. Our model employs a Hybrid architecture that fuses convolutional fine-grained texture features with transformer-based global representations through a learnable cross-branch gating module, enabling robust morpho-molecular inference from DPC images. To support downstream interpretability, we further incorporate a Large Language Model (LLM) that generates concise, biologically grounded summaries of the predicted cell states. Experiments on the Berkeley Single Cell Computational Microscopy (BSCCM) and Blood Cells Image benchmarks demonstrate strong performance, achieving a 91.3% WBC classification accuracy and a 0.72 Pearson correlation for CD16 expression regression on BSCCM. These results underscore the promise of label-free single-cell imaging for cost-effective hematological profiling, enabling simultaneous phenotype identification and quantitative biomarker estimation without fluorescent staining. The source code is available at https://github.com/saqibnaziir/Single-Cell-Phenotyping.",,foundation_model_agent,7.55,1.5,这篇工作偏基础模型/Agent方向，可能影响病原检测任务的建模上限，值得关注其任务定义与评测设计。,,foundation_model,,2605.14717v1,
Prompt-Only Gene-Circuit Modeling with a Large Language Model Simulates the synNotch Spheroids.,PubMed,2026-05-15T00:00:00+00:00,https://pubmed.ncbi.nlm.nih.gov/41968604/,"Morphogenesis emerges from gene regulatory circuits that translate biochemical cues into spatially organized cell fates; yet, constructing quantitative simulations of these processes remains technically demanding. Here, we present a prompt-only pipeline in which a large language model (LLM) automatically generates CompuCell3D (CC3D) simulations directly from natural-language biological specifications. Using the canonical synNotch spheroid assay as a benchmark, we show that the LLM-generated code captures key features of contact-dependent signaling, cadherin-mediated adhesion, and multicellular sorting dynamics without manual programming. Baseline simulations exhibited the expected qualitative ordering of inducer-responder activation but revealed fragmentation into multiple spheroids, implicating premature reciprocal signaling as a kinetic failure mode. Incorporating a cumulative contact-duration threshold for synNotch activation rescued robust single-spheroid formation, suggesting that sustained cell-cell interactions are a critical design principle for this pattern. Our results establish conversational LLM guidance as a powerful accelerator for multiscale modeling, collapsing the steep learning curve of CC3D into a dialog-driven workflow. This framework enables nonspecialists to test gene-circuit hypotheses in silico and provides a generalizable route toward rapid, mechanism-level exploration of developmental design principles.",,foundation_model_agent,7.15,1.25,这篇工作更像方法创新，可能直接关联 metagenomics、long-read 或 pathogen identification 流程优化。,,methods,10.1021/acssynbio.5c00704,,41968604
A fully open structure-guided RNA foundation model for robust structural and functional inference,bioRxiv,2026-05-14T00:00:00+00:00,https://www.biorxiv.org/content/10.1101/2025.08.06.668731v2,"RNA language models have achieved strong performances across diverse downstream tasks by leveraging large-scale sequence data. However, RNA function is fundamentally shaped by its hierarchical structure, making the integration of structural information into pre-training essential. Existing methods often depend on noisy structural annotations or introduce task-specific biases, limiting model generalizability. Here, we propose structRFM, a structure-guided RNA foundation model that is pre-trained on millions of RNA sequences and secondary structures data by integrating base pairing interactions into masked language modeling through a novel pair matching operation. We further introduce MUSES (multi-source ensemble of secondary structures) to mitigate model bias, and a dynamic masking ratio to balance the structure-guided mask and nucleotide-level mask. structRFM learns joint knowledge of sequential and structural data, producing versatile representations, including classification-level, sequence-level, and pairwise matrix features, that support a broad spectrum of downstream adaptations. structRFM ranks among the top models in zero-shot homology classification across seventeen biological language models, and sets new benchmarks for secondary structure prediction. structRFM further derives Zfold, which enables robust and reliable tertiary structure prediction, with consistent improvements in estimating 3D structures and their accordingly extracted 2D structures, achieving a pronounced about 20% performance gain compared with baselines and comparable performances with AlphaFold3 on CASP15-natural, CASP16, and RNA-Puzzles datasets. In functional tasks such as internal ribosome entry site identification, structRFM achieves a whopping 48% performance gain in F1 score. Furthermore, state-of-the-art performances in extensive experiments across novel RNA families and long non-coding RNAs indicate the robustness and generalizability of structRFM. These results demonstrate the effectiveness of structure-guided pre-training and highlight a promising direction for developing multi-modal RNA language models in computational biology. To support the broader scientific community, we have made the 21-million sequence-structure dataset and the pre-trained structRFM model fully open-source, facilitating the development of multimodal foundation models in biology.",,foundation_model_agent,6.8,7.0,这篇工作偏基础模型/Agent方向，可能影响病原检测任务的建模上限，值得关注其任务定义与评测设计。,,foundation_model,10.1101/2025.08.06.668731,,
RAPO++: Cross-Stage Prompt Optimization for Text-to-Video Generation via Data Alignment and Test-Time Scaling,arXiv,2025-10-23T04:45:09+00:00,http://arxiv.org/abs/2510.20206v2,"Prompt design plays a crucial role in text-to-video (T2V) generation, yet user-provided prompts are often short, unstructured, and misaligned with training data, limiting the generative potential of diffusion-based T2V models. We present \textbf{RAPO++}, a cross-stage prompt optimization framework that unifies training-data--aligned refinement, test-time iterative scaling, and large language model (LLM) fine-tuning to substantially improve T2V generation without modifying the underlying generative backbone. In \textbf{Stage 1}, Retrieval-Augmented Prompt Optimization (RAPO) enriches user prompts with semantically relevant modifiers retrieved from a relation graph and refactors them to match training distributions, enhancing compositionality and multi-object fidelity. \textbf{Stage 2} introduces Sample-Specific Prompt Optimization (SSPO), a closed-loop mechanism that iteratively refines prompts using multi-source feedback -- including semantic alignment, spatial fidelity, temporal coherence, and task-specific signals such as optical flow -- yielding progressively improved video generation quality. \textbf{Stage 3} leverages optimized prompt pairs from SSPO to fine-tune the rewriter LLM, internalizing task-specific optimization patterns and enabling efficient, high-quality prompt generation even before inference. Extensive experiments across five state-of-the-art T2V models and five benchmarks demonstrate that RAPO++ achieves significant gains in semantic alignment, compositional reasoning, temporal stability, and physical plausibility, outperforming existing methods by large margins. Our results highlight RAPO++ as a model-agnostic, cost-efficient, and scalable solution that sets a new standard for prompt optimization in T2V generation. The code is available at https://github.com/Vchitect/RAPO.",,foundation_model_agent,6.55,1.7,这篇工作偏基础模型/Agent方向，可能影响病原检测任务的建模上限，值得关注其任务定义与评测设计。,,foundation_model,,2510.20206v2,
Simulating population compliance with pandemic interventions using large language models,medRxiv,2026-05-15T00:00:00+00:00,https://www.medrxiv.org/content/10.64898/2026.05.12.26352942v1,"Effective pandemic response requires accurate modeling of population compliance with non-pharmaceutical interventions (NPIs), yet most epidemic models treat behavioral change as fixed scenarios rather than an emergent process. Here, we test whether large language model (LLM)-based agents can generate individualized behavioral responses to time-varying NPIs and disease risk. We instantiate demographically representative agents in three U.S. cities (Boston, Denver, San Antonio) and condition them on evolving outbreak conditions and policies during the early COVID-19 pandemic, without fitting to observed mobility data. Across three frontier LLMs and their ensemble, agents generate zero-shot mobility changes across restaurants, retail, and entertainment venues, benchmarked against cellphone-derived foot-traffic records. The simulations recover average mobility trends across cities and venue types but exhibit overly narrow within-city variation. The three LLMs display distinct biases, while an ensemble approach improves robustness and overall performance. These findings establish LLM agents as a promising framework for modeling adherence to NPIs and highlight the need for further fine-tuning and empirical validation before they can support policy analysis.",,foundation_model_agent,6.55,1.5,这篇工作偏基础模型/Agent方向，可能影响病原检测任务的建模上限，值得关注其任务定义与评测设计。,,foundation_model,10.64898/2026.05.12.26352942,,
Is Grep All You Need? How Agent Harnesses Reshape Agentic Search,arXiv,2026-05-14T17:58:41+00:00,http://arxiv.org/abs/2605.15184v1,"Recent advances in Large Language Model (LLM) agents have enabled complex agentic workflows where models autonomously retrieve information, call tools, and reason over large corpora to complete tasks on behalf of users. Despite the growing adoption of retrieval-augmented generation (RAG) in agentic search systems, existing literature lacks a systematic comparison of how retrieval strategy choice interacts with agent architecture and tool-calling paradigm. Important practical dimensions, including how tool outputs are presented to the model and how performance changes when searches must cope with more irrelevant surrounding text, remain under-explored in agent loops. This paper reports an empirical study organized into two experiments. Experiment 1 compares grep and vector retrieval on a 116-question sample from LongMemEval, using a custom agent harness (Chronos) and provider-native CLI harnesses (Claude Code, Codex, and Gemini CLI), for both inline tool results and file-based tool results that the model reads separately. Experiment 2 compares grep-only and vector-only retrieval while progressively mixing in additional unrelated conversation history, so that each query is embedded in more distracting material alongside the passages that matter. Across Chronos and the provider CLIs, grep generally yields higher accuracy than vector retrieval in our comparisons in experiment 1; at the same time, overall scores still depend strongly on which harness and tool-calling style is used, even when the underlying conversation data are the same.",,foundation_model_agent,6.55,1.0,这篇工作偏基础模型/Agent方向，可能影响病原检测任务的建模上限，值得关注其任务定义与评测设计。,,foundation_model,,2605.15184v1,
Privacy-preserving local language models accurately identify the presence and timing of self-harm in electronic mental health records,medRxiv,2026-05-16T00:00:00+00:00,https://www.medrxiv.org/content/10.1101/2025.10.27.25338892v2,"Background: Self-harm, defined as intentional self-injury or self-poisoning irrespective of motivation, is the strongest risk factor for suicide and an important outcome for mental health care. Although highly prevalent in clinical populations, it is often imprecisely captured in routinely collected clinical data, where it is typically recorded and stored in unstructured, free-text format. Contemporary language models, such as GPT (OpenAI), Gemini (Google) and Claude (Anthropic) can analyse free-text clinical notes, but such cloud-based commercial and closed-source models may violate data governance of processing sensitive patient data. Objective: We evaluated whether a privacy-preserving language model running entirely within an institution's secure computing infrastructure (here, the UK National Health Service) could accurately identify the presence and timing of self-harm using electronic health records (EHRs) from secondary mental healthcare. Methods: A random sample of 1,352 clinical notes from the EHRs of people with a confirmed diagnosis of a psychiatric disorder, according to the International Classification of Diseases (ICD-10), was selected from Oxford Health NHS Foundation Trust. Each clinical note was annotated for (i) presence or absence of self-harm and (ii) its recency (90 days vs. > 90 days vs. unknown), constituting the gold-standard data set for model development and validation. Privacy-preserving locally served 27-billion-parameter Gemma 3 language model (""Gemma3-27b"") was used as a core language model to identify self-harm along with its timing to generate a structured output per clinical record. The performance of Gemma3-27b model was compared against a strong baseline multi-label text classification model based on RoBERTa (Robustly Optimized BERT Pretraining Approach, a transformer-based language model) architecture. Model performance was evaluated using precision, recall, and the F1-score (harmonic mean of precision and recall), with 95% confidence intervals estimated from 1,000 bootstrap samples with replacement. Results: The Gemma3-27b model outperformed the RoBERTa classifier across all categories. Gemma3-27b achieved Precision = 0.92, Recall = 0.92 (sensitivity), and F1-score of 0.92 for notes containing self-harm, and Precision = 0.97, Recall = 0.97 (specificity), and F1-score of 0.97 for notes without self-harm. The performance of Gemma3-27b for recent self-harm was Precision = 0.84, Recall = 0.75, and F1-score of 0.79. The global weighted F1-score of Gemma3-27b across all categories was 0.88, compared to 0.85 for RoBERTa. Conclusions: The prompt-engineered local language model outperformed the multi-label text classification RoBERTa model on the task of ascertaining self-harm events and their timing, while requiring significantly fewer high-fidelity annotated data. This approach offers a practical solution for improving self-harm case ascertainment whilst adhering to strict data governance rules to potentially transform clinical monitoring and response to this critical public health challenge.",,foundation_model_agent,6.45,5.5,这篇工作更接近临床/监测落地，适合评估其对快速识别、预警或治疗辅助的实际价值。,,clinical_application,10.1101/2025.10.27.25338892,,
