title,source,date,url,abstract,matched_topics,relevance_score,novelty_score,why_it_matters,category,doi,arxiv_id,pubmed_id
Can Parents and Patients Understand Myopia Using Large Language Model-Based Chatbots?,medRxiv,2026-03-10T00:00:00+00:00,https://www.medRxiv.org/content/10.1101/10.64898/2026.03.09.26347905v1,"Purpose: This study aimed to compare the reliability of myopia-related information from AI chatbots using a set of commonly asked questions by parents and patients on myopia, which is an emerging disease of the 21st-century. Design: Prospective comparative reliability study Methods: The study used ChatGPT(OpenAI(2025)GPT-5), Gemini(Gemini 2.0,Google,2025) and DeepSeek (DeepSeek-R1). Twenty myopia-related questions were framed from the perspective of parents and patients, covering general questions, prevention and control, and complications of myopia. Based on their experience in the field of myopia, two senior clinicians, one junior clinician and one researcher(all[&ge;]3 years of experience in myopia) rated the responses generated by AI chatbots on a 5-point Likert scale(1:very poor, 2:poor, 3: acceptable, 4:good and 5:very good). Results: Overall, combined rating for tested chatbots had median score of 4(good). Gemini received significantly lower ratings than other two chatbots (p[&le;]0.001), with a median rating of 3(acceptable). ChatGPT and DeepSeek had median score of 4(good) and there was no significant difference in ratings (p=0.48). Both ChatGPT(66.0%) and DeepSeek(67.5%) had high proportions of good and very good ratings, compared to Gemini(40.0%). Combined poor and very poor ratings were highest for Gemini(7.5%), followed by ChatGPT(5.0%) and DeepSeek(4.0%). For general questions on myopia, ChatGPT and DeepSeek were rated good; for complications of myopia, ChatGPT was rated as good while others were rated acceptable. Conclusions: ChatGPT and DeepSeek demonstrated consistently high-quality responses, while ratings for Gemini were slightly lower but remained adequate. These findings suggest AI chatbots can support patients or parents in understanding myopia.",foundation_model_agent,6.15,5.75,这篇工作偏基础模型/Agent方向，可能影响病原检测任务的建模上限，值得关注其任务定义与评测设计。,foundation_model,10.64898/2026.03.09.26347905,,
Improving Causal Gene Identification Using Large Language Models,bioRxiv,2026-03-10T00:00:00+00:00,https://www.bioRxiv.org/content/10.1101/10.64898/2026.03.08.710344v1,"Genome-Wide Association Studies (GWAS) have successfully identified numerous loci associated with complex traits and diseases, yet pinpointing causal genes remains a significant challenge. The reliance on simple proximity-based heuristics is often insufficient due to linkage disequilibrium, gene interactions, and regulatory effects. Recent advancements in Large Language Models (LLMs) have demonstrated potential in automating causal gene identification, but their effectiveness remains limited by knowledge representation and retrieval mechanisms. This study builds on previous research by evaluating LLMs for causal gene identification, with a focus on enhancing performance through Retrieval- Augmented Generation (RAG) and the incorporation of genomic distance information. We replicate prior results using smaller model Qwen2.5 - assessing their predictive accuracy using a benchmark dataset from Open Targets. We improved the preformences when integrating RAG-based literature retrieval (F1 = 0.795) and gene distance information (F1 = 0.806). However, the combined approach yielded diminishing returns, suggesting interactions between these enhancements. Error analysis revealed that genomic distance features improved predictions by reinforcing established heuristics, while RAG enhanced domain knowledge but occasionally led to semantic biases. These findings highlight the potential of hybrid approaches in leveraging both structured genomic features and unstructured textual data.",foundation_model_agent,5.75,6.25,这篇工作偏数据集或基准构建，适合判断是否能作为病原组学训练或评测资源。,dataset,10.64898/2026.03.08.710344,,
GREmLN: A Cellular Graph Structure Aware Transcriptomics Foundation Model,bioRxiv,2026-03-10T00:00:00+00:00,https://www.bioRxiv.org/content/10.1101/10.1101/2025.07.03.663009v3,"The ever-increasing availability of large-scale single-cell profiles presents an opportunity to develop foundation models to capture cell properties and behavior. However, standard language models such as transformers benefits from sequentially structured data with well defined absolute or relative positional relationships, while single cell RNA data have orderless gene features. Molecular-interaction graphs, such as gene regulatory networks (GRN) or protein-protein interaction (PPI) networks, offer graph structure-based models that effectively encode both non-local gene token dependencies, as well as potential causal relationships. We introduce GREmLN (Gene Regulatory Embedding-based Large Neural model), a foundation model that leverages graph signal processing to embed gene token graph structure directly within its attention mechanism, producing biologically informed single cell specific gene embeddings. Our model faithfully captures transcriptomics landscapes and achieves superior performance relative to state-of-the-art baselines on cell type annotation, graph structure understanding, and fine-tuned reverse perturbation prediction tasks. It offers a unified and interpretable framework for learning high-capacity foundational representations that capture complex, long-range regulatory dependencies from high-dimensional single-cell transcriptomic data. Moreover, the incorporation of graph-structured inductive biases enables more parameter-efficient architectures and accelerates training convergence.",foundation_model_agent,5.75,5.75,这篇工作更像方法创新，可能直接关联 metagenomics、long-read 或 pathogen identification 流程优化。,methods,10.1101/2025.07.03.663009,,
Developing SCL2205 : A Protein Sequence-based Spatial Modelling Dataset for the Protein Language Model Frontier,bioRxiv,2026-03-10T00:00:00+00:00,https://www.bioRxiv.org/content/10.1101/10.64898/2026.03.08.710388v1,"Deep learning (DL) has advanced computational genome annotation tasks such as protein sub-cellular localisation (SCL) prediction. Nonetheless, its potential remains underutilised, primarily because of the limited availability of high-quality reference data and suboptimal input preparation strategies. In this study, we develop and analyse a high-quality dataset derived from the latest release of the universal protein knowledgebase (UniProtKB), designed to address existing challenges and support robust DL-based SCL modelling. The dataset was constructed through extensive quality preprocessing to ensure reliability, manual label mapping to enhance the quantity and diversity of the training data, and stringent partitioning to minimise data leakage. We validated the dataset using independent test sets, achieving up to 10.8% performance improvement, measured by the area under the precision-recall curve (PR-AUC), compared to the state-of-the-art (SoTA). Furthermore, we highlighted potential performance metric inflation in existing SoTA predictors by demonstrating, for the first time, at least 4.8% training-to-testing data leakage (pre-sequence representation) when using only 10% of the training set under homology augmentation (augmentation based on sequence similarity database searches; SCL2205 will efficiently support the development of robust, trustworthy, and generalisable DL-based SCL predictors, while minimising data leakage and promoting reproducibility. It is openly available under the Creative Commons Zero (CC0 1.0) licence on DRYAD and is conveniently deployed as a package on the Python Package Index - p-scldata.",foundation_model_agent,5.75,5.75,这篇工作偏数据集或基准构建，适合判断是否能作为病原组学训练或评测资源。,dataset,10.64898/2026.03.08.710388,,
Epistemic Closure: Autonomous Mechanism Completion for Physically Consistent Simulation,arXiv,2026-03-10T14:56:36+00:00,http://arxiv.org/abs/2603.09756v1,"The integration of Large Language Models (LLMs) into scientific discovery is currently hindered by the Implicit Context problem, where governing equations extracted from literature contain invisible thermodynamic assumptions (e.g., undrained conditions) that standard generative models fail to recognize. This leads to Physical Hallucination: the generation of syntactically correct solvers that faithfully execute physically invalid laws. Here, we introduce a Neuro-Symbolic Generative Agent that functions as a cognitive supervisor atop traditional numerical engines. By encapsulating physical laws into modular Constitutive Skills and leveraging latent intrinsic priors, the Agent employs a Chain-of-Thought reasoning workflow to autonomously validate, prune, and complete physical mechanisms. We demonstrate this capability on the challenge of thermal pressurization in low-permeability sandstone. While a standard literature-retrieval baseline erroneously predicts catastrophic material failure by blindly adopting a rigid ""undrained"" simplification, our Agent autonomously identifies the system as operating in a drained regime (Deborah number De << 1) via dimensionless scaling analysis. Consequently, it inductively completes the missing dissipation mechanism (Darcy flow) required to satisfy boundary constraints, predicting a stable stress path consistent with experimental reality. This work establishes a paradigm where AI agents transcend the role of coding assistants to act as epistemic partners, capable of reasoning about and correcting the theoretical assumptions embedded in scientific data.",foundation_model_agent,5.45,7.4,这篇工作偏基础模型/Agent方向，可能影响病原检测任务的建模上限，值得关注其任务定义与评测设计。,foundation_model,,2603.09756v1,
Evaluation of LLMs in retrieving food and nutritional context for RAG systems,arXiv,2026-03-10T14:15:35+00:00,http://arxiv.org/abs/2603.09704v1,"In this article, we evaluate four Large Language Models (LLMs) and their effectiveness at retrieving data within a specialized Retrieval-Augmented Generation (RAG) system, using a comprehensive food composition database. Our method is focused on the LLMs ability to translate natural language queries into structured metadata filters, enabling efficient retrieval via a Chroma vector database. By achieving high accuracy in this critical retrieval step, we demonstrate that LLMs can serve as an accessible, high-performance tool, drastically reducing the manual effort and technical expertise previously required for domain experts, such as food compilers and nutritionists, to leverage complex food and nutrition data. However, despite the high performance on easy and moderately complex queries, our analysis of difficult questions reveals that reliable retrieval remains challenging when queries involve non-expressible constraints. These findings demonstrate that LLM-driven metadata filtering excels when constraints can be explicitly expressed, but struggles when queries exceed the representational scope of the metadata format.",foundation_model_agent,5.45,7.29,这篇工作偏基础模型/Agent方向，可能影响病原检测任务的建模上限，值得关注其任务定义与评测设计。,foundation_model,10.1109/BigData66926.2025.11401545,2603.09704v1,
Enhancing Retrieval-Augmented Generation with Entity Linking for Educational Platforms,arXiv,2025-12-05T18:59:18+00:00,http://arxiv.org/abs/2512.05967v2,"In the era of Large Language Models (LLMs), Retrieval-Augmented Generation (RAG) architectures are gaining significant attention for their ability to ground language generation in reliable knowledge sources. Despite their effectiveness, RAG systems based solely on semantic similarity often fail to ensure factual accuracy in specialized domains, where terminological ambiguity can affect retrieval relevance. This study proposes ELERAG, an enhanced RAG architecture that integrates a factual signal derived from Entity Linking to improve the accuracy of educational question-answering systems in Italian. The system includes a Wikidata-based Entity Linking module and implements a hybrid re-ranking strategy based on Reciprocal Rank Fusion (RRF). To validate our approach, we compared it against standard baselines and state-of-the-art methods, including a Weighted-Score Re-ranking, a standalone Cross-Encoder and a combined RRF+Cross-Encoder pipeline. Experiments were conducted on two benchmarks: a custom academic dataset and the standard SQuAD-it dataset. Results show that, in domain-specific contexts, ELERAG significantly outperforms both the baseline and the Cross-Encoder configurations. Conversely, the Cross-Encoder approaches achieve the best results on the general-domain dataset. These findings provide strong experimental evidence of the domain mismatch effect, highlighting the importance of domain-adapted hybrid strategies to enhance factual precision in educational RAG systems without relying on computationally expensive models trained on disparate data distributions. They also demonstrate the potential of entity-aware RAG systems in educational environments, fostering adaptive and reliable AI-based tutoring tools.",foundation_model_agent,5.45,6.5,这篇工作更像方法创新，可能直接关联 metagenomics、long-read 或 pathogen identification 流程优化。,methods,,2512.05967v2,
Towards Robust Retrieval-Augmented Generation Based on Knowledge Graph: A Comparative Analysis,arXiv,2026-03-05T21:43:53+00:00,http://arxiv.org/abs/2603.05698v2,"Retrieval-Augmented Generation (RAG) was introduced to enhance the capabilities of Large Language Models (LLMs) beyond their encoded prior knowledge. This is achieved by providing LLMs with an external source of knowledge, which helps reduce factual hallucinations and enables access to new information not available during pretraining. However, inconsistent retrieved information can negatively affect LLM responses. The Retrieval-Augmented Generation Benchmark (RGB) was introduced to evaluate the robustness of RAG systems under such conditions. In this work, we use the RGB corpus to evaluate LLMs in four scenarios: noise robustness, information integration, negative rejection, and counterfactual robustness. We perform a comparative analysis between the RGB RAG baseline and GraphRAG, a knowledge graph based retrieval system. We test three GraphRAG customizations to improve robustness. Results show improvements over the RGB baseline and provide insights for designing more reliable RAG systems for real world scenarios.",foundation_model_agent,5.45,6.0,这篇工作偏基础模型/Agent方向，可能影响病原检测任务的建模上限，值得关注其任务定义与评测设计。,foundation_model,10.1109/SMC58881.2025.11343466,2603.05698v2,
TaSR-RAG: Taxonomy-guided Structured Reasoning for Retrieval-Augmented Generation,arXiv,2026-03-10T08:16:36+00:00,http://arxiv.org/abs/2603.09341v1,"Retrieval-Augmented Generation (RAG) helps large language models (LLMs) answer knowledge-intensive and time-sensitive questions by conditioning generation on external evidence. However, most RAG systems still retrieve unstructured chunks and rely on one-shot generation, which often yields redundant context, low information density, and brittle multi-hop reasoning. While structured RAG pipelines can improve grounding, they typically require costly and error-prone graph construction or impose rigid entity-centric structures that do not align with the query's reasoning chain. We propose \textsc{TaSR-RAG}, a taxonomy-guided structured reasoning framework for evidence selection. We represent both queries and documents as relational triples, and constrain entity semantics with a lightweight two-level taxonomy to balance generalization and precision. Given a complex question, \textsc{TaSR-RAG} decomposes it into an ordered sequence of triple sub-queries with explicit latent variables, then performs step-wise evidence selection via hybrid triple matching that combines semantic similarity over raw triples with structural consistency over typed triples. By maintaining an explicit entity binding table across steps, \textsc{TaSR-RAG} resolves intermediate variables and reduces entity conflation without explicit graph construction or exhaustive search. Experiments on multiple multi-hop question answering benchmarks show that \textsc{TaSR-RAG} consistently outperforms strong RAG and structured-RAG baselines by up to 14\%, while producing clearer evidence attribution and more faithful reasoning traces.",foundation_model_agent,4.75,6.54,这篇工作更像方法创新，可能直接关联 metagenomics、long-read 或 pathogen identification 流程优化。,methods,,2603.09341v1,
Reverse Distillation: Consistently Scaling Protein Language Model Representations,arXiv,2026-03-08T16:24:05+00:00,http://arxiv.org/abs/2603.07710v1,"Unlike the predictable scaling laws in natural language processing and computer vision, protein language models (PLMs) scale poorly: for many tasks, models within the same family plateau or even decrease in performance, with mid-sized models often outperforming the largest in the family. We introduce Reverse Distillation, a principled framework that decomposes large PLM representations into orthogonal subspaces guided by smaller models of the same family. The resulting embeddings have a nested, Matryoshka-style structure: the first k dimensions of a larger model's embedding are exactly the representation from the smaller model. This ensures that larger reverse-distilled models consistently outperform smaller ones. A motivating intuition is that smaller models, constrained by capacity, preferentially encode broadly-shared protein features. Reverse distillation isolates these shared features and orthogonally extracts additional contributions from larger models, preventing interference between the two. On ProteinGym benchmarks, reverse-distilled ESM-2 variants outperform their respective baselines at the same embedding dimensionality, with the reverse-distilled 15 billion parameter model achieving the strongest performance. Our framework is generalizable to any model family where scaling challenges persist. Code and trained models are available at https://github.com/rohitsinghlab/plm_reverse_distillation.",foundation_model_agent,5.75,0.75,这篇工作更像方法创新，可能直接关联 metagenomics、long-read 或 pathogen identification 流程优化。,methods,,2603.07710v1,
Accelerating Exploratory Clinical Research: An LLM-Powered Framework for Cross-Study Data Harmonization and Natural Language Querying,medRxiv,2026-03-09T00:00:00+00:00,https://www.medRxiv.org/content/10.1101/10.64898/2026.03.04.26345603v1,"Clinical research depends on high quality data that is standardized, accessible and interoperable. Yet evolving data standards over time and variations in their implementation hinder the secondary use of clinical trial datasets. Although individual studies adhere to clinical data standards set forth by CDISC (Clinical Data Interchange Standards Consortium), differences in study design, interpretation of complex models, controlled terminologies, and historical conventions create inconsistencies that limit interoperability and complicate cross-study analysis. As a result, harmonizing SDTM datasets across studies is essential to enable efficient secondary use and accelerate evidence generation.To address these challenges, we introduce a framework that leverages Large Language Models (LLMs) to automate the harmonization of study-specific clinical trial data, available in CDISC Study Data Tabulation Model (SDTM) format, into data that is harmonized across trials at scale and also enables natural language querying via a text-to-SQL agent. This system transforms siloed study clinical datasets into interoperable, analysis-ready formats while empowering users to retrieve insights across trials without needing SQL or domain-specific schema knowledge. By constructing a semantic layer and applying retrieval-augmented prompting to models like GPT-4o, our approach improves data access, query accuracy, and scalability across use cases. This work demonstrates the potential of LLMs to transform clinical data workflows, cutting manual effort, substantially reducing manual harmonization effort and query latency in secondary analysis workflows, and enabling faster exploratory analysis and hypothesis generation in clinical research.",foundation_model_agent,5.75,0.75,这篇工作偏基础模型/Agent方向，可能影响病原检测任务的建模上限，值得关注其任务定义与评测设计。,foundation_model,10.64898/2026.03.04.26345603,,
Retrieval-Augmented Anatomical Guidance for Text-to-CT Generation,arXiv,2026-03-09T12:27:17+00:00,http://arxiv.org/abs/2603.08305v1,"Text-conditioned generative models for volumetric medical imaging provide semantic control but lack explicit anatomical guidance, often resulting in outputs that are spatially ambiguous or anatomically inconsistent. In contrast, structure-driven methods ensure strong anatomical consistency but typically assume access to ground-truth annotations, which are unavailable when the target image is to be synthesized. We propose a retrieval-augmented approach for Text-to-CT generation that integrates semantic and anatomical information under a realistic inference setting. Given a radiology report, our method retrieves a semantically related clinical case using a 3D vision-language encoder and leverages its associated anatomical annotation as a structural proxy. This proxy is injected into a text-conditioned latent diffusion model via a ControlNet branch, providing coarse anatomical guidance while maintaining semantic flexibility. Experiments on the CT-RATE dataset show that retrieval-augmented generation improves image fidelity and clinical consistency compared to text-only baselines, while additionally enabling explicit spatial controllability, a capability inherently absent in such approaches. Further analysis highlights the importance of retrieval quality, with semantically aligned proxies yielding consistent gains across all evaluation axes. This work introduces a principled and scalable mechanism to bridge semantic conditioning and anatomical plausibility in volumetric medical image synthesis. Code will be released.",foundation_model_agent,5.75,0.75,这篇工作偏数据集或基准构建，适合判断是否能作为病原组学训练或评测资源。,dataset,,2603.08305v1,
HLER: Human-in-the-Loop Economic Research via Multi-Agent Pipelines for Empirical Discovery,arXiv,2026-03-08T03:40:34+00:00,http://arxiv.org/abs/2603.07444v1,"Large language models (LLMs) have enabled agent-based systems that aim to automate scientific research workflows. Most existing approaches focus on fully autonomous discovery, where AI systems generate research ideas, conduct analyses, and produce manuscripts with minimal human involvement. However, empirical research in economics and the social sciences poses additional constraints: research questions must be grounded in available datasets, identification strategies require careful design, and human judgment remains essential for evaluating economic significance. We introduce HLER (Human-in-the-Loop Economic Research), a multi-agent architecture that supports empirical research automation while preserving critical human oversight. The system orchestrates specialized agents for data auditing, data profiling, hypothesis generation, econometric analysis, manuscript drafting, and automated review. A key design principle is dataset-aware hypothesis generation, where candidate research questions are constrained by dataset structure, variable availability, and distributional diagnostics, reducing infeasible or hallucinated hypotheses. HLER further implements a two-loop architecture: a question quality loop that screens and selects feasible hypotheses, and a research revision loop where automated review triggers re-analysis and manuscript revision. Human decision gates are embedded at key stages, allowing researchers to guide the automated pipeline. Experiments on three empirical datasets show that dataset-aware hypothesis generation produces feasible research questions in 87% of cases (versus 41% under unconstrained generation), while complete empirical manuscripts can be produced at an average API cost of $0.8-$1.5 per run. These results suggest that Human-AI collaborative pipelines may provide a practical path toward scalable empirical research.",foundation_model_agent,5.45,1.0,这篇工作偏基础模型/Agent方向，可能影响病原检测任务的建模上限，值得关注其任务定义与评测设计。,foundation_model,,2603.07444v1,
