title,source,date,url,abstract,matched_topics,relevance_score,novelty_score,why_it_matters,category,doi,arxiv_id,pubmed_id
From General-Purpose to Disease-Specific Features: Aligning LLM Embeddings on a Disease-Specific Biomedical Knowledge Graph for Drug Repurposing,bioRxiv,2026-03-10T00:00:00+00:00,https://www.bioRxiv.org/content/10.1101/10.64898/2026.03.07.707871v1,"Identifying new therapeutic uses for existing drugs is a major challenge in biomedicine, especially for complex neurodegenerative conditions such as Alzheimer disease and related dementias (ADRD), where treatment options remain limited and relevant data are often sparse, heterogeneous, and difficult to integrate. Although general-purpose Large Language Model (LLM) embeddings encode rich semantic information, they often lack the task-specific biomedical context needed for inference tasks such as computational drug repurposing. We introduce Contextualizing LLM Embeddings via Attention-based gRaph learning (CLEAR), a multimodal representation-fusion framework that aligns LLM embeddings with the topological structure of a context-specific Knowledge Graph (KG). Across five benchmark datasets, CLEAR achieved state-of-the-art results, improving predictive performance (e.g., F1 score) by up to 30% over prior methods. We further applied CLEAR to identify FDA-approved drugs with potential for repurposing for ADRD, including Parkinson disease-related dementia and Lewy Body dementia. CLEAR learned a biologically coherent embedding space, prioritized leading ADRD drug candidates, and accurately summarized known therapeutic relationships for FDA-approved Alzheimer disease drugs. Overall, CLEAR shows that grounding biomedical LLM embeddings with context-specific KG signals can improve drug repurposing in data-sparse, real-world settings.",foundation_model_agent,7.9,7.0,这篇工作偏基础模型/Agent方向，可能影响病原检测任务的建模上限，值得关注其任务定义与评测设计。,foundation_model,10.64898/2026.03.07.707871,,
OPENXRD: A Comprehensive Benchmark Framework for LLM/MLLM XRD Question Answering,arXiv,2025-07-12T06:25:22+00:00,http://arxiv.org/abs/2507.09155v2,"We introduce OPENXRD, a comprehensive benchmarking framework for evaluating large language models (LLMs) and multimodal LLMs (MLLMs) in crystallography question answering. The framework measures context assimilation, or how models use fixed, domain-specific supporting information during inference. The framework includes 217 expert-curated X-ray diffraction (XRD) questions covering fundamental to advanced crystallographic concepts, each evaluated under closed-book (without context) and open-book (with context) conditions, where the latter includes concise reference passages generated by GPT-4.5 and refined by crystallography experts. We benchmark 74 state-of-the-art LLMs and MLLMs, including GPT-4, GPT-5, O-series, LLaVA, LLaMA, QWEN, Mistral, and Gemini families, to quantify how different architectures and scales assimilate external knowledge. Results show that mid-sized models (7B--70B parameters) gain the most from contextual materials, while very large models often show saturation or interference and the largest relative gains appear in small and mid-sized models. Expert-reviewed materials provide significantly higher improvements than AI-generated ones even when token counts are matched, confirming that content quality, not quantity, drives performance. OPENXRD offers a reproducible diagnostic benchmark for assessing reasoning, knowledge integration, and guidance sensitivity in scientific domains, and provides a foundation for future multimodal and retrieval-augmented crystallography systems.",foundation_model_agent,7.5,6.25,这篇工作偏基础模型/Agent方向，可能影响病原检测任务的建模上限，值得关注其任务定义与评测设计。,foundation_model,,2507.09155v2,
NeuroNarrator: A Generalist EEG-to-Text Foundation Model for Clinical Interpretation via Spectro-Spatial Grounding and Temporal State-Space Reasoning,bioRxiv,2026-03-10T00:00:00+00:00,https://www.bioRxiv.org/content/10.1101/10.64898/2026.03.07.707799v1,"Electroencephalography (EEG) provides a non-invasive window into neural dynamics at high temporal resolution and plays a pivotal role in clinical neuroscience research. Despite this potential, prevailing computational approaches to EEG analysis remain largely confined to task-specific classification objectives or coarse-grained pattern recognition, offering limited support for clinically meaningful interpretation. To address these limitations, we introduce NeuroNarrator, the first generalist EEG-to-text foundation model designed to translate electrophysiological segments into precise clinical narratives. A cornerstone of this framework is the curation of NeuroCorpus-160K, the first harmonized large-scale resource pairing over 160,000 EEG segments with structured, clinically grounded natural-language descriptions. Our architecture first aligns temporal EEG waveforms with spatial topographic maps via a rigorous contrastive objective, establishing spectro-spatially grounded representations. Building on this grounding, we condition a Large Language Model through a state-space-inspired formulation that integrates historical temporal and spectral context to support coherent clinical narrative generation. This approach establishes a principled bridge between continuous signal dynamics and discrete clinical language, enabling interpretable narrative generation that facilitates expert interpretation and supports clinical reporting workflows. Extensive evaluations across diverse benchmarks and zero-shot transfer tasks highlight NeuroNarrator's capacity to integrate temporal, spectral, and spatial dynamics, positioning it as a foundational framework for time-frequency-aware, open-ended clinical interpretation of electrophysiological data.",foundation_model_agent,7.15,6.75,这篇工作偏基础模型/Agent方向，可能影响病原检测任务的建模上限，值得关注其任务定义与评测设计。,foundation_model,10.64898/2026.03.07.707799,,
MITRA: An AI Assistant for Knowledge Retrieval in Physics Collaborations,arXiv,2026-03-10T15:28:35+00:00,http://arxiv.org/abs/2603.09800v1,"Large-scale scientific collaborations, such as the Compact Muon Solenoid (CMS) at CERN, produce a vast and ever-growing corpus of internal documentation. Navigating this complex information landscape presents a significant challenge for both new and experienced researchers, hindering knowledge sharing and slowing down the pace of scientific discovery. To address this, we present a prototype of MITRA, a Retrieval-Augmented Generation (RAG) based system, designed to answer specific, context-aware questions about physics analyses. MITRA employs a novel, automated pipeline using Selenium for document retrieval from internal databases and Optical Character Recognition (OCR) with layout parsing for high-fidelity text extraction. Crucially, MITRA's entire framework, from the embedding model to the Large Language Model (LLM), is hosted on-premise, ensuring that sensitive collaboration data remains private. We introduce a two-tiered vector database architecture that first identifies the relevant analysis from abstracts before focusing on the full documentation, resolving potential ambiguities between different analyses. We demonstrate the prototype's superior retrieval performance against a standard keyword-based baseline on realistic queries and discuss future work towards developing a comprehensive research agent for large experimental collaborations.",foundation_model_agent,6.55,8.19,这篇工作偏基础模型/Agent方向，可能影响病原检测任务的建模上限，值得关注其任务定义与评测设计。,foundation_model,,2603.09800v1,
"AI Agents, Language, Deep Learning and the Next Revolution in Science",arXiv,2026-03-09T04:14:20+00:00,http://arxiv.org/abs/2603.07940v1,"Modern science is reaching a critical inflection point. Instruments across disciplines, from particle physics and astronomy to genomics and climate modeling, now produce data of such scale, diversity, and interdependence that traditional analytical methods can no longer keep pace. This growing imbalance between data generation and data understanding signals the need for a new scientific paradigm. We propose that intelligent, human-supervised AI agents operating over deep-learning algorithms, represent the next evolution of the scientific method. Built upon large language models and multimodal learning, these agents can interpret scientific intent, design and execute analytical workflows, and ensure traceability through domain-specific languages that preserve human oversight and accountability. Particle physics, a historic incubator of computational innovation, offers the ideal testbed for this transition. At the Institute of High Energy Physics of the Chinese Academy of Sciences, the Dr. Sai system embodies this vision, a multi-agent reasoning framework deployed within collider research at the CEPC. This emerging approach does not replace human scientists but extends their cognitive reach, enabling discovery to scale with complexity and redefining how knowledge itself is produced in the age of intelligent machines. The significance of this paradigm transcends particle physics, offering a blueprint for all data-driven sciences facing the same complexity ceiling.",foundation_model_agent,8.5,0.75,这篇工作更像方法创新，可能直接关联 metagenomics、long-read 或 pathogen identification 流程优化。,methods,10.15302/frontphys.2026.096401,2603.07940v1,
DEO: Training-Free Direct Embedding Optimization for Negation-Aware Retrieval,arXiv,2026-03-10T04:47:15+00:00,http://arxiv.org/abs/2603.09185v1,"Recent advances in Large Language Models (LLMs) and Retrieval-Augmented Generation (RAG) have enabled diverse retrieval methods. However, existing retrieval methods often fail to accurately retrieve results for negation and exclusion queries. To address this limitation, prior approaches rely on embedding adaptation or fine-tuning, which introduce additional computational cost and deployment complexity. We propose Direct Embedding Optimization (DEO), a training-free method for negation-aware text and multimodal retrieval. DEO decomposes queries into positive and negative components and optimizes the query embedding with a contrastive objective. Without additional training data or model updates, DEO outperforms baselines on NegConstraint, with gains of +0.0738 nDCG@10 and +0.1028 MAP@100, while improving Recall@5 by +6\% over OpenAI CLIP in multimodal retrieval. These results demonstrate the practicality of DEO for negation- and exclusion-aware retrieval in real-world settings.",foundation_model_agent,7.5,5.96,这篇工作偏基础模型/Agent方向，可能影响病原检测任务的建模上限，值得关注其任务定义与评测设计。,foundation_model,,2603.09185v1,
MMGraphRAG: Bridging Vision and Language with Interpretable Multimodal Knowledge Graphs,arXiv,2025-07-28T13:16:23+00:00,http://arxiv.org/abs/2507.20804v2,"Large Language Models (LLMs) often suffer from hallucinations, which Retrieval-Augmented Generation (RAG) and GraphRAG mitigate by incorporating external knowledge and knowledge graphs (KGs). However, GraphRAG remains text-centric due to the difficulty of constructing fine-grained Multimodal KGs (MMKGs). Existing fusion methods, such as shared embeddings or captioning, require task-specific training and fail to preserve visual structural knowledge or cross-modal reasoning paths. To bridge this gap, we propose MMGraphRAG, which integrates visual scene graphs with text KGs via a novel cross-modal fusion approach. It introduces SpecLink, a method leveraging spectral clustering for accurate cross-modal entity linking and path-based retrieval to guide generation. We also release the CMEL dataset, specifically designed for fine-grained multi-entity alignment in complex multimodal scenarios. Evaluations on CMEL, DocBench, and MMLongBench demonstrate that MMGraphRAG achieves state-of-the-art performance, showing robust domain adaptability and superior multimodal information processing capabilities.",foundation_model_agent,6.8,6.0,这篇工作更像方法创新，可能直接关联 metagenomics、long-read 或 pathogen identification 流程优化。,methods,,2507.20804v2,
BRIDGE: Benchmark for multi-hop Reasoning In long multimodal Documents with Grounded Evidence,arXiv,2026-03-09T03:54:08+00:00,http://arxiv.org/abs/2603.07931v1,"Multi-hop question answering (QA) is widely used to evaluate the reasoning capabilities of large language models, yet most benchmarks focus on final answer correctness and overlook intermediate reasoning, especially in long multimodal documents. We introduce BRIDGE, a benchmark for multi-hop reasoning over long scientific papers that require integrating evidence across text, tables, and figures. The dataset supports both chain-like and fan-out structures and provides explicit multi-hop reasoning annotations for step-level evaluation beyond answer accuracy. Experiments with state-of-the-art LLMs and multimodal retrieval-augmented generation (RAG) systems reveal systematic deficiencies in evidence aggregation and grounding that remain hidden under conventional answer-only evaluation. BRIDGE provides a targeted testbed for diagnosing reasoning failures in long multimodal documents.",foundation_model_agent,6.8,1.5,这篇工作偏数据集或基准构建，适合判断是否能作为病原组学训练或评测资源。,dataset,,2603.07931v1,
CMMR-VLN: Vision-and-Language Navigation via Continual Multimodal Memory Retrieval,arXiv,2026-03-09T06:02:50+00:00,http://arxiv.org/abs/2603.07997v1,"Although large language models (LLMs) are introduced into vision-and-language navigation (VLN) to improve instruction comprehension and generalization, existing LLM- based VLN lacks the ability to selectively recall and use relevant priori experiences to help navigation tasks, limiting their performance in long-horizon and unfamiliar scenarios. In this work, we propose CMMR-VLN (Continual Multimodal Memory Retrieval based VLN), a VLN framework that endows LLM agents with structured memory and reflection capabilities. Specifically, the CMMR-VLN constructs a multimodal experi- ence memory indexed by panoramic visual images and salient landmarks to retrieve relevant experiences during navigation, introduces a retrieved-augmented generation pipeline to mimick how experienced human navigators leverage priori knowledge, and incorporates a reflection-based memory update strategy that selectively stores complete successful paths and the key initial mistake in failure cases. Comprehensive tests illustrate average success rate improvements of 52.9%, 20.9% and 20.9%, and 200%, 50% and 50% over the NavGPT, the MapGPT, and the DiscussNav in simulation and real tests, respectively eluci- dating the great potential of the CMMR-VLN as a backbone VLN framework.",foundation_model_agent,6.8,0.5,这篇工作偏基础模型/Agent方向，可能影响病原检测任务的建模上限，值得关注其任务定义与评测设计。,foundation_model,,2603.07997v1,
HDLxGraph: Bridging Large Language Models and HDL Repositories via HDL Graph Databases,arXiv,2025-05-21T16:14:10+00:00,http://arxiv.org/abs/2505.15701v2,"Retrieval Augmented Generation (RAG) is an essential agent for Large Language Model (LLM) aided Description Language (HDL) tasks, addressing the challenges of limited training data and prohibitively long prompts. However, its performance in handling ambiguous queries and real-world, repository-level HDL projects containing thousands or even tens of thousands of code lines remains limited. Our analysis demonstrates two fundamental mismatches, structural and vocabulary, between conventional semantic similarity-based RAGs and HDL codes. To this end, we propose HDLxGraph, the first framework that integrates the inherent graph characteristics of HDLs with RAGs for LLM-assisted tasks. Specifically, HDLxGraph incorporates Abstract Syntax Trees (ASTs) to capture HDLs' hierarchical structures and Data Flow Graphs (DFGs) to address the vocabulary mismatch. In addition, to overcome the lack of comprehensive HDL search benchmarks, we introduce HDLSearch, an LLM generated dataset derived from real-world, repository-level HDL projects. Evaluations show that HDLxGraph improves search, debugging, and completion accuracy by 12.04%/12.22%/5.04% and by 11.59%/8.18%/4.07% over state-of-the-art similarity-based RAG and software-code Graph RAG baselines, respectively. The code of HDLxGraph and HDLSearch benchmark are available at https://github.com/UMN-ZhaoLab/HDLxGraph.",foundation_model_agent,6.55,2.2,这篇工作偏基础模型/Agent方向，可能影响病原检测任务的建模上限，值得关注其任务定义与评测设计。,foundation_model,,2505.15701v2,
LongAudio-RAG: Event-Grounded Question Answering over Multi-Hour Long Audio,arXiv,2026-02-16T10:15:22+00:00,http://arxiv.org/abs/2602.14612v3,"Long-duration audio is increasingly common in industrial and consumer settings, yet reviewing multi-hour recordings is impractical, motivating systems that answer natural-language queries with precise temporal grounding and minimal hallucination. Existing audio-language models show promise, but long-audio question answering remains difficult due to context-length limits. We introduce LongAudio-RAG (LA-RAG), a hybrid framework that grounds Large Language Model outputs in retrieved, timestamped acoustic event detections rather than raw audio. Multi-hour streams are converted into structured event records stored in an SQL database, and at inference time the system resolves natural-language time references, classifies intent, retrieves only the relevant events, and generates answers using this constrained evidence. To evaluate performance, we construct a synthetic long-audio benchmark by concatenating recordings with preserved timestamps and generating template-based question-answer pairs for detection, counting, and summarization tasks. Finally, we demonstrate the practicality of our approach by deploying it in a hybrid edge-cloud environment, where the audio grounding model runs on-device on IoT-class hardware while the LLM is hosted on a GPU-backed server. This architecture enables low-latency event extraction at the edge and high-quality language reasoning in the cloud. Experiments show that structured, event-level retrieval significantly improves accuracy compared to vanilla Retrieval-Augmented Generation (RAG) or text-to-SQL approaches.",foundation_model_agent,6.55,1.5,这篇工作偏基础模型/Agent方向，可能影响病原检测任务的建模上限，值得关注其任务定义与评测设计。,foundation_model,,2602.14612v3,
EmbC-Test: How to Speed Up Embedded Software Testing Using LLMs and RAG,arXiv,2026-03-10T10:58:59+00:00,http://arxiv.org/abs/2603.09497v1,"Manual development of automatic tests for embedded C software is a strenuous and time-consuming task that does not scale well. With the accelerating pace of software release cycles, verification increasingly becomes the bottleneck in the embedded development workflow. This paper presents a Retrieval-Augmented Generation (RAG) pipeline as a solution for partial automation of the verification process. By grounding a large language model in project-specific artifacts, the approach reduces hallucinations and improves project alignment. An industrial evaluation showed that the generated tests are 100 % syntactically correct, with 85 % successfully passing runtime validation. The proposed solution has the potential to save up to 66 % of the testing time compared to manual test writing while generating 270 tests per hour.",foundation_model_agent,6.15,6.99,这篇工作更像方法创新，可能直接关联 metagenomics、long-read 或 pathogen identification 流程优化。,methods,,2603.09497v1,
The Virtuous Cycle: AI-Powered Vector Search and Vector Search-Augmented AI,arXiv,2026-03-10T08:28:58+00:00,http://arxiv.org/abs/2603.09347v1,"Modern AI and vector search are rapidly converging, forming a promising research frontier in intelligent information systems. On one hand, advances in AI have substantially improved the semantic accuracy and efficiency of vector search, including learned indexing structures, adaptive pruning strategies, and automated parameter tuning. On the other hand, powerful vector search techniques have enabled new AI paradigms, notably Retrieval-Augmented Generation (RAG), which effectively mitigates challenges in Large Language Models (LLMs) like knowledge staleness and hallucinations. This mutual reinforcement establishes a virtuous cycle where AI injects intelligence and adaptive optimization into vector search, while vector search, in turn, expands AI's capabilities in knowledge integration and context-aware generation. This tutorial provides a comprehensive overview of recent research and advancements at this intersection. We begin by discussing the foundational background and motivations for integrating vector search and AI. Subsequently, we explore how AI empowers vector search (AI4VS) across each step of the vector search pipeline. We then investigate how vector search empowers AI (VS4AI), with a particular focus on RAG frameworks that integrate dynamic, external knowledge sources into the generative process of LLMs. Furthermore, we analyze end-to-end co-optimization strategies that fully unlock the potential of the ``virtuous cycle"" between vector search and AI. Finally, we highlight key challenges and future research opportunities in this emerging area. This paper was published in ICDE 2026.",foundation_model_agent,6.15,6.57,这篇工作更像方法创新，可能直接关联 metagenomics、long-read 或 pathogen identification 流程优化。,methods,,2603.09347v1,
Fanar-Sadiq: A Multi-Agent Architecture for Grounded Islamic QA,arXiv,2026-03-09T15:35:12+00:00,http://arxiv.org/abs/2603.08501v2,"Large language models (LLMs) can answer religious knowledge queries fluently, yet they often hallucinate and misattribute sources, which is especially consequential in Islamic settings where users expect grounding in canonical texts (Qur'an and Hadith) and jurisprudential (fiqh) nuance. Retrieval-augmented generation (RAG) reduces some of these limitations by grounding generation in external evidence. However, a single ``retrieve-then-generate'' pipeline is limited to deal with the diversity of Islamic queries. Users may request verbatim scripture, fatwa-style guidance with citations or rule-constrained computations such as zakat and inheritance that require strict arithmetic and legal invariants. In this work, we present a bilingual (Arabic/English) multi-agent Islamic assistant, called Fanar-Sadiq, which is a core component of the Fanar AI platform. Fanar-Sadiq routes Islamic-related queries to specialized modules within an agentic, tool-using architecture. The system supports intent-aware routing, retrieval-grounded fiqh answers with deterministic citation normalization and verification traces, exact verse lookup with quotation validation, and deterministic calculators for Sunni zakat and inheritance with madhhab-sensitive branching. We evaluate the complete end-to-end system on public Islamic QA benchmarks and demonstrate effectiveness and efficiency. Our system is currently publicly and freely accessible through API and a Web application, and has been accessed $\approx$1.9M times in less than a year.",foundation_model_agent,6.15,6.25,这篇工作偏基础模型/Agent方向，可能影响病原检测任务的建模上限，值得关注其任务定义与评测设计。,foundation_model,,2603.08501v2,
