title,source,date,url,abstract,matched_topics,relevance_score,novelty_score,why_it_matters,category,doi,arxiv_id,pubmed_id
Routing without Forgetting,arXiv,2026-03-10T12:23:46+00:00,http://arxiv.org/abs/2603.09576v1,"Continual learning in transformers is commonly addressed through parameter-efficient adaptation: prompts, adapters, or LoRA modules are specialized per task while the backbone remains frozen. Although effective in controlled multi-epoch settings, these approaches rely on gradual gradient-based specialization and struggle in Online Continual Learning (OCL), where data arrive as a non-stationary stream and each sample may be observed only once. We recast continual learning in transformers as a routing problem: under strict online constraints, the model must dynamically select the appropriate representational subspace for each input without explicit task identifiers or repeated optimization. We thus introduce Routing without Forgetting (RwF), a transformer architecture augmented with energy-based associative retrieval layers inspired by Modern Hopfield Networks. Instead of storing or merging task-specific prompts, RwF generates dynamic prompts through single-step associative retrieval over the transformer token embeddings at each layer. Retrieval corresponds to the closed-form minimization of a strictly convex free-energy functional, enabling input-conditioned routing within each forward pass, independently of iterative gradient refinement. Across challenging class-incremental benchmarks, RwF improves over existing prompt-based methods. On Split-ImageNet-R and Split-ImageNet-S, RwF outperforms prior prompt-based approaches by a large margin, even in few-shot learning regimes. These results indicate that embedding energy-based associative routing directly within the transformer backbone provides a principled and effective foundation for OCL.",,0.7,7.23,这篇工作偏基础模型/Agent方向，可能影响病原检测任务的建模上限，值得关注其任务定义与评测设计。,foundation_model,,2603.09576v1,
Explainable Innovation Engine: Dual-Tree Agent-RAG with Methods-as-Nodes and Verifiable Write-Back,arXiv,2026-03-10T05:04:28+00:00,http://arxiv.org/abs/2603.09192v1,"Retrieval-augmented generation (RAG) improves factual grounding, yet most systems rely on flat chunk retrieval and provide limited control over multi-step synthesis. We propose an Explainable Innovation Engine that upgrades the knowledge unit from text chunks to methods-as-nodes. The engine maintains a weighted method provenance tree for traceable derivations and a hierarchical clustering abstraction tree for efficient top-down navigation. At inference time, a strategy agent selects explicit synthesis operators (e.g., induction, deduction, analogy), composes new method nodes, and records an auditable trajectory. A verifier-scorer layer then prunes low-quality candidates and writes validated nodes back to support continual growth. Expert evaluation across six domains and multiple backbones shows consistent gains over a vanilla baseline, with the largest improvements on derivation-heavy settings, and ablations confirm the complementary roles of provenance backtracking and pruning. These results suggest a practical path toward controllable, explainable, and verifiable innovation in agentic RAG systems. Code is available at the project GitHub repository https://github.com/xiaolu-666113/Dual-Tree-Agent-RAG.",,0.7,5.51,这篇工作偏基础模型/Agent方向，可能影响病原检测任务的建模上限，值得关注其任务定义与评测设计。,foundation_model,,2603.09192v1,
Understand Then Memory: A Cognitive Gist-Driven RAG Framework with Global Semantic Diffusion,arXiv,2026-02-11T12:58:08+00:00,http://arxiv.org/abs/2602.15895v2,"Retrieval-Augmented Generation (RAG) effectively mitigates hallucinations in LLMs by incorporating external knowledge. However, the inherent discrete representation of text in existing frameworks often results in a loss of semantic integrity, leading to retrieval deviations. Inspired by the human episodic memory mechanism, we propose CogitoRAG, a RAG framework that simulates human cognitive memory processes. The core of this framework lies in the extraction and evolution of the Semantic Gist. During the offline indexing stage, CogitoRAG first deduces unstructured corpora into gist memory corpora, which are then transformed into a multi-dimensional knowledge graph integrating entities, relational facts, and memory nodes. In the online retrieval stage, the framework handles complex queries via Query Decomposition Module that breaks them into comprehensive sub-queries, mimicking the cognitive decomposition humans employ for complex information. Subsequently, Entity Diffusion Module performs associative retrieval across the graph, guided by structural relevance and an entity-frequency reward mechanism. Furthermore, we propose the CogniRank algorithm, which precisely reranks candidate passages by fusing diffusion-derived scores with semantic similarity. The final evidence is delivered to the generator in a passage-memory pairing format, providing high-density information support. Experimental results across five mainstream QA benchmarks and multi-task generation on GraphBench demonstrate that CogitoRAG significantly outperforms state-of-the-art RAG methods, showcasing superior capabilities in complex knowledge integration and reasoning.",,0.7,0.75,这篇工作更像方法创新，可能直接关联 metagenomics、long-read 或 pathogen identification 流程优化。,methods,,2602.15895v2,
Learning Hierarchical Knowledge in Text-Rich Networks with Taxonomy-Informed Representation Learning,arXiv,2026-03-09T09:40:18+00:00,http://arxiv.org/abs/2603.08159v1,"Hierarchical knowledge structures are ubiquitous across real-world domains and play a vital role in organizing information from coarse to fine semantic levels. While such structures have been widely used in taxonomy systems, biomedical ontologies, and retrieval-augmented generation, their potential remains underexplored in the context of Text-Rich Networks (TRNs), where each node contains rich textual content and edges encode semantic relationships. Existing methods for learning on TRNs often focus on flat semantic modeling, overlooking the inherent hierarchical semantics embedded in textual documents. To this end, we propose TIER (Hierarchical \textbf{T}axonomy-\textbf{I}nformed R\textbf{E}presentation Learning on Text-\textbf{R}ich Networks), which first constructs an implicit hierarchical taxonomy and then integrates it into the learned node representations. Specifically, TIER employs similarity-guided contrastive learning to build a clustering-friendly embedding space, upon which it performs hierarchical K-Means followed by LLM-powered clustering refinement to enable semantically coherent taxonomy construction. Leveraging the resulting taxonomy, TIER introduces a cophenetic correlation coefficient-based regularization loss to align the learned embeddings with the hierarchical structure. By learning representations that respect both fine-grained and coarse-grained semantics, TIER enables more interpretable and structured modeling of real-world TRNs. We demonstrate that our approach significantly outperforms existing methods on multiple datasets across diverse domains, highlighting the importance of hierarchical knowledge learning for TRNs.",,0.7,0.75,这篇工作偏基础模型/Agent方向，可能影响病原检测任务的建模上限，值得关注其任务定义与评测设计。,foundation_model,,2603.08159v1,
Multi-Agent Off-World Exploration for Sparse Evidence Discovery via Gaussian Belief Mapping and Dual-Domain Coverage,arXiv,2026-03-08T14:27:41+00:00,http://arxiv.org/abs/2603.07650v1,"Off-world multi-robot exploration is challenged by sparse targets, limited sensing, hazardous terrain, and restricted communication. Many scientifically valuable clues are visually ambiguous and often require close-range observations, making efficient and safe informative path planning essential. Existing methods often rely on predefined areas of interest (AOIs), which may be incomplete or biased, and typically handle terrain risk only through soft penalties, which are insufficient for avoiding non-recoverable regions. To address these issues, we propose a multi-agent informative path planning framework for sparse evidence discovery based on Gaussian belief mapping and dual-domain coverage. The method maintains Gaussian-process-based interest and risk beliefs and combines them with trajectory-intent representations to support coordinated sequential decision-making among multiple agents. It further prioritizes search inside the AOI while preserving limited exploration outside it, thereby improving robustness to AOI bias. In addition, the risk-aware design helps agents balance information gain and operational safety in hazardous environments. Experimental results in simulated lunar environments show that the proposed method consistently outperforms sampling-based and greedy baselines under different budgets and communication ranges. In particular, it achieves lower final uncertainty in risk-aware settings and remains robust under limited communication, demonstrating its effectiveness for cooperative off-world robotic exploration.",,0.7,0.25,这篇工作更像方法创新，可能直接关联 metagenomics、long-read 或 pathogen identification 流程优化。,methods,,2603.07650v1,
