title,source,date,url,abstract,matched_topics,relevance_score,novelty_score,why_it_matters,category,doi,arxiv_id,pubmed_id
Amortized Phylodynamic Inference with Neural Bayes Estimators and Recursive Neural Networks,arXiv,2026-03-09T13:07:01+00:00,http://arxiv.org/abs/2603.08345v1,"Phylodynamics is used to estimate epidemic dynamics from phylogenetic trees or genomic sequences of pathogens, but the likelihood calculations needed can be challenging for complex models. We present a neural Bayes estimator (NBE) for key epidemic quantities: the reproduction number, prevalence, and cumulative infections through time. By performing quantile regression over tree space, the NBE allows us to estimate posterior medians and credible intervals directly from a reconstructed tree. Our approach uses a recursive neural network as a tree embedding network with a prediction network conditioned on time and quantile level to generate the estimates. In simulation studies, the NBE achieves good predictive performance, with conservative uncertainty estimates. Compared with a BEAST2 fixed-tree analysis, the NBE gives less biased estimates of time-varying reproduction numbers in our test setting. Under a misspecified sampling model, the NBE performance degrades (as expected) but remains reasonable, and fine-tuning a pre-trained model yields estimates comparable to those from a model trained from scratch, at substantially lower computational cost.",sequencing_bioinformatics,2.6,6.85,这篇工作更像方法创新，可能直接关联 metagenomics、long-read 或 pathogen identification 流程优化。,methods,,2603.08345v1,
Unified Multi-Modal Interactive & Reactive 3D Motion Generation via Rectified Flow,arXiv,2025-09-28T22:36:18+00:00,http://arxiv.org/abs/2509.24099v3,"Generating realistic, context-aware two-person motion conditioned on diverse modalities remains a fundamental challenge for graphics, animation and embodied AI systems. Real-world applications such as VR/AR companions, social robotics and game agents require models capable of producing coordinated interpersonal behaviour while flexibly switching between interactive and reactive generation. We introduce DualFlow, the first unified and efficient framework for multi-modal two-person motion generation. DualFlow conditions 3D motion generation on diverse inputs, including text, music, and prior motion sequences. Leveraging rectified flow, it achieves deterministic straight-line sampling paths between noise and data, reducing inference time and mitigating error accumulation common in diffusion-based models. To enhance semantic grounding, DualFlow employs a novel Retrieval-Augmented Generation (RAG) module for two-person motion that retrieves motion exemplars using music features and LLM-based text decompositions of spatial relations, body movements, and rhythmic patterns. We use a contrastive rectified flow objective to further sharpen alignment with conditioning signals and add synchronisation loss to improve inter-person temporal coordination. Extensive evaluations across interactive, reactive, and multi-modal benchmarks demonstrate that DualFlow consistently improves motion quality, responsiveness, and semantic fidelity. DualFlow achieves state-of-the-art performance in two-person multi-modal motion generation, producing coherent, expressive, and rhythmically synchronized motion.",,2.1,6.25,这篇工作偏基础模型/Agent方向，可能影响病原检测任务的建模上限，值得关注其任务定义与评测设计。,foundation_model,,2509.24099v3,
Flow Matching Meets Biology and Life Science: A Survey,arXiv,2025-07-23T17:44:29+00:00,http://arxiv.org/abs/2507.17731v2,"Over the past decade, advances in generative modeling, such as generative adversarial networks, masked autoencoders, and diffusion models, have significantly transformed biological research and discovery, enabling breakthroughs in molecule design, protein generation, catalysis discovery, drug discovery, and beyond. At the same time, biological applications have served as valuable testbeds for evaluating the capabilities of generative models. Recently, flow matching has emerged as a powerful and efficient alternative to diffusion-based generative modeling, with growing interest in its application to problems in biology and life sciences. This paper presents the first comprehensive survey of recent developments in flow matching and its applications in biological domains. We begin by systematically reviewing the foundations and variants of flow matching, and then categorize its applications into three major areas: biological sequence modeling, molecule generation and design, and peptide and protein generation. For each, we provide an in-depth review of recent progress. We also summarize commonly used datasets and software tools, and conclude with a discussion of potential future directions. The corresponding curated resources are available at https://github.com/Violet24K/Awesome-Flow-Matching-Meets-Biology.",,1.7,5.75,这篇工作更像方法创新，可能直接关联 metagenomics、long-read 或 pathogen identification 流程优化。,methods,,2507.17731v2,
Human-AI Collaboration for Scaling Agile Regression Testing: An Agentic-AI Teammate from Manual to Automated Testing,arXiv,2026-03-09T10:19:13+00:00,http://arxiv.org/abs/2603.08190v1,"Agile organizations increasingly rely on automated regression testing to sustain rapid, high-quality software delivery. However, as systems grow and requirements evolve, a persistent bottleneck arises: test specifications are produced faster than they can be transformed into executable scripts, leading to mounting manual effort and delayed releases. In partnership with Hacon (a Siemens company), we present an agentic AI approach that generates system-level test scripts directly from validated specifications, aiming to accelerate automation without sacrificing human oversight. Our solution features a retrieval-augmented, multi-agent architecture integrated into Hacon's agile workflows. We evaluate this system through a mixed-method analysis of industrial artifacts and practitioner feedback. Results show that the AI teammate significantly increases test script throughput and reduces manual authoring effort, while underscoring the ongoing need for clear specifications and human review to ensure quality and maintainability. We conclude with practical lessons for scaling regression automation and fostering effective Human-AI collaboration in agile environments.",,1.4,6.63,这篇工作更像方法创新，可能直接关联 metagenomics、long-read 或 pathogen identification 流程优化。,methods,,2603.08190v1,
KohakuRAG: A simple RAG framework with hierarchical document indexing,arXiv,2026-03-08T12:52:39+00:00,http://arxiv.org/abs/2603.07612v1,"Retrieval-augmented generation (RAG) systems that answer questions from document collections face compounding difficulties when high-precision citations are required: flat chunking strategies sacrifice document structure, single-query formulations miss relevant passages through vocabulary mismatch, and single-pass inference produces stochastic answers that vary in both content and citation selection. We present KohakuRAG, a hierarchical RAG framework that preserves document structure through a four-level tree representation (document $\rightarrow$ section $\rightarrow$ paragraph $\rightarrow$ sentence) with bottom-up embedding aggregation, improves retrieval coverage through an LLM-powered query planner with cross-query reranking, and stabilizes answers through ensemble inference with abstention-aware voting. We evaluate on the WattBot 2025 Challenge, a benchmark requiring systems to answer technical questions from 32 documents with $\pm$0.1% numeric tolerance and exact source attribution. KohakuRAG achieves first place on both public and private leaderboards (final score 0.861), as the only team to maintain the top position across both evaluation partitions. Ablation studies reveal that prompt ordering (+80% relative), retry mechanisms (+69%), and ensemble voting with blank filtering (+1.2pp) each contribute substantially, while hierarchical dense retrieval alone matches hybrid sparse-dense approaches (BM25 adds only +3.1pp). We release KohakuRAG as open-source software at https://github.com/KohakuBlueleaf/KohakuRAG.",,1.4,6.0,这篇工作偏基础模型/Agent方向，可能影响病原检测任务的建模上限，值得关注其任务定义与评测设计。,foundation_model,,2603.07612v1,
Learning Hierarchical Knowledge in Text-Rich Networks with Taxonomy-Informed Representation Learning,arXiv,2026-03-09T09:40:18+00:00,http://arxiv.org/abs/2603.08159v1,"Hierarchical knowledge structures are ubiquitous across real-world domains and play a vital role in organizing information from coarse to fine semantic levels. While such structures have been widely used in taxonomy systems, biomedical ontologies, and retrieval-augmented generation, their potential remains underexplored in the context of Text-Rich Networks (TRNs), where each node contains rich textual content and edges encode semantic relationships. Existing methods for learning on TRNs often focus on flat semantic modeling, overlooking the inherent hierarchical semantics embedded in textual documents. To this end, we propose TIER (Hierarchical \textbf{T}axonomy-\textbf{I}nformed R\textbf{E}presentation Learning on Text-\textbf{R}ich Networks), which first constructs an implicit hierarchical taxonomy and then integrates it into the learned node representations. Specifically, TIER employs similarity-guided contrastive learning to build a clustering-friendly embedding space, upon which it performs hierarchical K-Means followed by LLM-powered clustering refinement to enable semantically coherent taxonomy construction. Leveraging the resulting taxonomy, TIER introduces a cophenetic correlation coefficient-based regularization loss to align the learned embeddings with the hierarchical structure. By learning representations that respect both fine-grained and coarse-grained semantics, TIER enables more interpretable and structured modeling of real-world TRNs. We demonstrate that our approach significantly outperforms existing methods on multiple datasets across diverse domains, highlighting the importance of hierarchical knowledge learning for TRNs.",,0.7,6.77,这篇工作偏基础模型/Agent方向，可能影响病原检测任务的建模上限，值得关注其任务定义与评测设计。,foundation_model,,2603.08159v1,
Understand Then Memory: A Cognitive Gist-Driven RAG Framework with Global Semantic Diffusion,arXiv,2026-02-11T12:58:08+00:00,http://arxiv.org/abs/2602.15895v2,"Retrieval-Augmented Generation (RAG) effectively mitigates hallucinations in LLMs by incorporating external knowledge. However, the inherent discrete representation of text in existing frameworks often results in a loss of semantic integrity, leading to retrieval deviations. Inspired by the human episodic memory mechanism, we propose CogitoRAG, a RAG framework that simulates human cognitive memory processes. The core of this framework lies in the extraction and evolution of the Semantic Gist. During the offline indexing stage, CogitoRAG first deduces unstructured corpora into gist memory corpora, which are then transformed into a multi-dimensional knowledge graph integrating entities, relational facts, and memory nodes. In the online retrieval stage, the framework handles complex queries via Query Decomposition Module that breaks them into comprehensive sub-queries, mimicking the cognitive decomposition humans employ for complex information. Subsequently, Entity Diffusion Module performs associative retrieval across the graph, guided by structural relevance and an entity-frequency reward mechanism. Furthermore, we propose the CogniRank algorithm, which precisely reranks candidate passages by fusing diffusion-derived scores with semantic similarity. The final evidence is delivered to the generator in a passage-memory pairing format, providing high-density information support. Experimental results across five mainstream QA benchmarks and multi-task generation on GraphBench demonstrate that CogitoRAG significantly outperforms state-of-the-art RAG methods, showcasing superior capabilities in complex knowledge integration and reasoning.",,0.7,5.75,这篇工作更像方法创新，可能直接关联 metagenomics、long-read 或 pathogen identification 流程优化。,methods,,2602.15895v2,
MUSS: Multilevel Subset Selection for Relevance and Diversity,arXiv,2025-03-14T06:37:17+00:00,http://arxiv.org/abs/2503.11126v3,"The problem of relevant and diverse subset selection has a wide range of applications, including recommender systems and retrieval-augmented generation (RAG). For example, in recommender systems, one is interested in selecting relevant items, while providing a diversified recommendation. Constrained subset selection problem is NP-hard, and popular approaches such as Maximum Marginal Relevance (MMR) are based on greedy selection. Many real-world applications involve large data, but the original MMR work did not consider distributed selection. This limitation was later addressed by a method called DGDS which allows for a distributed setting using random data partitioning. Here, we exploit structure in the data to further improve both scalability and performance on the target application. We propose MUSS, a novel method that uses a multilevel approach to relevant and diverse selection. In a recommender system application, our method can not only improve the performance up to $4$ percent points in precision, but is also $20$ to $80$ times faster. Our method is also capable of outperforming baselines on RAG-based question answering accuracy. We present a novel theoretical approach for analyzing this type of problems, and show that our method achieves a constant factor approximation of the optimal objective. Moreover, our analysis also resulted in a $\times 2$ tighter bound for DGDS compared to previously known bound.",,0.7,5.25,这篇工作更像方法创新，可能直接关联 metagenomics、long-read 或 pathogen identification 流程优化。,methods,,2503.11126v3,
Retrieval Pivot Attacks in Hybrid RAG: Measuring and Mitigating Amplified Leakage from Vector Seeds to Graph Expansion,arXiv,2026-02-09T13:55:04+00:00,http://arxiv.org/abs/2602.08668v3,"Hybrid Retrieval-Augmented Generation (RAG) pipelines combine vector similarity search with knowledge graph expansion for multi-hop reasoning. We show that this composition introduces a distinct security failure mode: a vector-retrieved ""seed"" chunk can pivot via entity links into sensitive graph neighborhoods, causing cross-tenant data leakage that does not occur in vector-only retrieval. We formalize this risk as Retrieval Pivot Risk (RPR) and introduce companion metrics Leakage@k, Amplification Factor, and Pivot Depth (PD) to quantify leakage magnitude and traversal structure. We present seven Retrieval Pivot Attacks that exploit the vector-to-graph boundary and show that adversarial injection is not required: naturally shared entities create cross-tenant pivot paths organically. Across a synthetic multi-tenant enterprise corpus and the Enron email corpus, the undefended hybrid pipeline exhibits high pivot risk (RPR up to 0.95) with multiple unauthorized items returned per query. Leakage consistently appears at PD=2, which we attribute to the bipartite chunk-entity topology and formalize as a proposition. We then show that enforcing authorization at a single location, the graph expansion boundary, eliminates measured leakage (RPR near 0) across both corpora, all attack variants, and label forgery rates up to 10 percent, with minimal overhead. Our results indicate the root cause is boundary enforcement, not inherently complex defenses: two individually secure retrieval components can compose into an insecure system unless authorization is re-checked at the transition point.",,0.7,5.25,这篇工作偏数据集或基准构建，适合判断是否能作为病原组学训练或评测资源。,dataset,,2602.08668v3,
Multi-Agent Off-World Exploration for Sparse Evidence Discovery via Gaussian Belief Mapping and Dual-Domain Coverage,arXiv,2026-03-08T14:27:41+00:00,http://arxiv.org/abs/2603.07650v1,"Off-world multi-robot exploration is challenged by sparse targets, limited sensing, hazardous terrain, and restricted communication. Many scientifically valuable clues are visually ambiguous and often require close-range observations, making efficient and safe informative path planning essential. Existing methods often rely on predefined areas of interest (AOIs), which may be incomplete or biased, and typically handle terrain risk only through soft penalties, which are insufficient for avoiding non-recoverable regions. To address these issues, we propose a multi-agent informative path planning framework for sparse evidence discovery based on Gaussian belief mapping and dual-domain coverage. The method maintains Gaussian-process-based interest and risk beliefs and combines them with trajectory-intent representations to support coordinated sequential decision-making among multiple agents. It further prioritizes search inside the AOI while preserving limited exploration outside it, thereby improving robustness to AOI bias. In addition, the risk-aware design helps agents balance information gain and operational safety in hazardous environments. Experimental results in simulated lunar environments show that the proposed method consistently outperforms sampling-based and greedy baselines under different budgets and communication ranges. In particular, it achieves lower final uncertainty in risk-aware settings and remains robust under limited communication, demonstrating its effectiveness for cooperative off-world robotic exploration.",,0.7,5.25,这篇工作更像方法创新，可能直接关联 metagenomics、long-read 或 pathogen identification 流程优化。,methods,,2603.07650v1,
"YAQIN: Culturally Sensitive, Agentic AI for Mental Healthcare Support Among Muslim Women in the UK",arXiv,2026-03-08T16:23:43+00:00,http://arxiv.org/abs/2603.07709v1,"Mental healthcare services in the UK lack tools and resources to address the cultural needs of Muslim women, often leaving them feeling as though their values are pathologised and limiting trust and engagement [1]. Despite growing awareness of cultural competency, few interventions integrate Islamic frameworks into therapeutic support. This report investigates the design and evaluation of YAQIN, a co-designed AI-based application supporting culturally and faith-sensitive mental health engagement for Muslim women. With almost 1.9 million Muslim women in England in 2021, YAQIN responds to a gap in care [2]. It leverages AIś anonymity and continuous support through a faith-aware chatbot and guided journaling tool grounded in user-centred design and Islamic psychology. The YAQIN design research methodology comprised three stages: contextual investigation and literature review, user research with N=14 stakeholders including Muslim women and mental health experts, and prototype development informed by deductive thematic analysis, personas, journey maps, and design specifications. Evaluation involved a co-designed user study with five participants: four Muslim women and one mental health expert who reviewed therapeutic alignment and cultural sensitivity after using the chatbot prototype. Feedback focused on tone, faith relevance, emotional resonance, and the Retrieval-Augmented Generation pipeline enabling contextual continuity. Participants highlighted YAQINś ability to bridge cultural gaps in trust and therapeutic confidence. Feedback included suggestions of including linguistic diversity and routine-based guidance. This project demonstrates how culturally sensitive AI can improve mental healthcare accessibility and trust for marginalised communities and highlights the potential of faith-integrated technology in healthcare innovation.",,0.7,5.25,这篇工作更像方法创新，可能直接关联 metagenomics、long-read 或 pathogen identification 流程优化。,methods,,2603.07709v1,
