title,source,date,url,abstract,abstract_zh,matched_topics,relevance_score,novelty_score,why_it_matters,analysis_zh,category,doi,arxiv_id,pubmed_id
Accelerating Exploratory Clinical Research: An LLM-Powered Framework for Cross-Study Data Harmonization and Natural Language Querying,medRxiv,2026-03-09T00:00:00+00:00,https://www.medrxiv.org/content/10.64898/2026.03.04.26345603v1,"Clinical research depends on high quality data that is standardized, accessible and interoperable. Yet evolving data standards over time and variations in their implementation hinder the secondary use of clinical trial datasets. Although individual studies adhere to clinical data standards set forth by CDISC (Clinical Data Interchange Standards Consortium), differences in study design, interpretation of complex models, controlled terminologies, and historical conventions create inconsistencies that limit interoperability and complicate cross-study analysis. As a result, harmonizing SDTM datasets across studies is essential to enable efficient secondary use and accelerate evidence generation.To address these challenges, we introduce a framework that leverages Large Language Models (LLMs) to automate the harmonization of study-specific clinical trial data, available in CDISC Study Data Tabulation Model (SDTM) format, into data that is harmonized across trials at scale and also enables natural language querying via a text-to-SQL agent. This system transforms siloed study clinical datasets into interoperable, analysis-ready formats while empowering users to retrieve insights across trials without needing SQL or domain-specific schema knowledge. By constructing a semantic layer and applying retrieval-augmented prompting to models like GPT-4o, our approach improves data access, query accuracy, and scalability across use cases. This work demonstrates the potential of LLMs to transform clinical data workflows, cutting manual effort, substantially reducing manual harmonization effort and query latency in secondary analysis workflows, and enabling faster exploratory analysis and hypothesis generation in clinical research.",,foundation_model_agent,5.75,5.75,这篇工作偏基础模型/Agent方向，可能影响病原检测任务的建模上限，值得关注其任务定义与评测设计。,,foundation_model,10.64898/2026.03.04.26345603,,
Retrieval-Augmented Anatomical Guidance for Text-to-CT Generation,arXiv,2026-03-09T12:27:17+00:00,http://arxiv.org/abs/2603.08305v1,"Text-conditioned generative models for volumetric medical imaging provide semantic control but lack explicit anatomical guidance, often resulting in outputs that are spatially ambiguous or anatomically inconsistent. In contrast, structure-driven methods ensure strong anatomical consistency but typically assume access to ground-truth annotations, which are unavailable when the target image is to be synthesized. We propose a retrieval-augmented approach for Text-to-CT generation that integrates semantic and anatomical information under a realistic inference setting. Given a radiology report, our method retrieves a semantically related clinical case using a 3D vision-language encoder and leverages its associated anatomical annotation as a structural proxy. This proxy is injected into a text-conditioned latent diffusion model via a ControlNet branch, providing coarse anatomical guidance while maintaining semantic flexibility. Experiments on the CT-RATE dataset show that retrieval-augmented generation improves image fidelity and clinical consistency compared to text-only baselines, while additionally enabling explicit spatial controllability, a capability inherently absent in such approaches. Further analysis highlights the importance of retrieval quality, with semantically aligned proxies yielding consistent gains across all evaluation axes. This work introduces a principled and scalable mechanism to bridge semantic conditioning and anatomical plausibility in volumetric medical image synthesis. Code will be released.",,foundation_model_agent,5.75,5.75,这篇工作偏数据集或基准构建，适合判断是否能作为病原组学训练或评测资源。,,dataset,,2603.08305v1,
Epistemic Closure: Autonomous Mechanism Completion for Physically Consistent Simulation,arXiv,2026-03-10T14:56:36+00:00,http://arxiv.org/abs/2603.09756v1,"The integration of Large Language Models (LLMs) into scientific discovery is currently hindered by the Implicit Context problem, where governing equations extracted from literature contain invisible thermodynamic assumptions (e.g., undrained conditions) that standard generative models fail to recognize. This leads to Physical Hallucination: the generation of syntactically correct solvers that faithfully execute physically invalid laws. Here, we introduce a Neuro-Symbolic Generative Agent that functions as a cognitive supervisor atop traditional numerical engines. By encapsulating physical laws into modular Constitutive Skills and leveraging latent intrinsic priors, the Agent employs a Chain-of-Thought reasoning workflow to autonomously validate, prune, and complete physical mechanisms. We demonstrate this capability on the challenge of thermal pressurization in low-permeability sandstone. While a standard literature-retrieval baseline erroneously predicts catastrophic material failure by blindly adopting a rigid ""undrained"" simplification, our Agent autonomously identifies the system as operating in a drained regime (Deborah number De << 1) via dimensionless scaling analysis. Consequently, it inductively completes the missing dissipation mechanism (Darcy flow) required to satisfy boundary constraints, predicting a stable stress path consistent with experimental reality. This work establishes a paradigm where AI agents transcend the role of coding assistants to act as epistemic partners, capable of reasoning about and correcting the theoretical assumptions embedded in scientific data.",,foundation_model_agent,5.45,7.09,这篇工作偏基础模型/Agent方向，可能影响病原检测任务的建模上限，值得关注其任务定义与评测设计。,,foundation_model,,2603.09756v1,
Evaluation of LLMs in retrieving food and nutritional context for RAG systems,arXiv,2026-03-10T14:15:35+00:00,http://arxiv.org/abs/2603.09704v1,"In this article, we evaluate four Large Language Models (LLMs) and their effectiveness at retrieving data within a specialized Retrieval-Augmented Generation (RAG) system, using a comprehensive food composition database. Our method is focused on the LLMs ability to translate natural language queries into structured metadata filters, enabling efficient retrieval via a Chroma vector database. By achieving high accuracy in this critical retrieval step, we demonstrate that LLMs can serve as an accessible, high-performance tool, drastically reducing the manual effort and technical expertise previously required for domain experts, such as food compilers and nutritionists, to leverage complex food and nutrition data. However, despite the high performance on easy and moderately complex queries, our analysis of difficult questions reveals that reliable retrieval remains challenging when queries involve non-expressible constraints. These findings demonstrate that LLM-driven metadata filtering excels when constraints can be explicitly expressed, but struggles when queries exceed the representational scope of the metadata format.",,foundation_model_agent,5.45,6.98,这篇工作偏基础模型/Agent方向，可能影响病原检测任务的建模上限，值得关注其任务定义与评测设计。,,foundation_model,10.1109/bigdata66926.2025.11401545,2603.09704v1,
Enhancing Retrieval-Augmented Generation with Entity Linking for Educational Platforms,arXiv,2025-12-05T18:59:18+00:00,http://arxiv.org/abs/2512.05967v2,"In the era of Large Language Models (LLMs), Retrieval-Augmented Generation (RAG) architectures are gaining significant attention for their ability to ground language generation in reliable knowledge sources. Despite their effectiveness, RAG systems based solely on semantic similarity often fail to ensure factual accuracy in specialized domains, where terminological ambiguity can affect retrieval relevance. This study proposes ELERAG, an enhanced RAG architecture that integrates a factual signal derived from Entity Linking to improve the accuracy of educational question-answering systems in Italian. The system includes a Wikidata-based Entity Linking module and implements a hybrid re-ranking strategy based on Reciprocal Rank Fusion (RRF). To validate our approach, we compared it against standard baselines and state-of-the-art methods, including a Weighted-Score Re-ranking, a standalone Cross-Encoder and a combined RRF+Cross-Encoder pipeline. Experiments were conducted on two benchmarks: a custom academic dataset and the standard SQuAD-it dataset. Results show that, in domain-specific contexts, ELERAG significantly outperforms both the baseline and the Cross-Encoder configurations. Conversely, the Cross-Encoder approaches achieve the best results on the general-domain dataset. These findings provide strong experimental evidence of the domain mismatch effect, highlighting the importance of domain-adapted hybrid strategies to enhance factual precision in educational RAG systems without relying on computationally expensive models trained on disparate data distributions. They also demonstrate the potential of entity-aware RAG systems in educational environments, fostering adaptive and reliable AI-based tutoring tools.",,foundation_model_agent,5.45,6.5,这篇工作更像方法创新，可能直接关联 metagenomics、long-read 或 pathogen identification 流程优化。,,methods,,2512.05967v2,
Towards Robust Retrieval-Augmented Generation Based on Knowledge Graph: A Comparative Analysis,arXiv,2026-03-05T21:43:53+00:00,http://arxiv.org/abs/2603.05698v2,"Retrieval-Augmented Generation (RAG) was introduced to enhance the capabilities of Large Language Models (LLMs) beyond their encoded prior knowledge. This is achieved by providing LLMs with an external source of knowledge, which helps reduce factual hallucinations and enables access to new information not available during pretraining. However, inconsistent retrieved information can negatively affect LLM responses. The Retrieval-Augmented Generation Benchmark (RGB) was introduced to evaluate the robustness of RAG systems under such conditions. In this work, we use the RGB corpus to evaluate LLMs in four scenarios: noise robustness, information integration, negative rejection, and counterfactual robustness. We perform a comparative analysis between the RGB RAG baseline and GraphRAG, a knowledge graph based retrieval system. We test three GraphRAG customizations to improve robustness. Results show improvements over the RGB baseline and provide insights for designing more reliable RAG systems for real world scenarios.",,foundation_model_agent,5.45,6.0,这篇工作偏基础模型/Agent方向，可能影响病原检测任务的建模上限，值得关注其任务定义与评测设计。,,foundation_model,10.1109/smc58881.2025.11343466,2603.05698v2,
RexDrug: Reliable Multi-Drug Combination Extraction through Reasoning-Enhanced LLMs,arXiv,2026-03-09T09:47:25+00:00,http://arxiv.org/abs/2603.08166v1,"Automated Drug Combination Extraction (DCE) from large-scale biomedical literature is crucial for advancing precision medicine and pharmacological research. However, existing relation extraction methods primarily focus on binary interactions and struggle to model variable-length n-ary drug combinations, where complex compatibility logic and distributed evidence need to be considered. To address these limitations, we propose RexDrug, an end-to-end reasoning-enhanced relation extraction framework for n-ary drug combination extraction based on large language models. RexDrug adopts a two-stage training strategy. First, a multi-agent collaborative mechanism is utilized to automatically generate high-quality expert-like reasoning traces for supervised fine-tuning. Second, reinforcement learning with a multi-dimensional reward function specifically tailored for DCE is applied to further refine reasoning quality and extraction accuracy. Extensive experiments on the DrugComb dataset show that RexDrug consistently outperforms state-of-the-art baselines for n-ary extraction. Additional evaluation on the DDI13 corpus confirms its generalizability to binary drugdrug interaction tasks. Human expert assessment and automatic reasoning metrics further indicates that RexDrug produces coherent medical reasoning while accurately identifying complex therapeutic regimens. These results establish RexDrug as a scalable and reliable solution for complex biomedical relation extraction from unstructured text. The source code and data are available at https://github.com/DUTIR-BioNLP/RexDrug",,foundation_model_agent,5.45,6.0,这篇工作偏数据集或基准构建，适合判断是否能作为病原组学训练或评测资源。,,dataset,,2603.08166v1,
SPD-RAG: Sub-Agent Per Document Retrieval-Augmented Generation,arXiv,2026-03-09T12:46:32+00:00,http://arxiv.org/abs/2603.08329v1,"Answering complex, real-world queries often requires synthesizing facts scattered across vast document corpora. In these settings, standard retrieval-augmented generation (RAG) pipelines suffer from incomplete evidence coverage, while long-context large language models (LLMs) struggle to reason reliably over massive inputs. We introduce SPD-RAG, a hierarchical multi-agent framework for exhaustive cross-document question answering that decomposes the problem along the document axis. Each document is processed by a dedicated document-level agent operating only on its own content, enabling focused retrieval, while a coordinator dispatches tasks to relevant agents and aggregates their partial answers. Agent outputs are synthesized by merging partial answers through a token-bounded synthesis layer (which supports recursive map-reduce for massive corpora). This document-level specialization with centralized fusion improves scalability and answer quality in heterogeneous multidocument settings while yielding a modular, extensible retrieval pipeline. On the LOONG benchmark (EMNLP 2024) for long-context multi-document QA, SPD-RAG achieves an Avg Score of 58.1 (GPT-5 evaluation), outperforming Normal RAG (33.0) and Agentic RAG (32.8) while using only 38% of the API cost of a full-context baseline (68.0).",,foundation_model_agent,5.45,6.0,这篇工作更像方法创新，可能直接关联 metagenomics、long-read 或 pathogen identification 流程优化。,,methods,,2603.08329v1,
InterMind: Doctor-Patient-Family Interactive Depression Assessment Empowered by Large Language Models,arXiv,2024-09-23T10:23:19+00:00,http://arxiv.org/abs/2409.14878v2,"Depression poses significant challenges to patients and healthcare organizations, necessitating efficient assessment methods. Existing paradigms typically focus on a patient-doctor way that overlooks multi-role interactions, such as family involvement in the evaluation and caregiving process. Moreover, current automatic depression detection (ADD) methods usually model depression detection as a classification or regression task, lacking interpretability for the decision-making process. To address these issues, we developed InterMind, a doctor-patient-family interactive depression assessment system empowered by large language models (LLMs). Our system enables patients and families to contribute descriptions, generates assistive diagnostic reports for doctors, and provides actionable insights, improving diagnostic precision and efficiency. To enhance LLMs' performance in psychological counseling and diagnostic interpretability, we integrate retrieval-augmented generation (RAG) and chain-of-thoughts (CoT) techniques for data augmentation, which mitigates the hallucination issue of LLMs in specific scenarios after instruction fine-tuning. Quantitative experiments and professional assessments by clinicians validate the effectiveness of our system.",,foundation_model_agent,5.45,5.5,这篇工作更接近临床/监测落地，适合评估其对快速识别、预警或治疗辅助的实际价值。,,clinical_application,,2409.14878v2,
EvoScientist: Towards Multi-Agent Evolving AI Scientists for End-to-End Scientific Discovery,arXiv,2026-03-09T09:07:19+00:00,http://arxiv.org/abs/2603.08127v1,"The increasing adoption of Large Language Models (LLMs) has enabled AI scientists to perform complex end-to-end scientific discovery tasks requiring coordination of specialized roles, including idea generation and experimental execution. However, most state-of-the-art AI scientist systems rely on static, hand-designed pipelines and fail to adapt based on accumulated interaction histories. As a result, these systems overlook promising research directions, repeat failed experiments, and pursue infeasible ideas. To address this, we introduce EvoScientist, an evolving multi-agent AI scientist framework that continuously improves research strategies through persistent memory and self-evolution. EvoScientist comprises three specialized agents: a Researcher Agent (RA) for scientific idea generation, an Engineer Agent (EA) for experiment implementation and execution, and an Evolution Manager Agent (EMA) that distills insights from prior interactions into reusable knowledge. EvoScientist contains two persistent memory modules: (i) an ideation memory, which summarizes feasible research directions from top-ranked ideas while recording previously unsuccessful directions; and (ii) an experimentation memory, which captures effective data processing and model training strategies derived from code search trajectories and best-performing implementations. These modules enable the RA and EA to retrieve relevant prior strategies, improving idea quality and code execution success rates over time. Experiments show that EvoScientist outperforms 7 open-source and commercial state-of-the-art systems in scientific idea generation, achieving higher novelty, feasibility, relevance, and clarity via automatic and human evaluation. EvoScientist also substantially improves code execution success rates through multi-agent evolution, demonstrating persistent memory's effectiveness for end-to-end scientific discovery.",,foundation_model_agent,5.45,5.5,这篇工作偏基础模型/Agent方向，可能影响病原检测任务的建模上限，值得关注其任务定义与评测设计。,,foundation_model,,2603.08127v1,
TaSR-RAG: Taxonomy-guided Structured Reasoning for Retrieval-Augmented Generation,arXiv,2026-03-10T08:16:36+00:00,http://arxiv.org/abs/2603.09341v1,"Retrieval-Augmented Generation (RAG) helps large language models (LLMs) answer knowledge-intensive and time-sensitive questions by conditioning generation on external evidence. However, most RAG systems still retrieve unstructured chunks and rely on one-shot generation, which often yields redundant context, low information density, and brittle multi-hop reasoning. While structured RAG pipelines can improve grounding, they typically require costly and error-prone graph construction or impose rigid entity-centric structures that do not align with the query's reasoning chain. We propose \textsc{TaSR-RAG}, a taxonomy-guided structured reasoning framework for evidence selection. We represent both queries and documents as relational triples, and constrain entity semantics with a lightweight two-level taxonomy to balance generalization and precision. Given a complex question, \textsc{TaSR-RAG} decomposes it into an ordered sequence of triple sub-queries with explicit latent variables, then performs step-wise evidence selection via hybrid triple matching that combines semantic similarity over raw triples with structural consistency over typed triples. By maintaining an explicit entity binding table across steps, \textsc{TaSR-RAG} resolves intermediate variables and reduces entity conflation without explicit graph construction or exhaustive search. Experiments on multiple multi-hop question answering benchmarks show that \textsc{TaSR-RAG} consistently outperforms strong RAG and structured-RAG baselines by up to 14\%, while producing clearer evidence attribution and more faithful reasoning traces.",,foundation_model_agent,4.75,6.23,这篇工作更像方法创新，可能直接关联 metagenomics、long-read 或 pathogen identification 流程优化。,,methods,,2603.09341v1,
Beyond Relevance: On the Relationship Between Retrieval and RAG Information Coverage,arXiv,2026-03-09T18:20:20+00:00,http://arxiv.org/abs/2603.08819v1,"Retrieval-augmented generation (RAG) systems combine document retrieval with a generative model to address complex information seeking tasks like report generation. While the relationship between retrieval quality and generation effectiveness seems intuitive, it has not been systematically studied. We investigate whether upstream retrieval metrics can serve as reliable early indicators of the final generated response's information coverage. Through experiments across two text RAG benchmarks (TREC NeuCLIR 2024 and TREC RAG 2024) and one multimodal benchmark (WikiVideo), we analyze 15 text retrieval stacks and 10 multimodal retrieval stacks across four RAG pipelines and multiple evaluation frameworks (Auto-ARGUE and MiRAGE). Our findings demonstrate strong correlations between coverage-based retrieval metrics and nugget coverage in generated responses at both topic and system levels. This relationship holds most strongly when retrieval objectives align with generation goals, though more complex iterative RAG pipelines can partially decouple generation quality from retrieval effectiveness. These findings provide empirical support for using retrieval metrics as proxies for RAG performance.",,foundation_model_agent,3.45,6.25,这篇工作偏基础模型/Agent方向，可能影响病原检测任务的建模上限，值得关注其任务定义与评测设计。,,foundation_model,,2603.08819v1,
Amortized Phylodynamic Inference with Neural Bayes Estimators and Recursive Neural Networks,arXiv,2026-03-09T13:07:01+00:00,http://arxiv.org/abs/2603.08345v1,"Phylodynamics is used to estimate epidemic dynamics from phylogenetic trees or genomic sequences of pathogens, but the likelihood calculations needed can be challenging for complex models. We present a neural Bayes estimator (NBE) for key epidemic quantities: the reproduction number, prevalence, and cumulative infections through time. By performing quantile regression over tree space, the NBE allows us to estimate posterior medians and credible intervals directly from a reconstructed tree. Our approach uses a recursive neural network as a tree embedding network with a prediction network conditioned on time and quantile level to generate the estimates. In simulation studies, the NBE achieves good predictive performance, with conservative uncertainty estimates. Compared with a BEAST2 fixed-tree analysis, the NBE gives less biased estimates of time-varying reproduction numbers in our test setting. Under a misspecified sampling model, the NBE performance degrades (as expected) but remains reasonable, and fine-tuning a pre-trained model yields estimates comparable to those from a model trained from scratch, at substantially lower computational cost.",,sequencing_bioinformatics,2.6,5.25,这篇工作更像方法创新，可能直接关联 metagenomics、long-read 或 pathogen identification 流程优化。,,methods,,2603.08345v1,
AutoAgent: Evolving Cognition and Elastic Memory Orchestration for Adaptive Agents,arXiv,2026-03-10T14:23:49+00:00,http://arxiv.org/abs/2603.09716v1,"Autonomous agent frameworks still struggle to reconcile long-term experiential learning with real-time, context-sensitive decision-making. In practice, this gap appears as static cognition, rigid workflow dependence, and inefficient context usage, which jointly limit adaptability in open-ended and non-stationary environments. To address these limitations, we present AutoAgent, a self-evolving multi-agent framework built on three tightly coupled components: evolving cognition, on-the-fly contextual decision-making, and elastic memory orchestration. At the core of AutoAgent, each agent maintains structured prompt-level cognition over tools, self-capabilities, peer expertise, and task knowledge. During execution, this cognition is combined with live task context to select actions from a unified space that includes tool calls, LLM-based generation, and inter-agent requests. To support efficient long-horizon reasoning, an Elastic Memory Orchestrator dynamically organizes interaction history by preserving raw records, compressing redundant trajectories, and constructing reusable episodic abstractions, thereby reducing token overhead while retaining decision-critical evidence. These components are integrated through a closed-loop cognitive evolution process that aligns intended actions with observed outcomes to continuously update cognition and expand reusable skills, without external retraining. Empirical results across retrieval-augmented reasoning, tool-augmented agent benchmarks, and embodied task environments show that AutoAgent consistently improves task success, tool-use efficiency, and collaborative robustness over static and memory-augmented baselines. Overall, AutoAgent provides a unified and practical foundation for adaptive autonomous agents that must learn from experience while making reliable context-aware decisions in dynamic environments.",,,2.1,7.75,这篇工作偏基础模型/Agent方向，可能影响病原检测任务的建模上限，值得关注其任务定义与评测设计。,,foundation_model,,2603.09716v1,
